レビューID,施設ID,施設GID,レビュワー評価,レビュワー名,レビュー日時,レビュー本文,レビュー要約,レビューGID
353,202462,ChIJXTnmOycz-F8RWr5UPCYbhno,5,澁谷浩,2026-02-01T04:05:05.363Z,とても素敵な女性に巡り会えました。,,Ci9DQUlRQUNvZENodHljRjlvT2pWTlNFVTBSbE13UzJKdVdEVkZObXBSVVZaTlZYYxAB
354,202462,ChIJXTnmOycz-F8RWr5UPCYbhno,5,もふ,2026-01-30T10:10:41.355Z,"お話をきいていただきまして
ありがとうございました。",,Ci9DQUlRQUNvZENodHljRjlvT25SMWRteGxhRVZMUW0xWFRWWkZjVmM1VmsxU1puYxAB
355,201749,ChIJkdoApOFdGGARHUv8FdRk9iA,5,A,2026-02-03T12:43:03.008Z,"今まで恋愛とか女性との付き合いをしてこなかったので女性とどう接していけばいいか、会話の進め方が分からないという悩みがあり結婚に前向きではない自分がおりましたが、一度きりの人生だから始めてみようよという面談時の後押しもあり入会しました。
お見合いの数はまだ少ないですが、面談やお見合いで徐々に成長している自分を実感できており、手厚いサポートに感謝しております。",,Ci9DQUlRQUNvZENodHljRjlvT214MlZFTmtObEJVYkU0d1kzazJXazFhZG14RFpuYxAB
356,201749,ChIJkdoApOFdGGARHUv8FdRk9iA,5,TAKU,2026-01-31T22:34:26.524Z,"ここで素敵なお相手と出会えました😊
カウンセラーの方にも親身に相談に乗ってもらい、非常に助かりました♪",,Ci9DQUlRQUNvZENodHljRjlvT210SmQzUlJSa3MxVkRsWVJ6Vm1jWEJKTUROUGRVRRAB
357,201749,ChIJkdoApOFdGGARHUv8FdRk9iA,4,Yusuke Higashi,2026-01-31T05:51:56.750Z,"とても話しやすく。
忙しい状態でも声をかけて頂いて、安心して少しずつでも進めています。",,Ci9DQUlRQUNvZENodHljRjlvT2xaRE1teFBiRnBxWDBaS1owTm9NUzFyTjNaMmRGRRAB
358,201338,ChIJmRd0DADjAGARZQcT7eXunNs,5,h s,2026-01-28T12:36:13.554Z,"今月入会させていただきました。
相談所についてほとんど知識がないまま無料相談に臨んだのですが、こちらの疑問にも丁寧に答えてくださり、安心感を覚えました。
いざ入会しプロフィール写真撮影に同行していただいた時には、緊張感も和らぎ、リラックスしながら撮影してもらうことができました。終始丁寧にご対応してくださるので漠然と色々な不安がある方におすすめの相談所さんです。",,Ci9DQUlRQUNvZENodHljRjlvT210M2VXVXlSMFl4V0doWlNFVlRaVlJxVEdWMVNtYxAB
359,201213,ChIJdzgnU_gNImAR9nx0aS9skhQ,5,SoyOe,2026-01-27T13:24:00.786Z,"他の相談所で活動し色々あり、ようやく気持ちが落ち着いてきたので再度活動しようと思い口コミやHPを読んで親身に話を聞いてくださいそうな印象でしたので無料相談に申し込みました。
以前のところは個人で女性の方が担当でしたが、早口で常に忙しそうな雰囲気を感じ自分の性格もあり上手く相談できずほぼ1人で活動していました。大田様は写真のまま物腰柔らかで話すスピードも聞き取りやすく、とても丁寧に話しを聞いて下さいました。
以前他で活動していた事もあり具体的な会員の方へどういったアドバイス等しているかなど聞け、終始会員の方を想って活動されている印象を受け、他で上手く相談できなかった自分も大田様なら色々相談できるかもと思いました。
相談所はハードルが高いイメージがある方もいると思いますが、自分は今回話を聞けて前向きになれましたので悩んでいる方は一度話しを聞いてもいいと思います。",,Ci9DQUlRQUNvZENodHljRjlvT2xOaFFqazVTbkJOUjJKbFZXdGlRV3hYT1RoVE9VRRAB
360,201359,ChIJrY8WEuKHHWARznUQg7OzZk8,5,やまへい,2026-01-28T15:13:39.417Z,"まだ活動前ですが、何回も面談を重ね、わからないことなど細やかにサポ－トしてくれます。私自身婚活歴が長く、いくつかの結婚相談所を経験していますが、ここまで丁寧に対応してくれるところは他にないと思います。

２月より本格的に活動を始めますが、良いご縁に恵まれることを期待し、頑張っていきたいと思います。今後ともよろしくお願いいたします。",,Ci9DQUlRQUNvZENodHljRjlvT2sxU1pETTRRbHBxYjI5Nk0ydFpURXhxTjB4cVpFRRAB
361,203472,ChIJ-Vku9eQPHWARZv8RClQL7_4,5,Takashi T,2026-01-31T09:25:53.061Z,娘がお世話になりました。上田さんには本当に感謝しています、ありがとうございました。年末にお相手からプロポーズされ、今、結婚に向けて２人で準備しています。楽しそうです！,,Ci9DQUlRQUNvZENodHljRjlvT25sbmJFaHhZV3h3V0MxMWVpMHplWFJDZFc5cVkzYxAB
362,202693,ChIJaZ2OttNcH2ARRMgwcqMZJ7U,5,らら,2026-01-28T09:26:41.597Z,"他の相談所で5年ほど活動していましたが、なかなか上手くいかず、正直「もう無理かも」と思っていました。
それでも最後にもう一度だけ頑張ってみようと思い、こちらの相談所に入会しました。
結果的に、活動を始めてから約1年で成婚退会することができました。
同じ結婚相談所でも、会員数やサポートの仕方でここまで違うのかと身をもって実感しています。
活動中は、迷った時や気持ちが落ちた時にも、その都度丁寧に話を聞いていただき、自分一人では整理できなかった気持ちを一緒に考えてくださいました。
鈴木さんのところで活動できて本当に良かったです。
大変お世話になりました。ありがとうございました。",,Ci9DQUlRQUNvZENodHljRjlvT2tkRWIzRmZUMGhNU2s1a1lYWlJTR1JoTTFoNU1tYxAB
363,201253,ChIJt4BD15EJAWARcoM42MA54to,5,miya,2026-02-02T15:23:55.483Z,"これまで異性と全く関りがない中、それでも温かい家庭を築きたいと思い相談所をいろいろと調べたところサニーソウマリッジさんのサポート体制が充実している点が自分にはあっていると感じ入会しました。
活動開始前に買い物同行や美容院の選定、髪型の提案、そして活動写真に関しても撮影後一緒に考えていただけたことで素敵なプロフィール写真で活動を開始できました。
予想よりも多くの素敵な方からの申し受けをいただきうれしく思いつつも「ここからがスタート」と思い気を引き締めて活動していきたいです。
わからないこともたくさん聞いてしまっているのですが担当の方が丁寧に答えてくださるのでとても心強いです。
まだ活動開始して間もないですが、素敵な結婚生活を目指して努力を続けていきたいです。",,Ci9DQUlRQUNvZENodHljRjlvT2pCa05HNVJNVWt5U2pkSldWUklXVnA2VEhkbFlYYxAB
364,200807,ChIJ8Vdgr6loCgQRgKR6573QMTM,5,T Y,2026-01-29T06:07:02.037Z,"婚活でサポートして頂いたお陰で、成婚出来ました!

ありがとうございました!",,Ci9DQUlRQUNvZENodHljRjlvT204eVFqSjNhVTFsY0haS01UVnRSMUphVWxoV2JuYxAB
365,201153,ChIJWxE_gnjTEgcRu2lLl9BOgLI,5,中村ゆうき（ゆーき）,2026-01-31T12:21:02.413Z,とても優しく丁寧に対応してくださりました。素敵な方と出会えたのでオススメします✨,,Ci9DQUlRQUNvZENodHljRjlvT2taZmRsOVBhVXRmZVdVNU0wbDZiR2hCYVdGbmFYYxAB
366,202114,ChIJUemyeospil8ReOzgzc6Xcuk,5,kakuni,2026-02-04T15:31:49.647Z,"先日、約1年ちょっとの活動の末、素敵なご縁があり成婚退会させていただきました。

数年前から周囲が結婚または婚活を行い始めていたこともあり、また自身も多少なりとも願望があったため独自に活動をおこないましたが、うまく結果を出せずにいました。

思い悩んだ末、「異性との付き合い自体が不慣れということもあり、サポートが必要だと感じた」事や、「ちゃんとお金を支払って活動することで、もしうまくいかなくても自分を納得させたかった」等々の思いがあり、相談所を検討することとしました。

相談所を選ぶにあたり色々調べたところ、入会金や月額費が他所と比較してハードルが低い事、お見合いにも手数料が掛からないこと、直接お伺いし、ご担当者様のお話をお聞きし、入会することを決意しました。

その後、初めてお見合いを行う際やうまく活動がいかず休会を考えていた際も親身に寄り添って頂き、なんやかんやで活動を続けていく事が出来ました。

そうしていく中で、とても気があう方と出会う事が出来、その後はあっという間に仮交際→真剣交際、そして先日プロポーズを行い婚約に至りました。

結婚相談所をご検討されている方、一度ご相談してみてはいかがでしょうか。",,Ci9DQUlRQUNvZENodHljRjlvT210RGQzWndTSHBoZGpSWU9HWjBUbUZ1ZUZCT01sRRAB
367,201442,ChIJOYJJDhhJFUwRAP5Got8P5s0,5,Hana “mofu”,2026-02-05T00:07:54.212Z,"結婚相談所は身分のしっかりした人を紹介してくれるので、年頃の娘を持つ親として相談しました。
新田さんは、とても気さくで明るく笑顔が素敵な女性です。子育てを経験した同世代の母として、何でも話しやすく信頼できるカウンセラーさんだと思います。",,Ci9DQUlRQUNvZENodHljRjlvT25rdFpqWldORGRUYjFnNFNYZGZXbTR0YzJzdFNIYxAB
368,202026,ChIJS9GuMV_5GGARmct4SzeGS4o,5,Y,2026-02-01T01:26:42.293Z,"結婚相談所は少し敷居が高いイメージがありましたが、素敵な人と出会えたらと思い入会いたしました。

婚活を始めて、上手くいかず落ち込むことも多いですが、自分自身を見つめ直すいい機会にもなっています。
タエさんは明るく気さくで、親身に相談にのってくださり、とても心強い存在です。
自信がなくなかなか進めない時に、優しく寄り添い、時にはお世辞なくストレートに伝えてくださり、タエさんのおかげで前向きに考えよう、頑張ろうと思えます。

タエさん、いつもありがとうございます。
今後も色々とご相談させていただくこともあるかと思いますが、どうぞよろしくお願いいたします。",,Ci9DQUlRQUNvZENodHljRjlvT25NMldIbDZURTVDUTJZelZXRTNTSEJCVlRsWlJIYxAB
369,201456,ChIJf_eGrwz0QDURTU4lXCjoopw,5,wk,2026-01-28T12:22:48.983Z,"本日成婚退会しました。
活動中、私に結婚は無理かも…と退会も考えたのですが、カウンセラーさんが親身に励ましてくださり、もう少し頑張ってみよう！と思ってお見合いを申し込んだ方と結婚が決まりました。今とっても幸せで、あの時諦めないで本当によかったです…！
植本さん、若林さん、素敵なご縁を繋いでくださり本当にありがとうございました♡",,Ci9DQUlRQUNvZENodHljRjlvT2pSak5uWkJZMXBWU2xabVpHRXphVGMzTjNaYVNXYxAB
370,202106,ChIJGaxF2HyY3moR-Iqw764ZsKA,5,ナミー,2026-02-01T09:36:35.495Z,"アドバイザーの方が話しやすく、雑談を交えながらリラックスして相談できています。自分一人で悩んでいるタイミングで、アドバイザーの方からも状況確認の連絡をくださるなど、いつも親切かつ丁寧なサポートを受けています。

特に、プロフィールのアドバイザーさんからのPRでは、自分の魅力やお相手が気になりそうなポイントを的確に補足してくださいました。お見合いの席でその内容をきっかけに話が弾むことも多く、感謝しています。",,Ci9DQUlRQUNvZENodHljRjlvT2tOelRqRlhTRXB1VUdWZlMzVkZjemxTWTI0d1puYxAB
371,202021,ChIJQesmT-gBAywRTj0wPWGksic,5,もりゆ,2026-01-31T09:23:18.314Z,無事成婚しました。大変お世話になり、ありがとうございました。,,Ci9DQUlRQUNvZENodHljRjlvT25sQmVuaHFWRzV2YTNsVVRHbFBhM3AwZVRGUFQyYxAB
372,202019,ChIJZWUnczONGGARYIZZqq9CsvE,5,Ok Tam,2026-02-01T01:16:51.154Z,"50代女おたくでも入会していいのかな
将来支えあえるひとを探したい",,Ci9DQUlRQUNvZENodHljRjlvT21WTFUyNTFhWGhvVUZCMmExRnhRVkJwVGxWVlZsRRAB
373,201779,ChIJAb7P9db3GGAROKga6C73HKQ,5,おはな,2026-02-06T04:51:37.686Z,"婚活を始めるのは正直とても不安でしたが、こちらに入会してからは安心して活動ができています。
いつも優しく、そして親身になって相談に乗ってくださるカウンセラーさんの存在は本当に心強いです。
メールや電話で気軽にやり取りができるのもありがたく、面談では一緒にお見合いのシミュレーションまでしてもらえて、自信にもつながっています。
婚活はひとりで頑張るものだと思っていましたが、今は「寄り添ってくれる人がいる」という安心感の中で前向きに、そして楽しく活動できています。",,Ci9DQUlRQUNvZENodHljRjlvT2xKalVGSkpkRTlsUTBsemREazFNUzB6Y3pJd1drRRAB
374,202747,ChIJ7xbJABuRQTURB6yWqTh7dKo,5,UD,2026-01-31T14:44:30.591Z,"まだ入会して2週間ほどですが、すでに2人の方とお見合いをさせていただき、1人の方とは仮交際まで進むことができました。
担当の水城さんのご紹介のおかげもあり、まだ4人の方とのお見合いも控えております。
正直最初から順調過ぎて逆に怖くもありますが、これから出会う方々一人一人と真摯に向き合い、最高のパートナーを見つけたいと思っております。
入会してまだ日が浅い現時点でも実感できるほど手厚いサポートとなんでも相談しやすい雰囲気がU＆C様にはあります。
もし結婚相談所で迷われている方は是非一度お話を聞いてみるだけでも損はないと思います！",,Ci9DQUlRQUNvZENodHljRjlvT2s0M1RsSnBaMk5vVFRBMGN6aGZOWEpFWDI5aVZrRRAB
375,203304,ChIJQd4l1MJJGmART2N1uhYgCX0,5,まる,2026-01-29T06:24:33.070Z,"成婚まで親身になって相談に乗っていただき、ありがとうございました！
挫けそうな時も的確にアドバイスをいただき、助かりました！

婚活だけじゃなく個人的な趣味の部分も踏まえて色々話せてお会いすることができて良かったです！
成婚までありがとうございました😊",,Ci9DQUlRQUNvZENodHljRjlvT2xZemVGaE5Wazl4TTNsTFdIZG1SbDkxWWtoME5rRRAB
376,201509,ChIJHcMMCjWXRDURtWz7UTmvwM4,5,t s,2026-02-01T10:41:02.404Z,"Vive la Vie 平本さんには、常日頃からとてもお世話になっています。
お話させていただくなかで、とても華やかで、楽しくて。前向きなアドバイスも的確にしてくださいます。

「この方に相談したい！」「この方なら任せられる！」と自然に思えるとってもステキなカウンセラーさんです。

結婚相談所を探している方には、心からおすすめしたい方です。",,Ci9DQUlRQUNvZENodHljRjlvT2taTmRuRnpUREZ0TUhZd2NFSkNSV0YxVG0xSlduYxAB
377,201509,ChIJHcMMCjWXRDURtWz7UTmvwM4,5,こうじ,2026-02-01T02:38:11.524Z,"ヴィブラヴィさんには口コミが良かったのもありまして、お電話差し上げたところカウンセラーの平本さんがうけていただき親身になって話しを聞いていただきました。
お伺いした時も色々私の長所である部分を褒めていただいたり、直したほうがいいところも丁寧にご指導もいただけました。
そこが入会するきっかけとなりました。
入会する際も美容院や写真の段取りをスムーズに取り付けて頂きました。
すごく応援してもらっているなと実感しました。成婚の実現に向けて短所の部分など改善するきっかけになっております。
平本さんには婚活をするにあたって勉強させていただいております。
成婚する頃にはプラスアルファで人間的にも成長できている様な気がしています。",,Ci9DQUlRQUNvZENodHljRjlvT25KT1RXNTNZVE5uUWxKU0xWVk9RVUZQVVhvelZWRRAB
378,201085,ChIJg8wHq2cdAWARXzhdfo2RgPM,5,k i,2026-02-02T14:37:48.715Z,"入会前の無料カウンセリングから
丁寧かつ的確に説明していただき
今後するべきことが、具体的にイメージできました。
連絡の返信も早く、心強く感じています。
これから安心して活動できそうです。",,Ci9DQUlRQUNvZENodHljRjlvT25aWFFWZDVaVkZDVXpoU01HaHVRMHRMU1dSbVduYxAB
379,203480,ChIJP8hSuMjEECIR6srvqF-5Uyo,5,みき,2026-02-06T16:42:20.937Z,"2月から活動を開始します。
いくつかの相談所を検討した上で、コストとサポート内容を比較して、どちらも満足できそうなこちらの相談所で活動することに決めました。

相談所の雰囲気としては、昔ながらのというよりかは、すべてオンライン完結、LINEで相談可など今風の感じなので、そちらの方が合う方にはいいと思います。

リーズナブルな分どこまでサポートしてもらえるか不安に思っていましたが、プロフィール公開前の面談を通じて、しっかりサポートしてもらえそうだと思えて安心しました。

また、面談後なるべく早く活動を開始したい旨お伝えしたところ、担当の方がPR文の作成やシステムへの反映等大変速やかに動いてくださり、ありがたかったです。

初めての相談所で不安もありますが、後悔しないように積極的に活動できればと思っています。",,Ci9DQUlRQUNvZENodHljRjlvT25sa1MxSklUVkZsUTJ4b1ZFUkhRakpJTFRVMlpVRRAB
380,203480,ChIJP8hSuMjEECIR6srvqF-5Uyo,5,Ki Ie,2026-02-05T11:26:29.199Z,"結婚相談所は高いところが多いですが、こちらはリーズナブルな価格設定でチャレンジしやすいことが決め手でした。
申し込みからネット全て完結のため、個人情報の扱いだけが気になり質問したところ、しっかり管理されている旨の回答をいただき安心いたしました。
また婚活するのに不安な点があり、LINEで聞いたところ優しくアドバイスいただき、不安感が少し和らぎました。
これから活動が始まるので、まだどうなるか分からないですが良いご縁があったら嬉しいです。",,Ci9DQUlRQUNvZENodHljRjlvT210aVZFZHphVVJGY0ZBMlNIbG5lR3ByTnpBME5GRRAB
381,203480,ChIJP8hSuMjEECIR6srvqF-5Uyo,3,吉田りょう,2026-02-03T16:37:34.860Z,"費用が安いのでテンプレでの対応がほとんどなのは仕方がないのですが、コミュニケーションの取り方において、不安に思う点があります。
基本的に日時調整のみをやってくれると考えるのが良いかと思います。",,Ci9DQUlRQUNvZENodHljRjlvT21OdldGUnZSRVZmWWxOVFdrcFJaWHBtY0daV1lXYxAB
382,203480,ChIJP8hSuMjEECIR6srvqF-5Uyo,5,Kuyu,2026-01-31T10:28:21.362Z,"色々相談に乗らせてもらっております。
まだまだ難しいところもありますが、
必ず結婚できるようにしますので、これからも支援よろしくお願いします",,Ci9DQUlRQUNvZENodHljRjlvT2xsbFJVUkJaRmhpZFhkMFIwWlRXWFl4YmpOTFJsRRAB
383,203480,ChIJP8hSuMjEECIR6srvqF-5Uyo,5,チョココルネ,2026-01-31T02:56:42.354Z,担当者の方が丁寧に説明してくださり、安心して入会できました。,,Ci9DQUlRQUNvZENodHljRjlvT2tseFV6UlNhMFpmT1V4bmJGZFdjVVZoYkdSUmJXYxAB
384,202385,ChIJueftp6OJGGARHYCEVZij7zw,5,m t,2026-02-03T11:58:31.732Z,"【追記】
この度無事成婚退会しました。9ヶ月間本当にお世話になりました。
面談以外の時間でも、私が悩んだ時にはすぐにLINEや電話で相談に乗ってくださり、花泉さんのおかげで最初から最後まで前向きな気持ちで活動を続けることができました。
居酒屋での面談もとても楽しかったです！ありがとうございました。

【2025年5月投稿】
近隣で結婚相談所を探していたところ、こちらを見つけました。面談が居酒屋で行われることもあると知り、結婚相談所のお堅そうなイメージが覆されたことがきっかけで無料相談を申し込みました。
実際にお会いした花泉さんはとても楽しく温かい雰囲気の方で、この方となら前向きな気持ちで婚活ができそうだと感じました。無理な勧誘は一切なく、安心してお話を伺うことができました。何よりも、「婚活は自分と向き合うこと」とおっしゃっていただいたお言葉に共感できたことが入会の決め手になりました。
活動を始めたばかりですが、手厚いサポートのおかげで不安なく準備を進められました。これからもよろしくお願いします。",,ChdDSUhNMG9nS0VJQ0FnTUNZdnNtTDlnRRAB
385,201115,ChIJtxBfM6hxA2ARyajGpPiIj_c,4,小出小出,2026-01-31T02:06:02.159Z,"始めちゃいました、、
いい出会いに巡り会えるかは自分次第ですが
仲人の方は、頼りになる素敵な方で驚きましたー‼️
勝手なイメージで、落ち着いた丁寧な方をイメージしていましたが、
仲人の方は、元々スポーツマンで活力溢れる魅力的な人でした🏃‍➡️
一番印象に残ったのは
『結婚相手を見つける時間が、どんなに大切か』を自分に合わせて教えていただきました。
この方なら、頑張って結婚相手を見つけられそうと思い入会しました😌
今日から頑張ります🫡",,Ci9DQUlRQUNvZENodHljRjlvT25aVE1sZDBUME5VVTB4TlZGUm9RekZaU2xjeU0yYxAB
386,201115,ChIJtxBfM6hxA2ARyajGpPiIj_c,5,石川友香,2026-01-27T12:10:01.539Z,青山先生とお話しさせていただくと元気になれます！なにを話しても大きく優しく受け止めてくださるので安心できます。青山先生となら頑張れる！って思わせてくれます！これからもよろしくお願いいたします。,,Ci9DQUlRQUNvZENodHljRjlvT2tSUlgwbHVSRzkxWVVORloxcE1NMVJ0U1Y5QlNrRRAB
387,201115,ChIJtxBfM6hxA2ARyajGpPiIj_c,5,石井理一,2026-01-27T08:35:23.556Z,"青山くん、がんばれー😊
やっぱ君ならやってくれると思ってた‼️これからも応援してるよ📣",,Ci9DQUlRQUNvZENodHljRjlvT2taaFFWRlZWR1UyWVdkUFRUZDNXVXhXTW05cFQzYxAB
388,201250,ChIJpS91tvFcGGARlABwaZJigSE,5,ばりる,2026-02-03T11:46:27.540Z,約９ヶ月間お世話になりました。恋愛経験ゼロで右も左も分からない私に親身になって相談に乗ってくれたことは本当に嬉しかったです。一度心が折れてしまい、１ヶ月ほど活動を控えていた時期もありました。そんな時も優しく寄り添ってくれた時のことは忘れられません。諦めずに心機一転して活動を再開した直後に素敵なご縁に恵まれて、本当にとんとん拍子で交際が進み、成婚することができました。間様には本当に感謝しております。この相談所に入って本当に良かったです。ありがとうございました。,,Ci9DQUlRQUNvZENodHljRjlvT2pSVVpFWmpUSFJFVFVkdWNXaFJTVmhZZW1ZeWRrRRAB
389,201250,ChIJpS91tvFcGGARlABwaZJigSE,5,宮口泰代,2026-02-02T10:25:38.337Z,会員さんに真摯に向き合っている結婚相談所だと思います。,,Ci9DQUlRQUNvZENodHljRjlvT2poV1dHbENNRFJ1VkdSdmVIVmZWV0UzZEc1NVVuYxAB
390,201250,ChIJpS91tvFcGGARlABwaZJigSE,1,Yok,2026-01-30T14:52:04.883Z,威圧的な対応を受けて残念でした。今後に期待します。,,Ci9DQUlRQUNvZENodHljRjlvT2pabE1HVkJhMnBzVmpSc01HOVdlaTFrV0RWdFduYxAB
391,201250,ChIJpS91tvFcGGARlABwaZJigSE,3,ikattsu 500,2026-01-29T02:30:48.145Z,,,Ci9DQUlRQUNvZENodHljRjlvT25jeVVXZEVjMGRaVG10Q09WVktVR1ZmT0ZoTWVVRRAB
392,200602,ChIJUeeQU7va2IsRc9WGYxZO_dI,5,ももたん,2026-01-30T05:13:47.683Z,"偶然Xの投稿を見たのをきっかけにメッセージを送ったのがきっかけでお返事をいただきました。こんなどこの誰かもわからない一個人に対しても丁寧にメッセージを下さり、それがきっかけでたまにやりとりをさせていただいていました。
婚活の苦労や悩み、愚痴をいつも全力で受け止めていただき背中を押していただいていました。3年程かかってしまいましたが、諦めない気持ちで頑張ったお陰でなんとか成婚する事ができました。
住む場所も違う、会員でもないこんな私のサポートまでしていただき本当に感謝です。同世代の女性の気持ちがよくわかる友葉さん、ぜひ地元の方、おススメです！！",,Ci9DQUlRQUNvZENodHljRjlvT25RM1psTkJPVUYxVW5kbGFYZ3RVSFI2VmtZMGVWRRAB
