レビューID,施設ID,施設GID,レビュワー評価,レビュワー名,レビュー日時,レビュー本文,レビュー要約,レビューGID
804,202269,ChIJ05a4iQqjWjURYLh6ymX6rqM,5,akira2978,2026-01-28T12:11:52.466Z,"結婚相談所を探していたとき広島市内で簡単に行ける場所で調べていた所エンエールさんを見つけました
初回カウンセリングで代表の藤川さんと自分が婚活で不安に思っている事を相談解決することができました。分からないことも気軽にLINEで質問でき、とても安心して入会することができました
活動の進め方など分からないことがあっても適切なサポートを受けることができると思います",,Ci9DQUlRQUNvZENodHljRjlvT2tWVFQxQkRkM3AzVWs5alpVcGhha3RKTmt4aWJXYxAB
805,202269,ChIJ05a4iQqjWjURYLh6ymX6rqM,5,ss tt,2026-01-25T09:35:58.353Z,"これまではマッチングアプリを使用していましたが、中々難しくこの度こちらの結婚相談所に入会いたしました。ご担当の藤川さんにはプロフィール作成など種々フォロー頂き、早速お見合いも成立しました。プロフィール作成には自信があるとおっしゃっていた通り素晴らしいPR分を作成頂き感謝いたします。
まだ活動は始まったばかりですが、頑張りたいと思います。",,Ci9DQUlRQUNvZENodHljRjlvT21GU2JXUlhObEJXUjJJd2RIVjRaV1pyVFdwQ2RIYxAB
806,202269,ChIJ05a4iQqjWjURYLh6ymX6rqM,5,微炭酸麦茶,2026-01-25T07:46:03.597Z,"代表の方は初回無料カウンセリング時に、丁寧な説明をされる中でもこちらに疑問点等ないか確認してくださったり、考える時間をくださったりと、真摯かつ丁寧な姿勢に感銘を受け、入会しました。

コースは、体を絞りたかったのでボディーメークコースを選択。
3ヶ月間、パーソナルトレーナーの方と二人三脚、食事
制限やトレーニング等、とてもしんどい期間となりましたが、トレーナーの方の気持ちのこもったアドバイスやエールを受け、結果的に13キロの減量に成功しました！(もとが三桁オーバーだったのでよく落ちました笑)

ようやく婚活のスタート地点に立てたとはいえ、今の時点で料金的にも十分もとが取れたと思っているので、星5です！！",,Ci9DQUlRQUNvZENodHljRjlvT21SblkxVnJObEJPVnpkamNVOVFXV2htYUhwT2VXYxAB
807,202269,ChIJ05a4iQqjWjURYLh6ymX6rqM,5,k y,2026-01-24T05:40:45.501Z,"広島県で結婚相談所を探していたところ、評価が高く料金がリーズナブルなエンエール様を見つけました。
無料相談をさせていただいた際には、私の結婚に関する悩みにも親身になっていただいたことが印象に残っております。
また、写真やプロフィール等に関してもとても素敵なものを作成していただき、入会してよかったと思いました。
藤川さんはとても丁寧な方で、LINEでいつでも相談できるのが非常にありがたいです。結婚に向けて安心して活動することができると思います！",,Ci9DQUlRQUNvZENodHljRjlvT25SamVGaGhlR1ZEV1ZGUmMzRm5kVVF6VUZCR1NsRRAB
808,202269,ChIJ05a4iQqjWjURYLh6ymX6rqM,5,タコス,2026-01-24T01:52:31.474Z,"ホームページを見てから良いかもしれないと思って実際に言ってみました！
親切に対応してもらい、説明もとても分かりやすかったです！こちらの話も真面目に聞いてくれて信用できそうだなと感じました！！",,Ci9DQUlRQUNvZENodHljRjlvT2pZM1ZteHFOakJWYWtwa1NuZE1NRUl6UlVOWVZWRRAB
809,202269,ChIJ05a4iQqjWjURYLh6ymX6rqM,5,ほいぬ,2026-01-14T13:32:01.914Z,20代30代に特化した結婚相談所であることと、値段のリーズナブルさに惹かれて無料カウンセリングを受けました。カウンセリング時は、私の聞きたいことを中心に説明を展開してくださったことに感動しました。また、説明資料が非常にわかりやすく、情報が入りやすかったです。こんなにも聞いていいんですか！？と思うほどに何度も質問の時間を取ってくださったので、入会前の不安を解消することができ非常に安心感がありました。活動は始まったばかりですが、LINEでの質問にも迅速に答えてくださり、ありがたいです。プロフィールも非常に素敵なものを作っていただき感動しました。藤川さんからの的確なアドバイスを頂きながら頑張りたいと思います。,,Ci9DQUlRQUNvZENodHljRjlvT2xGWWJtMHRTMng1VW5KU1VIQmpXV2xVYkVKSlYwRRAB
810,201386,ChIJ08OT-ZIpC18RrC6uBm5IpIk,5,赤兎馬,2026-01-11T06:02:09.393Z,"最初のカウンセリングからとても丁寧で、こちらの話をしっかり聞いた上で現実的なアドバイスをしてくれます。
日程調整や相談へのレスポンスも早く、1人で婚活している感じがしません。",,Ci9DQUlRQUNvZENodHljRjlvT21Wd1ZWWTNjbWxSV25sNGJtWTFiMUpLTjI1V1UwRRAB
811,201073,ChIJoZs6IJ1PGGARIGwtLEX5nvc,5,MSK,2026-01-19T03:37:32.650Z,"38歳になりこのまま結婚できないのでは･･･と焦りを感じていた時にエターナル湘南のHPを見つけました。

思い切って婚活相談に申し込み緊張して行ったのですが、中村さんはお会いするととても気さくで話しやすく、即入会を決めました。

そこからスタートした婚活。何もわからなくても全てサポートして下さり、レスポンスも早く安心して進めることができました。

お陰様で8ヵ月で成婚退会！　本気で結婚したい人にオススメしたいです。",,Ci9DQUlRQUNvZENodHljRjlvT2pOaVJsSjNRbGN0YVc5Q2NYTXRSWFpPUkcxT2RIYxAB
812,202300,ChIJQ-VFex6fBGARcMyFRpG5EmA,5,ようこ,2026-01-15T01:43:12.440Z,結婚相談は恥ずかしくてなかなか一歩が出なかったですが、イメージが変わりました。　まずカウンセラーの方とは話がしやすくて、お友達と世間話をしているくらいラフに相談ができたし、無理な勧誘などもありませんでした。1人で悩んでたけど一緒に考えていただいて、フッと肩の力が抜けて気が楽になった感じ！また不安があった事も整理ができて前進できそうです。結婚を真剣に考えていきたいと思います。　これから宜しくお願いします。,,Ci9DQUlRQUNvZENodHljRjlvT2pkMGNWUnFjSGRqVW5SRFdUTlNia3N3Y25CRGNIYxAB
813,200955,ChIJnwhozfMqzmYRtG4knYl8C1I,5,りんご58,2026-01-21T12:55:31.895Z,私に合う方を紹介して下さったり、相談に即座にのってくださったり親身に対応して下さいます。,,Ci9DQUlRQUNvZENodHljRjlvT21KUFVHMU9MVTlrZFZGU2NESjJhbGR6WkhOMGEwRRAB
814,203064,ChIJU8VG8O3fAGAROeFKpi8PcLo,5,tobika,2026-01-19T00:53:44.177Z,結婚相談所のFirstの宇野さんには3年間弱サポートしていただきました。僕の場合は婚活は自分の好きに行動する方が好きで、迷いが生じた時やモヤモヤが発生した時などは宇野さんに相談するスタイルで活動できました。宇野さんは暖かく相談に乗ってくださったので感謝です。申込も200件最大マックスまで行えるので、お見合いが組めずに困る月も少なく、自由に効率的に活動できました。また宇野さんのレスポンスもめちゃくちゃ早く、活動で止まったりなど困ることはありませんでした。Firstで活動し、無事に成婚できてとても嬉しく思います。,,Ci9DQUlRQUNvZENodHljRjlvT2pob01VTm1RVU0zVHpGdE1GTklPRmhEVldoTVdtYxAB
815,203064,ChIJU8VG8O3fAGAROeFKpi8PcLo,5,Ay,2026-01-18T00:51:12.026Z,"今月末で成婚退会します。
宇野さんには入会から退会まで親身にサポートいただきました！
Firstさんで登録しようと思ったきっかけは、宇野さんの人柄です^ ^
最初からとても話しやすい雰囲気で、相談しやすかったです。
常に味方であり、応援していただけたので、忍耐力が試される婚活では、心強い存在でした。。。！
自分が思っていたよりも早く、すごく素敵な方に巡り会えて今は幸せでいっぱいです！
ありがとうございました！",,Ci9DQUlRQUNvZENodHljRjlvT2tKTk1uaFpjMUIxVW1KRmRsQmFSbE52YlVSRFEyYxAB
816,201894,ChIJEcMkpJsIAWARDf3gtqe4TK0,2,Taru,2026-01-14T23:07:23.582Z,,,Ci9DQUlRQUNvZENodHljRjlvT25VNFlYSlVZbXhGU3padk5FZE1MVFZ6UzFsSE9WRRAB
817,200758,ChIJazOJCJPfGmARHjzlnqRnAqA,5,小麦,2026-01-14T11:46:22.463Z,"最初は緊張しながら伺いましたが、安心感のある担当者さんで、落ち着いた空間の中、親身に相談に乗っていただけました。自然とこちらでお世話になりたいと感じました。

朗らかなお人柄と前向きな言葉に、これから頑張っていこうと前向きな気持ちになれる、素敵な場所です。",,Ci9DQUlRQUNvZENodHljRjlvT2xsSk5WTmZiak5DWkRWcWQydFZlSE5KV0MxU0xXYxAB
818,201328,ChIJId0r5Br8K6cRFgkLKHr_zCo,5,chi I,2026-01-20T10:28:41.809Z,"本当にお世話になりました。
婚活中にお相手との関わりで何かモヤモヤすることがあっても自分がなんでモヤモヤしているのかっていうところがいまいちわからなくて、嫌なことや気になることはきちんと言わないといけないと頭ではわかっていても、元々の性格もあってそれが上手くできず、結果的に勝手に疲れて自滅する…というのが今までの私でした。
ですが的場さんは上手く言語化できてない私の話をきちんと聞いて、寄り添って、一緒に整理してくれた上で「こういうふうに言ったらいいんじゃない？」というのを具体的にアドバイスしてくれました。
的場さんはモヤモヤしたことがあった時のお相手への伝え方が上手で、とても参考になりました！
的場さんが仰っていましたが「言える相手を探すのではなく、言える自分になること」が大事なんだと気付いてから、遥かに気持ちが楽になったと思います。

このたび無事に成婚退会して1ヶ月程経ちますが、今の所言いたいことも言えてますし、仲良くやっていけています。
自己理解が上手くできていない方、お相手に言いたいことが上手く言えない方、寄り添ってもらいながらも的確なアドバイスが欲しい方には的場さんの相談所はオススメです。
本当にありがとうございました！",,Ci9DQUlRQUNvZENodHljRjlvT2pNMlMyWXpVVjkxWmkxcVpGZDBibEpYYjNoNllXYxAB
819,201233,ChIJGU6qQmlizK0RRg2GzIHKlXo,5,g KK,2026-02-09T02:25:13.119Z,"以前は別の結婚相談所で活動していましたが、相談に対する対応がやや事務的に感じられ、親身に伴走してもらえている実感が持てずにいました。
実際、お見合いもほとんど組めない状況が続き、このまま続けていて大丈夫なのかなと不安を感じていました。

そんな中でふたり記念日さんを知り、思い切って移籍しました。
今振り返ると、この判断は本当に良かったと思います。

こちらでは代表の方が直接話を聞いてくださり、その時々の状況に合わせてとても的確なアドバイスをしてくれます。
親身に寄り添ってくれる一方で感情論に偏ることはなく、「なぜそう考えるのか」をきちんと言語化しながら、論理的にも納得できる形で説明してもらえるのが印象的です。
また、恋愛経験に基づく実践的な視点や、占い的な観点からのアドバイスもあり、自分では気づかなかった考え方にハッとさせられることも多いです。
年齢も近く、堅苦しさがなく相談しやすい雰囲気なのもありがたいと感じています。

移籍してからはお見合いの件数も増え、以前は諦めかけていた婚活を、前向きな気持ちで続けられるようになりました。
一人ひとりの状況をきちんと見たうえで、本気で向き合ってくれているのが伝わってきて、安心して活動できています。

これからもいただいたアドバイスを大切にしながら、自分自身も前向きに頑張っていきたいと思います。",,Ci9DQUlRQUNvZENodHljRjlvT2pWRkxYZHFaMVpPU2pOUWRWbG9ibkZXVmtKRVdHYxAB
820,203074,ChIJs5kLSnRtA2ARTD_IU4Z4fMs,1,mt fuji,2026-01-11T13:15:45.141Z,,,Ci9DQUlRQUNvZENodHljRjlvT25KclEwRllURzB5TFdsNU4yTklha1p3VEVNdFduYxAB
821,201638,ChIJq2ApwXTCsKARpcSL2lNzYXs,5,津村春樹,2026-02-08T03:50:27.701Z,"今回、プロフィール写真を撮影していただきました！！
とても丁寧にヒアリングしてもらえ、理想の写真を撮影してもらえてとても満足しています！
今後は家族写真もお願いしたいと思いました！",,Ci9DQUlRQUNvZENodHljRjlvT2tWSGFUTjFjRXBJYmpkdk1tRmllbUZCYlZsd1YyYxAB
822,201638,ChIJq2ApwXTCsKARpcSL2lNzYXs,5,萩原大貴,2026-01-21T00:33:17.054Z,"結婚式の前撮りと、結婚式、マタニティーフォトで依頼させて貰いました。こちらが笑顔になれるような声掛けをして貰い、とてもリラックスしながら撮影に臨むことができました！
わざわざ神戸まで来てくれてとても助かりました。
結婚相談所も始めたとお聞きしました☺️
安心できる人がやってくれているので、とてもオススメです！！",,Ci9DQUlRQUNvZENodHljRjlvT21GU1dXOU1WbUZWU2s0NU5tVlhVbTlDTURGaVZWRRAB
823,202048,ChIJ27Uluda_-F8RAkKEll1le7Q,5,ななころびやおき,2026-02-09T13:20:26.642Z,"1人での婚活に行き詰まり、結婚相談所を探していたところ、こちらのクチコミの中で、投稿者とのやりとりの文面を拝見し、無料相談を申し込みました。
（文面から人柄の良さが出ていました）

実際、カウンセラーの方とお会いしてお話ししてみたところ、とても気さくで親しみやすい方でした。また、こちらの話しを親身になって聞いてくださり、人として信頼できると判断し、すぐに入会を決めました。

今まで複数人でのパーティーやイベントに参加して、右も左もわからない状況ではありましたが、アドバイスを頂ける伴走者が近くに居てくれることは、とても心強いと感じます。

いろんなことを吸収しながら、どんな人に出会えるのかを楽しみに活動していきたいと思います。",,Ci9DQUlRQUNvZENodHljRjlvT25OTk5rbzRaMnhOVERjMk5GbElWRTE0VEdsWGNVRRAB
824,202048,ChIJ27Uluda_-F8RAkKEll1le7Q,4,busin 3910,2026-01-20T03:21:22.279Z,カウンセラーは終始明るく親しみやすい。人柄の良さが言葉の端々に表れ、LINEでの迅速な相談対応も心強い。相談所の支援体制は手厚く、価格設定も良心的で評価できる。総合的に信頼できるところ。,,Ci9DQUlRQUNvZENodHljRjlvT2tzdE1VaFhkemgwZDIxTlZqRmZVVEF0WjFaNk4wRRAB
825,202053,ChIJyUkePbZ9AWARyPyOpGeuVjY,5,ひろさん,2026-01-13T12:54:58.470Z,ハンデがいっぱいあって中々難しいかも知れませんが、地道に頑張ります。よろしくお願いします。,,Ci9DQUlRQUNvZENodHljRjlvT2tsbmRtUk5XbE0wU0doNmFsSlRVbUYxTFZsM2MzYxAB
826,202182,ChIJyyeGhhV_GGAR3mC-YEreM7Y,5,テツ,2026-01-18T14:21:38.309Z,"今までアプリや婚活パーティなどを利用していましたが上手くいかず、IBJの紹介でいくつかの相談所からこちらを選びました。
他のところと比較して講座やシミュレーションなどがあり、コンテンツが充実していると感じたこと、また羽澤さんとお話しして人柄に惹かれたことがこちらを選んだ理由です。
活動はこれからですが、頑張っていきたいです！",,Ci9DQUlRQUNvZENodHljRjlvT201bVFYaHJlbHBQU0VsSkxUUkNhMk5PVldzd1lYYxAB
827,202182,ChIJyyeGhhV_GGAR3mC-YEreM7Y,5,ヤス,2026-01-18T07:57:43.894Z,"真剣に結婚を考えるにあたり、結婚相談所を検討していたところ、代表の羽澤さんとお会いする機会があり、「この方なら信頼できる」と思い入会致しました。

私の場合は「1年間頑張ってみて、結果が出なければ一旦区切りにしよう」と期限を切っての活動を予定していたので、ファッションコーディネート(買物から同行)のオプションは活動の不安を大きく取り除いてくれました。
私は利用しておりませんが、コミュニケーションの取り方のサポートなども充実しているようです。

羽澤さんの手厚いサポートもあり、私は入会から凡そ8ヶ月で成婚退会にこぎつけることができました。

最終的には相性とご縁が全てにはなりますが、「婚活にあたっての不安を取り除いてくれる結婚相談所」として非常に頼りになりました。
検討されている方にも良いご縁がありますよう。",,Ci9DQUlRQUNvZENodHljRjlvT2t4dExYZGthVk5vYmpoWGVuRlFZbFIxYjE5Q2VXYxAB
828,200752,ChIJxew_vDRCbWgRh_gr8hgZemo,4,Taru,2026-01-14T22:51:17.639Z,,,Ci9DQUlRQUNvZENodHljRjlvT2t0UFlVcHJWV2RVTWxFNVRVRlBjME5mVjNOcVVGRRAB
829,200750,ChIJGef4SxbrGGARyCZK8v9M1Q4,5,rina 08,2026-01-25T07:50:18.698Z,こちらでお世話になり成婚しました。とても優しく明るい方です。,,Ci9DQUlRQUNvZENodHljRjlvT205c2NXaE9RVkpuUWt4MVEwOHdUVEJXTjFOV1RtYxAB
830,201608,ChIJnx9ZmqrqJkgRjf57FQhK4ZE,5,R R,2026-01-24T01:42:57.198Z,仲人さんは初めて会った時から親身になってお話を丁寧に聞いてくださって話しやすい方です。そして何よりお話しているとこちらが前向きに頑張ろうという気持ちになります。頭の回転も速く柔軟な考えの仲人さんでオススメの相談所です。,,Ci9DQUlRQUNvZENodHljRjlvT20xblNHUnJRa2xZTjNGMVZXaHVTRmxwUldRMFRtYxAB
831,201608,ChIJnx9ZmqrqJkgRjf57FQhK4ZE,5,mariko,2026-01-20T03:03:52.652Z,"事業家のコミュニティで知り合いいつもお世話になっております！

とても明るく、事業の成果も出されているお力のある方です◎周りの方からの評価も高いので、入会されている方は大満足されている方が多いとお聞きしております＾＾

私も周りで結婚について悩まれている方は、春うららさんにお繋ぎしたいと思っております。引き続きどうぞよろしくお願い致します！",,Ci9DQUlRQUNvZENodHljRjlvT21OTlJEWTJlblkyTkdoWFNuaEVkMjlvZDNaQ1lYYxAB
832,201325,ChIJcaxoSIndGGAR63w5cA85ATY,5,ウィル,2026-01-17T16:09:29.984Z,"結婚をしたくて、ここを選びましたけど
対応が良くて、さすが色々と専門家だと思いました",,Ci9DQUlRQUNvZENodHljRjlvT2s1bU5WRTJRVXc0UlVSNU9UUmZTVzVJTlhwRGNuYxAB
833,201325,ChIJcaxoSIndGGAR63w5cA85ATY,5,Kiran Bohara,2026-01-14T16:05:12.744Z,よく話を聞いてくれます。本当に色々助かりました。,,Ci9DQUlRQUNvZENodHljRjlvT2tGYU9VRmZTaTFYWkdWWE1GVnFSbE5XZEVKMWIzYxAB
834,201325,ChIJcaxoSIndGGAR63w5cA85ATY,5,イキイキ乳酸菌,2026-01-13T16:50:08.279Z,とにかくどんな些細な悩みでも多角的に方向性を指南してくれるので助かりました。,,Ci9DQUlRQUNvZENodHljRjlvT2xwalQwRldWSE0zZEc1ME0xOXhlVUprZG1SaWRuYxAB
835,202380,ChIJEYpHDF3PAGARIP_xLmHFtqE,5,ノリックノリック,2026-01-21T06:58:20.999Z,"開店当初からご来店いただいて、かれこれ25年、上田さんのヘアを担当させていただいてます。
オシャレでいつも明るい笑顔で優しさがにじみでていて、来店時も楽しいお話を色々聞かせてもらってます！
上田さん一家は素敵なとても仲のいい家族です。
きっと素敵な出会いに導いてくれると思います。",,Ci9DQUlRQUNvZENodHljRjlvT2poV1p6WnVXbTVzWVZCaFRsTkpjbVZwV0ZWalMzYxAB
836,202380,ChIJEYpHDF3PAGARIP_xLmHFtqE,5,将弘,2026-01-18T04:39:00.472Z,おかげさまで成婚しました！約10ヶ月お世話になり、手厚いサポートがあってこの日を迎えれたと思っています。ありがとうございます。,,ChdDSUhNMG9nS0VJQ0FnTUNRM19XdzRnRRAB
837,202380,ChIJEYpHDF3PAGARIP_xLmHFtqE,5,まりまり,2026-01-14T04:24:03.683Z,婚活するうえで、一緒に悩みも親身に聞いてくれるのでいつも頑張ろうと思わせてくれるのが励みになっています。,,Ci9DQUlRQUNvZENodHljRjlvT2t0bmVqQTVMV2hrTjNoYVdGZGxhWGREWnpCeFZGRRAB
838,202560,ChIJ7f6SseH0E68RyjOf08ott44,5,k,2026-01-20T01:01:01.662Z,迅速な対応、的確なアドバイスをいただいてのスタートが切れました。,,Ci9DQUlRQUNvZENodHljRjlvT2xWR1dreFNiV2hEVjBoMlRucDRaVTlHUkU5dWRuYxAB
839,202560,ChIJ7f6SseH0E68RyjOf08ott44,5,村上薫,2026-01-18T12:49:57.659Z,とても丁寧に、迅速にプロフィールを添削していただけました。非常に魅力的なプロフィールに仕上がっていると思います。アフターケアまであり、非常に心強いです。お勧めいたします。,,Ci9DQUlRQUNvZENodHljRjlvT205aFNFZGhaVzVCV25selozZHlPVXhKWkdRdFgzYxAB
840,201203,ChIJ8wLOh5DzGGARAjK_hnTks6w,4,U.F,2026-01-19T13:41:52.594Z,"1年間程で成婚退会しました。
女性との付き合い方がわからない中、
親身になって助言をしてくれました。",,Ci9DQUlRQUNvZENodHljRjlvT2pocVNIRlJTa1paWkV4NFYwRnpkRkpmYm5jMlIxRRAB
841,202700,ChIJE8ZEWXv1GGARwHMu5raQ-MI,5,もふもふ,2026-02-08T06:46:17.494Z,ツルツルセッションを受けさせていただきました。自分の過去を振り返りながら、大切な気持ちや感情を知る過程は、とても学びが多かったです。人生に寄り添ったアドバイスもたくさんいただき、これからを生きるヒントを頂けた気がします！婚活にももちろん役立ちますが、これからの人生をより自分らしくありたいと思う方にもオススメしたいです！,,Ci9DQUlRQUNvZENodHljRjlvT2tORWRrZFdWa2xvTW5BeVRHRllTM05mWHpFM09IYxAB
842,202700,ChIJE8ZEWXv1GGARwHMu5raQ-MI,5,yu,2026-01-21T11:24:40.270Z,"4時間の自己分析は少し不安でしたが、始まるとあっという間で、とても充実した時間でした。
漠然と感じていた生きづらさの理由が分かり、自分の軸や自分を大切にする方法を知ることができて、気持ちがスッキリしました。
婚活に限らず、仕事や人間関係など、これからの人生のさまざまな場面で活かしていける学びの多い時間だったと思います。

松本さんがとても気さくで話しやすく、安心して自分をさらけ出せました。ありがとうございました。",,Ci9DQUlRQUNvZENodHljRjlvT21KdFdGWkJYMHBTWjAxaFkzTTNTbkpIZVY5YVRIYxAB
843,201385,ChIJfQ6y2bLhVDURXcbmeHmyR7k,5,藤原幸子,2026-02-08T08:12:13.546Z,"本日は、色々お話を聞かせて頂きありがとうございました。
気兼ねなく、親切丁寧にお話していただき、とても分かりやすかったです。",,Ci9DQUlRQUNvZENodHljRjlvT2pKNk5FUlRiMUpsT1RRMVJVZ3pOVkpNY1ZONGFIYxAB
844,200934,ChIJi5bvvk2kQTURCpK_Azb7a4E,5,T M,2026-01-25T14:16:32.183Z,"無料相談から入会まで丁寧に対応していただき、安心してスタートできました。
婚活は初めてで不安もありましたが、こちらの話をしっかり聞いた上で、無理に勧める感じがなく、自分のペースを尊重してくれる点が好印象でした。
地元・久留米での結婚を考えている自分に合ったアドバイスももらえて、これからの活動が具体的にイメージできました。
サポート体制もしっかりしていそうなので、前向きに活動していきたいと思います。
担当の方も話しやすく、相談しやすい雰囲気だったのも決め手の一つです。",,Ci9DQUlRQUNvZENodHljRjlvT2xOWFEyMUhOMmxKWDNNMVJIQm1TVlZTZVhOdGNGRRAB
845,202175,ChIJU5V33932GGARwp2xcqLmxUI,5,K M,2026-01-11T09:36:42.822Z,"元々、大手の相談所に登録していましたが、ご縁があり、この度こちらの相談所様にお世話になることにしました。
とても親身になってくれるカウンセラーさんが入会の決め手でして、このご縁が更なる良縁に繋がるようこれから頑張りたいと思います。

(2026年1月更新)
こちらの結婚相談所にお世話になったおかげで、素晴らしいパートナーと出会うことができ、先日無事、成婚退会ができました！

不安や心配もありましたが、アドバイザーさんが、とても親切で、私の気持ちに寄り添いながらサポートしてくれました。出会った彼女との相性もよく、あっという間に二人の距離が縮まりました。

また、相談所経由で不動産会社を紹介してもらい、新居を見つけることができましたので、そちらにも感謝しています。

結婚を真剣に考えている方には、自信を持ってお勧めできる相談所です！",,ChdDSUhNMG9nS0VJN1l6czJBcE1laG5RRRAB
846,201025,ChIJZVITJnltUzURSYlxx3b8aZc,5,森恵美,2026-01-11T07:49:41.646Z,あちかく、親身になって、付き添いをしていただきました、すごく嬉しくおもいました。,,Ci9DQUlRQUNvZENodHljRjlvT2xkTU1FUlpVbTFIZDNWUmMwZ3lZMmN5U0dSUGNuYxAB
