レビューID,施設ID,施設GID,レビュワー評価,レビュワー名,レビュー日時,レビュー本文,レビュー要約,レビューGID
568,200296,ChIJfbFAUdGMGGAR1hYvWqiG4q8,1,ma ta (tama),2026-01-23T01:59:18.719Z,"悪徳商法極まりありません。お金払うまでは手厚いです。支払い後は期限は守らない、言い訳はする。最悪です。すぐに辞めました。

結婚相談所として利用したいのにIBJの加盟店にならないか、と話ありました。
IBJのシステム(会員の個人情報モリモリ)を購入できるそうです。しかもかなり安いです。個人でも購入可能です。怖すぎる……。友人も誘われたとのこと。マルチよりタチが悪いです。

絶対に契約してはいけません。",,Ci9DQUlRQUNvZENodHljRjlvT2tKMWVWWlFlVEI2T1ZjMFNuQTVTM0ZpTW1kSlNtYxAB
569,200296,ChIJfbFAUdGMGGAR1hYvWqiG4q8,3,RYO,2026-01-13T15:44:44.578Z,,,Ci9DQUlRQUNvZENodHljRjlvT2pkR1pYZGFXbUZwVDNwaVZWWjBSa3d6Y0VsSU9WRRAB
570,200296,ChIJfbFAUdGMGGAR1hYvWqiG4q8,4,Ogawa Takuma,2026-01-12T03:48:46.313Z,,,Ci9DQUlRQUNvZENodHljRjlvT2tRNVpYWk1PVzVmWkVwR1RFOVFhbVJIY0dNeFVtYxAB
571,200296,ChIJfbFAUdGMGGAR1hYvWqiG4q8,5,山本奏,2026-01-11T02:40:41.159Z,"8月から初めて1月に成婚退会しました！
手厚くサポートしていただけてとてもありがたかったです。",,Ci9DQUlRQUNvZENodHljRjlvT2s1UGRYTkVTbDloYkV4TE4xbzRhMDFuYkVJMFptYxAB
572,200295,ChIJtQqDzvLmAGARgqOZi58e8RQ,1,和也,2026-01-21T10:24:52.206Z,"パーティーに何回か参加しました。
満席とか書いてるのに何人も当日欠席になっていたり、明らかに嘘で人集めてると思います。
プラチナ会も参加しましたが、これ、プラチナ？ってレベルでした。",,Ci9DQUlRQUNvZENodHljRjlvT205NWRqQlpNbFJQY2pSR1luZEZla3RIVFVWV00xRRAB
573,200295,ChIJtQqDzvLmAGARgqOZi58e8RQ,5,Na,2026-01-19T13:27:40.849Z,"約8ヶ月活動し、成婚退会しました。
カウンセラーさんと適宜相談しながら楽しく活動することができました！
会費や成婚料は高いですが、いい人が見つかれば結婚までのスピードは早く、アフターフォローも手厚くしてもらえるので、入ってよかったと思います。
年齢が若い方が有利だと感じたので、迷われていたらぜひ話を聞いてみてはどうかなと思います！",,Ci9DQUlRQUNvZENodHljRjlvT214TVRGTnNWbTlXZW1WRE1FeFNjek5LWm1WdVUyYxAB
574,200295,ChIJtQqDzvLmAGARgqOZi58e8RQ,5,高岸将充,2026-01-13T22:04:15.589Z,40代前半の男性です。カウンセラーの花坂さまの手厚いご支援にて、1年の活動を経て、30代のステキな女性と成婚退会いたしました！まだ入籍はしておりませんが、とても幸せです。しんどい時期もありましたが、1年続けようと思えたのは、花坂さまのお人柄を通じたサポートだと感じます。謙虚に活動すれば、必ず成婚できます。私は入会して良かったな、と思っています。仮に成婚退会できない結果だったとしても、得られるものが多かったからです。本当にありがとうございました！,,Ci9DQUlRQUNvZENodHljRjlvT2tWR0xXRnJVMjlUVVZCUU56Vm9iRzFxTFZWaVEyYxAB
575,200107,ChIJ0xrjHeh2A2ARO1yPYFZNkZ4,5,日置栞,2026-02-08T05:05:45.699Z,"長い期間お世話になりました。
何度か挫けそうになりましたが担当者の方が親身になってくださり色々なプランを教えてくださいました。
諦めなくて良かったです。
とっても素敵な人に出会えました。
ありがとうございました！",,Ci9DQUlRQUNvZENodHljRjlvT25oaWMxYzVVazl3VkZaRFJsRXhaVE5FWjFCTmJFRRAB
576,200107,ChIJ0xrjHeh2A2ARO1yPYFZNkZ4,5,ReiKa,2026-01-25T06:45:57.862Z,活動報告をあまりしない私に愛想尽かさずに小まめに電話して現状を聞き出してアドバイスしてくれて、担当の方が居なかったら私は彼に出逢えなかったと思います。本当にありがとうございました。,,Ci9DQUlRQUNvZENodHljRjlvT21KVlFVdHBZalpMTWpOdGRUZ3Rla2w0VGpkSE0wRRAB
577,200107,ChIJ0xrjHeh2A2ARO1yPYFZNkZ4,5,佐々木雄大,2026-01-24T07:12:24.835Z,アドバイザーさんに背中を押してもらい、素敵な方と巡り会うことができてよかったです。,,Ci9DQUlRQUNvZENodHljRjlvT2paWWNVUXlia1EwWTFOb2FEZ3dXV3N0T1dad09XYxAB
578,200107,ChIJ0xrjHeh2A2ARO1yPYFZNkZ4,5,箕浦大志,2026-01-24T06:36:16.571Z,アドバイザーさんのおかげで良い出会いに巡り合うことが出来ました。,,Ci9DQUlRQUNvZENodHljRjlvT2pGU1RqTXdjRGwzWW5Sak0wSjZXRzVWU2xjNVEzYxAB
579,200107,ChIJ0xrjHeh2A2ARO1yPYFZNkZ4,5,sei,2026-01-24T02:04:09.957Z,いい出会いがあって感謝,,Ci9DQUlRQUNvZENodHljRjlvT2xGcExYcDBiM2s1Y0hJNWJWSkpiVUYxYkZjM2MwRRAB
580,200107,ChIJ0xrjHeh2A2ARO1yPYFZNkZ4,5,argentum silver,2026-01-18T04:36:27.252Z,"この度はサポート頂き、ありがとうございました！
お陰で素敵な方に出会うことができ、無事結婚で来ました！",,Ci9DQUlRQUNvZENodHljRjlvT2t4WVFrRnlYMVoxUzI1V1FtOVphREIyU1ZScmMyYxAB
581,200107,ChIJ0xrjHeh2A2ARO1yPYFZNkZ4,5,寺西孝泰,2026-01-17T06:52:15.864Z,,,Ci9DQUlRQUNvZENodHljRjlvT2sxek1UVlRNV0p6WWtGWExXTnRYM1U1Y2tGYVptYxAB
582,200107,ChIJ0xrjHeh2A2ARO1yPYFZNkZ4,5,COTTA PANNA,2026-01-14T09:30:10.998Z,とても親身に接してくださり、モチベーションを維持することができ結果に繋がりました。大変お世話になりました。ありがとうございました。,,Ci9DQUlRQUNvZENodHljRjlvT2pSaGN6QkNWSFJ0TWtzeUxVOW5kRUk0YW1keU4xRRAB
583,200107,ChIJ0xrjHeh2A2ARO1yPYFZNkZ4,5,松本晃太,2026-01-11T07:45:22.702Z,素敵な出会いをありがとうございました。結婚に悩んでいる人は是非、一度伺ってみてはどうでしょうか！,,Ci9DQUlRQUNvZENodHljRjlvT2pkSWNXTmxlalZUWWtGUU16Z3hhMDFuZW1obFkxRRAB
584,200107,ChIJ0xrjHeh2A2ARO1yPYFZNkZ4,5,kazu,2026-01-11T05:33:17.272Z,,,Ci9DQUlRQUNvZENodHljRjlvT2w5U2NFNVRkemhVYUVkT05rSTRlREpuT1RKT1RYYxAB
585,200107,ChIJ0xrjHeh2A2ARO1yPYFZNkZ4,5,Taiko Z,2026-01-11T05:21:39.579Z,親身になって相談に乗っていただけました。,,Ci9DQUlRQUNvZENodHljRjlvT2xGR2NXTkVibVkyUVZoSU1VaE1TSEJQZFV0Zk1WRRAB
586,200107,ChIJ0xrjHeh2A2ARO1yPYFZNkZ4,5,M,2026-01-11T05:14:33.830Z,約1年間活動して来ました。挫けそうな事が何度かありましたが、担当者の葛城さんに叱咤激励を頂き、良い御縁に巡り合うことが出来ました。本当にありがとうございました。心より感謝いたしております。この御縁を大切にします。,,Ci9DQUlRQUNvZENodHljRjlvT2tGRmNYVTFMVkpLYUc0eFVIZDVaMjlyUkdRM1NVRRAB
587,200291,ChIJw5ZWFuWLGGARQoWG8zOCtIM,5,h k,2026-01-12T04:06:44.878Z,活動期間2年間ほどでしたか、長い期間にも関わらず、カウンセラーの方にとても親切に、親身に対応して頂きました。些細な相談にもアドバイスをいただけるので安心して活動できました。そのおかげて良いご縁に恵まれ、無事に成婚退会することができました。入会して良かったと心から思います。,,Ci9DQUlRQUNvZENodHljRjlvT21JelJYVnJhMjV2ZFVsTWFWOUVaVGhWVlRSd1MzYxAB
588,200291,ChIJw5ZWFuWLGGARQoWG8zOCtIM,5,オペラ,2026-01-11T06:10:30.049Z,"4ヶ月くらいで成婚退会できました。
仮交際や真剣交際などステップごとに相談に乗っていただけました。
自分としては最高の女性と出会えたと思っています。本当にラッキーでした。",,Ci9DQUlRQUNvZENodHljRjlvT2sxalNqUTVOR2xTTjBsamVYcFhVbUV0V0dKQ1dXYxAB
589,200299,ChIJgyKme_qOAGAR7n2U6qLgL-Q,5,山田,2026-02-07T01:00:54.595Z,"マッチングアプリで婚活していましたが、なかなか思ったように進まず、こちらの婚活パーティー参加をきっかけに、入会しました。

お相手の方は身元もしっかりしている方たちで安心感ありましたし、サポートしてくれる担当の方はレスポンスが早く、とても助かりました。

2回目のデートになかなか進めない時に、担当の方に相談すると、面談をしていただき、僕に合わせた「いいところ」、「改善した方がいいところ」をしっかり教えてもらえました。

その甲斐あって、パートナーと出会うことができ、自分でも驚くぐらいデートも順調に進みました。相手に聞にくいところを担当者さんが、パートナーの担当者さんと連携して確認してくれたりなどして、関係をすすめやすかったです。

成婚してからのサポートも充実していて、これからするべきことなどを一緒に整理してくれたり、アイデアを出してくれたりなど、心強い存在です。

本当に入会して良かったなと思いました。
ありがとうございました。",,Ci9DQUlRQUNvZENodHljRjlvT2t0NVJEWTJWWHBHUzJ0SFR6aHJWVkJqVkZoTE5XYxAB
590,200293,ChIJ_0QUtseRQTURHJYlenGbREQ,5,まつこまつこ,2026-01-29T14:25:40.813Z,"【プロフィール・活動について】
30代後半の男性です。
福岡県外在住ですが、会社の先輩の勧めもあってＩＢＪメンバーズ福岡店に入りました。
2025年2月に入会し、2025年9月に真剣交際、2025年12月に成婚退会→入籍、という流れで卒業しました。

【入会について】
入会から退会までそれなりの費用はかかりますが、お会いできる相手の身元はしっかりしており、結婚への真剣度が高いことを考えると、マッチングアプリなどよりも成婚に至る確実性が高く、タイパもよいことから、総じてコストパフォーマンスはいいのではないかと思います。

【活動中】
本当に素晴らしいカウンセラーさんに付いていただいたおかげで、事務手続きから普段のお見合いや交際についても丁寧にフォローいただき、活動を進めることができました。
婚活は孤独だったり、苦しいこともしばしばありますが、ＩＢＪメンバーズ福岡店の方々は、しっかりと寄り添ってくださるカウンセラーさんたちで、安心して活動できると思います。
私自身は、私に付いてくださったカウンセラーさんがいらしたからこそ成婚できたと思うので、本当に感謝しかありません。

【お伝えしたいこと】
もちろん、目に見えぬ縁や理論的に説明できない運の要素も強い世界だと感じましたが、そんな世界だからこそ、心から寄り添ってくださるカウンセラーさんは重要だと思いました。
ＩＢＪメンバーズ福岡店は、その点、大丈夫です！
私は福岡県外在住のため、なかなか面談には行けませんでしたが、面談が不要なくらい頻繁にLINEやコメントツールでアドバイスをいただいたり、愚痴を聞いてもらったりしました。LINEでの連絡が主になりましたが、お返事も早くマメにいただき、いつもそばにいてくださる感じがして本当に心強かったです。ありがとうございました(;_;)
ですので、福岡以外の九州の男性にもおすすめできます。身近に結婚相談所が少ないこともあると思いますので、選択肢に入れてみて欲しいです。
また、結婚相談所は最後の砦で、活動している人は変わった人が多いというSNSのコメントを見かけたりもしますが、私が見ていた限りでは、お見合いした方も仮交際した方々も皆様とっても素敵な方々でした。

【おわりに】
最終的に、思い描いていたような方、理想に描いていた方と結婚できました。
結婚相談所でなければ絶対に出会えなかったと思います。自分のように地方在住で、転勤もあって、年齢も高めという良い条件がない場合でも、十分チャンスがあると思います。
ぜひ、婚活の手段として前向きに結婚相談所も考えていただきたいし、その中でもＩＢＪメンバーズ福岡店を選んでみてください！

★カウンセラーさん、本当に本当にお世話になりました！ありがとうございました！たくさんの感謝を込めまして。",,Ci9DQUlRQUNvZENodHljRjlvT210VWMwRm5Uak5OUlcxTU5IUlVaR2hYTW1kaFgzYxAB
591,200293,ChIJ_0QUtseRQTURHJYlenGbREQ,5,K,2026-01-28T05:54:01.338Z,"IBJ主催の婚活パーティーに参加後、入会することにしました。
友人もこちらの結婚相談所で結婚したので、これから頑張ろうと思います！",,Ci9DQUlRQUNvZENodHljRjlvT2pkTlEwTnhaVk5yYW05RWJ6VmtZbGwyZEVsemFuYxAB
592,200293,ChIJ_0QUtseRQTURHJYlenGbREQ,5,Yuko,2026-01-25T04:00:31.258Z,色々とお話を聞いてくださり決断できました。後悔しないようにがんばります。,,Ci9DQUlRQUNvZENodHljRjlvT2tSQ1ZsZEpiMjR6YVdZM00wdHRVVzlHVDJSNGJFRRAB
593,200293,ChIJ_0QUtseRQTURHJYlenGbREQ,4,みみ,2026-01-24T09:54:37.428Z,"マッチングアプリに疲れて色々と検索している時にこちらのIBJの婚活パーティーを知りました。初めて行ったパーティーで担当者の方にお声がけ頂き、色々とご説明をしてもらって婚活を本格的に始めようと思いました！
気軽に相談できそうなところが魅力的だと思います。これから頑張ります！",,Ci9DQUlRQUNvZENodHljRjlvT25CdVUzcFhUMkZNVFZOU1ZIcE9iMFpsV2pSS2FsRRAB
594,200294,ChIJFZVHDlCLGGARX7MIjfnuU_E,5,アニエス,2026-01-24T07:41:03.026Z,次の誕生日までに良い出会いがあればと昨年5月に入会し、10月に成婚退会しました。最初は自分に需要があるのか分からない状態で初めましたが、カウンセラーの方に常に親身に寄り添って頂き、ご縁あってこれ以上ない素敵な方と来月入籍することになり、自分でも信じられない気持ちです😌相談所での婚活は初めてだったので、毎週土日の予定がびっしり埋まりびっくりしましたが、今日が一番若いと思って乗り切りました笑　スケジュールはタイトでしたが、カウンセラーの方を通してフィードバックを頂けてお相手の方の反応が分かるので、精神的にはあまり負荷を感じることなく、何より楽しく進めることができました！いつも的確に絶大なサポートを頂き、時に私の欠点をどう克服するか一緒に考えてくださり、心から感謝しています☺️また退会後も色々なサポートがあり、とても有難いです。もし迷われている方は、一歩踏み出してみることをお勧めします🍀,,Ci9DQUlRQUNvZENodHljRjlvT2paTmNuQm1SbXBZWkVvdFYybzBUWGhyUzNKRmFHYxAB
595,200294,ChIJFZVHDlCLGGARX7MIjfnuU_E,1,Xg7LpQ,2026-01-22T05:30:38.227Z,"サポートがいいのは最初だけです。
表面上だけ「条件も良いし、素敵な方なのにどうしてうまくいかないんだろうと話してました」などと調子のいいことばかり言わないで欲しい。

それならまだ「あなたの容姿、考え方では無理です。1から学び直してください」とはっきり言われたほうがましです。",,Ci9DQUlRQUNvZENodHljRjlvT2tNMVJrSm1aMXBGVTE4MlFUaDRVWEJHUlMxRmVFRRAB
596,200294,ChIJFZVHDlCLGGARX7MIjfnuU_E,5,げんげん,2026-01-12T08:15:27.117Z,"IBJメンバーズに去年10月に入会させていただき、ご縁あって12月のクリスマスのタイミングで成婚退会しました。恋愛経験はありませんでしたが、お見合いや、その後のデートのサポートを丁寧にしていただき、成婚までスムーズに進めることができました。
これから新生活が始まりますが、成婚後の新生活をサポートするアフターサービスもあり、今後有効活用させてもらおうと思っています。",,Ci9DQUlRQUNvZENodHljRjlvT210TWNYRnFSbWt6UmxWTFNWVjVha1UyTWxWSk5YYxAB
597,200294,ChIJFZVHDlCLGGARX7MIjfnuU_E,5,いいやまみつる,2026-01-12T02:19:17.401Z,軽い気持ちで初めて見たが、開始からすぐに素敵な方と出会うことができた。定期的な面談でサポートも充実していた。,,Ci9DQUlRQUNvZENodHljRjlvT2twSWJWRkVjREJ2ZDBKaFVUaEphbFZaTlRJeWNFRRAB
598,200294,ChIJFZVHDlCLGGARX7MIjfnuU_E,5,とも,2026-01-12T00:05:46.077Z,"担当カウンセラーさんのアドバイスやサポートがあり前向きに活動を続けられました。ありがとうございました。
また、成婚退会して終わりではなく、退会後のアフターサポートもあり、手厚いサポートをしてもらえます。分からないことが多いので安心ですし心強いです。",,Ci9DQUlRQUNvZENodHljRjlvT204NWNsbEtZV040VkRoUlFWSkdPRXhCU1hjdE5HYxAB
599,200294,ChIJFZVHDlCLGGARX7MIjfnuU_E,5,na,2026-01-11T12:33:57.291Z,"最初から最後まで、手厚くサポートしていただき、本当にありがとうございました！！活動期間も長かったこともあり、何度も心が折れましたが、良い時も悪い時も、一緒に共感していただいて、全力で励ましていただいて、とても心強かったです。
1人だったら絶対諦めていたな〜と思います。
そして、身元がしっかりと保証されている真剣度の高い会員様がほとんどなので、人を見る目のない私でも(笑)安心して、活動を進めることができました。おかげさまで、最高の相手と出会うことができ無事成婚退会できました☺️✨
迷っている方がいらっしゃいましたら、ぜひ、勇気を出して利用して欲しいです！！",,Ci9DQUlRQUNvZENodHljRjlvT25WbWQyZFBWVFp0Y0c5clVtbE1Za3BGVTFOeFQzYxAB
600,200294,ChIJFZVHDlCLGGARX7MIjfnuU_E,5,いぬはんぬ,2026-01-11T07:58:45.983Z,婚活はとても堅苦しいものだと思っていましたが、カウンセラーさんもとても親身に話を聞いてくださいますし、相談に乗ってくださいます。気持ちの整理もついて、素敵な人と出会えてよかったです。ありがとうございました✨,,Ci9DQUlRQUNvZENodHljRjlvT21sd1UwVkJhM0J0Y0RWSmRFVnZUR3RvYVVGRGEzYxAB
601,200106,ChIJmVgdtQpnH2ARdu-_QnyBkTE,5,S. I.,2026-01-26T09:42:54.164Z,,,Ci9DQUlRQUNvZENodHljRjlvT21SaWJYcEtVUzF3TTBSMlFXVnJSV2x1Umt4Q1RYYxAB
602,200105,ChIJp5nlLzQGVDURmt_1rH67o4U,5,守安将人,2026-02-08T03:26:54.972Z,親身になって相談に乗って頂きました！,,Ci9DQUlRQUNvZENodHljRjlvT21wa1EyY3hhVmxuUlVOcWNsWlljVU5WVVRGeFVuYxAB
603,200105,ChIJp5nlLzQGVDURmt_1rH67o4U,4,吉田翔一,2026-01-12T05:10:38.929Z,定期的に連絡いただき、適切にフォロー頂きました。お世話になりました。ありがとうございました。,,Ci9DQUlRQUNvZENodHljRjlvT21OR2RXdDBTRkp0YUhWd1lVVk9NVzl1VG5obVoxRRAB
604,200120,ChIJSY5rTBRcGGARv0PWjPdZwAk,5,名古屋コーチン,2026-01-24T06:29:21.665Z,"短い期間でしたがありがとうございました。
素敵なご縁に出会えたこと、生涯大切にしていきたいと思います。
担当者様、スタッフの皆様方にも大変お世話になりました。",,Ci9DQUlRQUNvZENodHljRjlvT21wRWVrSjFPV1puTlhab1FVSmlObWRXTTBwelQxRRAB
605,200120,ChIJSY5rTBRcGGARv0PWjPdZwAk,1,Xg7LpQ,2026-01-21T09:40:15.229Z,"自分には結婚は無理だと痛感させられました。
婚活が長引くにつれ、対応が遅くなりサポートが少なくなるのをはっきりと感じました。

相談のメッセージを送っても返信が来ない。回答に時間がかかったり、答えられない内容ならそのように返してもらえれば納得もしますが、音沙汰なしなので見放されてるんだなと感じざるを得ません。契約不履行です。",,Ci9DQUlRQUNvZENodHljRjlvT21OcGRHUkpVRFEyVlZseGIzWnFZekUzYlRaaFNYYxAB
606,200120,ChIJSY5rTBRcGGARv0PWjPdZwAk,5,のぐちゆみ,2026-01-18T06:08:23.908Z,"悩みや相談を事細かに聞いてくださり、いつも助けてくださってありがとうございます！！
素敵な出会いを繋いでくださってありがとうございます！
正直、まだこの先の事はしっかりと決まってはおりませんが自分達のペースで進めていきます！お世話になりました！！",,Ci9DQUlRQUNvZENodHljRjlvT210T1JHZGljVWRuVG14SFpHUXhVRXczZW1NMmNVRRAB
607,200120,ChIJSY5rTBRcGGARv0PWjPdZwAk,5,ゆき,2026-01-17T10:03:30.057Z,"サポートありがとうございました！
思い切って、入会して本当によかったと思います。
自分の時間、性格に合わせて導いてもらえたので無理なく活動ができたと思いました。感謝しております。",,Ci9DQUlRQUNvZENodHljRjlvT2s5bVpDMXFSa3BRTkRVM01sWnBVREl6YUdOeVowRRAB
608,200120,ChIJSY5rTBRcGGARv0PWjPdZwAk,5,Hibiki Yoshida,2026-01-17T05:12:38.861Z,私は千葉店で登録しましたが、相手が横浜在住だったので最後の挨拶に伺いました。スタッフの方のとても丁寧な対応に心が和みました。これから2人で幸せな家庭を築いていけるようにしたいと思います。,,Ci9DQUlRQUNvZENodHljRjlvT2xOeWVHaFZRbE0zYkhZeWIzUXdPSGg0VFVaRFRtYxAB
609,200120,ChIJSY5rTBRcGGARv0PWjPdZwAk,5,takuto ooka (大岡 拓斗),2026-01-17T05:04:56.511Z,"こちらで結婚できる人と出会えました！　アドバイザーの方の対応も丁寧でやりやすかったです
ありがとうございました、、、！",,Ci9DQUlRQUNvZENodHljRjlvT2pCMWJYVmFiM2xyWkc5S2EyMDRkVEJPV0hndFdsRRAB
610,200120,ChIJSY5rTBRcGGARv0PWjPdZwAk,5,Wizard 03,2026-01-17T02:49:32.052Z,"オーネットさんのおかげで素敵な出会いを頂かことができました。
ありがとうございました♪",,Ci9DQUlRQUNvZENodHljRjlvT21kdFIyOVNWRE0yVUMwMk1uTkpjVTVVYVdOeE1VRRAB
611,200120,ChIJSY5rTBRcGGARv0PWjPdZwAk,5,みち,2026-01-13T11:33:31.742Z,"昨日成婚退会の挨拶に伺いました。
様々な出会いの方法があり、アドバイザーさんが1人つき、担当として親身になって話を聞いてくださいます。お相手との連携がスムーズで、どう思ってるのか・気になる点なども共有いただけます。
自分に合った婚活方法を探せるのが利点だと思います。
アドバイザーさんは婚活のアドバイスから、自分の価値観や相手への気遣いの大切さ、自分探し、将来のことまで真剣に考えてくださいました。わがままも沢山言った気がします…感謝してもしきれません。
婚活はずっと楽しいわけではなく、どうしても辛い時期があるかと思います。成婚まで泣いたり笑ったりたくさんありましたが、アドバイザーさんがいなければ結婚せず退会してたかもしれません。
おかげさまで一生を添い遂げたい素敵な方と出会うことができました。これから両家顔合わせや引越し、入籍、結婚式と目白押しですが彼と楽しく過ごせたらと思います。
あの時、たくさんの温かい前向きな言葉をありがとうございました。勇気と自信を持てたし、頑張ろうって思えました。最後は幸せな嬉し泣きで報告と退会ができてよかったです。
たくさんたくさんお世話になりました。",,Ci9DQUlRQUNvZENodHljRjlvT2twNFJFZDZRM1pWVEVvelRVVlNXbVpsZUZwTlZGRRAB
612,200130,ChIJWdcihCW9BGARy1RqTtAD3c8,5,れは,2026-02-08T07:23:43.474Z,"最初は仕事も忙しくて、私のペースで活動してました。私が相談したいときに、担当者の山本さんがすぐに対応してくれました。
しゃべりやすくて、気軽にちょっとしたことでも、すぐ相談にのってくてました。
お半年ぐらで無事に成立することができました。ほんとに感謝してします！",,Ci9DQUlRQUNvZENodHljRjlvT201TFdqSXdVRjlGTUdObWVWRjBkMmhQVkZod2QxRRAB
613,200130,ChIJWdcihCW9BGARy1RqTtAD3c8,5,るさ,2026-01-11T02:17:49.960Z,"なんとなく入ってみましたが、すごく良い方と出会えて婚約者が出来ました！
色々と不安があったので親身になって相談のっていただきました。",,Ci9DQUlRQUNvZENodHljRjlvT2pKWVJuWndWRFV5TkZOWlFrNVlhVlIwV1dkaWRuYxAB
614,200135,ChIJDRjlMTipA2ARytmoHwz3kIs,5,鳥澤咲也子,2026-01-24T02:02:04.934Z,"学生時代初めて付き合った、4年9カ月お付き合いした元彼と別れ、心がズタズタでした。4カ月経ってこのままじゃいけないと思い、思いつきで結婚相談所に入会してみました。(マッチングアプリ、社会人サークル等あまり良いイメージがなかったこともあり。。)
緊張と不安でいっぱいでしたが、仲人のサポートが手厚く、半年で優しい素敵な男性と成婚退会できました。去年の年末、正式にプロポーズをしてくださり、今は幸せで胸がいっぱいです。本当に入会してよかった。。。感謝です！！！",,Ci9DQUlRQUNvZENodHljRjlvT2xORlQxZG1Wa3RQVjA5ZlQwbFBlbEJKZWt0WVZHYxAB
615,200135,ChIJDRjlMTipA2ARytmoHwz3kIs,5,神沢千尋,2026-01-18T04:31:12.573Z,恋愛ど下手くその私に愛ある叱咤激励をありがとうございました、おかげで素敵なパートナーに出会い婚約まで至りました。頑張ってよかったと思います。,,Ci9DQUlRQUNvZENodHljRjlvT2w5R09FSlRaVmQ1VHpKTE0yRmZkSGh6YW1zeE5tYxAB
