レビューID,施設ID,施設GID,レビュワー評価,レビュワー名,レビュー日時,レビュー本文,レビュー要約,レビューGID
586,14358,ChIJwzsD1ryPAGARpT6zVCxohp4,1,春日美奈子,2026-01-28T02:09:15.047Z,,,Ci9DQUlRQUNvZENodHljRjlvT21ONWNtVk5SM04yY2xJMFlYSm9VVzF3VEhoTFQyYxAB
587,14923,ChIJ3Za0cUAtAWARHFoneiEN36A,5,はぐれストーカー,2026-02-03T20:07:40.803Z,施設の目の前にローソンがあった為、暖かいコーヒーが飲めるのですごくよかった。,,Ci9DQUlRQUNvZENodHljRjlvT2t4aFNsTm1XVXRpWm1WUFdFeERTMlV6ZGpSd1QyYxAB
588,14532,ChIJqZXk18EtVTURo0uXwHYZaEc,5,Hiroshi Yamada,2026-02-27T05:11:17.347Z,スタッフの皆さん、専門性も高く、とても優しくして親切です。,,Ci9DQUlRQUNvZENodHljRjlvT2xkRFEwSnZZMmxqYXpoWFZHSjNSVzg1WlhWWVVWRRAB
589,14532,ChIJqZXk18EtVTURo0uXwHYZaEc,5,HIDE,2026-01-04T13:07:05.471Z,スタッフの方がとても親切でレクレーション等のイベントも充実しています。食事も大変美味しいようで、入居10か月の父もとても満足しています。,,Ci9DQUlRQUNvZENodHljRjlvT2tkbFJ5MXlhSGRsVWxWd1NVdHBVWGN0UTFsbVdIYxAB
590,14532,ChIJqZXk18EtVTURo0uXwHYZaEc,5,ayay u_u,2026-01-01T13:09:21.835Z,スタッフの皆さんがとても優しく、入居者とその家族に対して本当に親身に寄り添ってくださるので、とても信頼してお任せできます。,,Ci9DQUlRQUNvZENodHljRjlvT21vdGNWTlRXakprWkRKVmVFa3pOVkpwVmtobmNuYxAB
591,14532,ChIJqZXk18EtVTURo0uXwHYZaEc,5,222 aaa,2025-12-29T08:12:34.726Z,スタッフの対応が良く、両親が安心して暮らせる場所だと感じました。,,Ci9DQUlRQUNvZENodHljRjlvT2pneGQzTkphMDFLVTFSbk1qTlpURFV5TkRoMVZGRRAB
592,14318,ChIJ2ZkHI1SBAGARAz296LT9Px4,5,S T,2026-02-19T01:34:26.208Z,"ロケーションが良く、フロントからホテルのようで落ち着いた雰囲気で素敵です。
こんなところで老後は毎日過ごしたいと思えます。
スタッフの皆様の対応も親切丁寧です。",,Ci9DQUlRQUNvZENodHljRjlvT213eFVVZERNRWxJZW5CdVFYTkdUVEJmTmtSMlYzYxAB
593,14318,ChIJ2ZkHI1SBAGARAz296LT9Px4,5,松岡美智子,2026-01-29T06:42:43.701Z,,,Ci9DQUlRQUNvZENodHljRjlvT2sxellrMVZaazlMY0VWemEyTlhZbGxwWlhWRU1IYxAB
594,14318,ChIJ2ZkHI1SBAGARAz296LT9Px4,5,菅野祐子,2026-01-25T23:23:40.598Z,スタッフの皆様の雰囲気がとても丁寧で柔らかく、自分の家族に是非勧めたいと思いました。内装デザインも綺麗で明るく、とても居心地が良かったです。,,Ci9DQUlRQUNvZENodHljRjlvT25FMllVSmthRlZrZUZsSk1XWnZTVlZGTWkxSWFIYxAB
595,14318,ChIJ2ZkHI1SBAGARAz296LT9Px4,5,ケアタクシーむすび,2026-01-22T05:52:49.202Z,スタッフ様がとても丁寧でいつも親切なご対応をいただいております。,,Ci9DQUlRQUNvZENodHljRjlvT20wemMyb3hVVmhMUkRkc2NtRmpRVjlSZGpCMGVXYxAB
596,14318,ChIJ2ZkHI1SBAGARAz296LT9Px4,5,N Y,2026-01-17T11:34:42.434Z,温かい対応と清潔な環境で安心して過ごせる、家族も満足の施設です。,,Ci9DQUlRQUNvZENodHljRjlvT2paMGFYUjJOMlkxZEZadFpYaEJPVzFoVHpOM1VtYxAB
597,14318,ChIJ2ZkHI1SBAGARAz296LT9Px4,5,ハル,2026-01-07T03:41:54.913Z,館内が非常にきらびやかで、清掃も行き届いていて素敵です。美容室もあり、喫茶店のような催しもあり、色々工夫されています。,,Ci9DQUlRQUNvZENodHljRjlvT25oS05XcHVRVFppWjNSVVVUZ3pRblZITUVadlZYYxAB
598,15543,ChIJhYC0VgBbB2ARyaz-P_6StQc,1,Y T,2025-12-29T03:31:47.541Z,"個人情報保護法に違反している介護職員がいる。
思いもよらない方面から伝えられ不快な思いをした。",,Ci9DQUlRQUNvZENodHljRjlvT25WVldrdGpUWEJOTkY5aFF6VTBUa0pXZFhsV1JtYxAB
599,15427,ChIJ60i7Ipw2B2ARe0BXSDaIdeg,1,海腹葵,2026-02-20T16:16:07.531Z,,,Ci9DQUlRQUNvZENodHljRjlvT2w5NlkwTm9WR2xXVDJaNWMweHZYMVJ2UTA1elUzYxAB
600,15215,ChIJY14IgDrNBmARqFvPEXuYsQ4,5,田合厚子,2026-02-24T18:13:28.708Z,,,Ci9DQUlRQUNvZENodHljRjlvT2tadVQyODNZMlZvWm1Vd05FeG9XVEIzZFRGME5IYxAB
601,13966,ChIJM-HP8lz3AGARC0O24-e6lLc,5,中田友恵,2026-02-02T01:43:55.414Z,,,Ci9DQUlRQUNvZENodHljRjlvT21oR1h6QmtXbmRXUld0WWRtWktTRWhRZG5Gc2EzYxAB
602,15400,ChIJwWyzNgFRB2ARQjymh9oJNSE,5,びっくん,2026-01-04T12:09:13.995Z,,,Ci9DQUlRQUNvZENodHljRjlvT25odVYzVTRibUpFU1U0MFFWWkZTMHhJZWxoNU1IYxAB
603,15238,ChIJ4ZTDNoIvAWARCOq4JKMrNfw,1,レモンワッフル,2026-02-12T02:58:49.056Z,"こちらのケアマネは営利目的。介護される人の生活面を良く見れているとはまったく言えず。補助する意味が介護施設。ここは儲けるため。
思慮も浅くて、受付も手際が悪い。みてやっているという高飛車な態度。",,Ci9DQUlRQUNvZENodHljRjlvT25SV1QzTm1aRXRmVFRKMWRta3hUVVZCVTNoc1dXYxAB
604,13308,ChIJw3wm7u1HAGARtbn4SPtlZwk,5,M N,2026-02-25T01:24:13.921Z,"入居相談のため電話を入れましたが、非常にプロフェッショナルな対応でした。

こうした施設の電話対応は事務的なことも多いですが、こちらは電話口でも非常に感じが良く、こちらの質問に対しても即座に的確な回答をいただけます。施設側の都合だけでなく、入居検討者のメリット・デメリットをしっかり伝えてくれる点に信頼が持てました。

最初の窓口が良いと、現場の連携も取れているのだろうなと想像がつきます。候補の一つとして前向きに検討したいと思える施設です。",,Ci9DQUlRQUNvZENodHljRjlvT21wWGRtTlZOWGRYUzJ4RlpFOHhWM1ppVUd0S1dtYxAB
605,13308,ChIJw3wm7u1HAGARtbn4SPtlZwk,5,masakazu makino,2026-01-27T07:43:46.617Z,"@m.makino
親族の入居について悩んでおり、まずは情報収集のつもりでお電話したのですが、相談員の方の対応が本当に素晴らしかったです。

こちらの現在の状況や、言葉にしづらい不安な気持ちを最後まで丁寧に聞き取ってくださり、「まずは一度お話ししましょう」と優しく仰っていただけたことで、張り詰めていた気持ちがフッと軽くなりました。

施設自体の説明も分かりやすく、無理な勧誘なども一切なく、終始こちらの立場に立ったアドバイスをいただけて感謝しています。大切な家族を任せるなら、こうした温かいスタッフさんがいる所がいいなと心から思えました。",,Ci9DQUlRQUNvZENodHljRjlvT25WcWRWQTRRVXRCUW5RemQxWm1hbWt6ZFZOM2FtYxAB
606,14981,ChIJb7v5TAAvAWARsK5e2dZuHPI,1,やや,2026-01-11T23:55:04.530Z,"職員採用の問い合わせで電話しましたが、担当者が不在の為折り返しますと言われてから全く連絡なし。
オープンの時にも同じ問い合わせをして同じ対応。
そんなに採用したくないなら折り返しますと言わなければ良いと思います。
こちらは何日もかかってこないスマホを気にしながら生活しています。
とても不親切な会社だなと思います。
こういう施設には絶対身内を入れようとは思いません。",,Ci9DQUlRQUNvZENodHljRjlvT2pWNFYwdDNUazQ0YkhaNVkyZ3plbHA2UlVrMlYzYxAB
607,15000,ChIJqXGEH9YtAWARJNP5lUv-Ldk,1,原田かすみ,2026-02-07T05:59:38.869Z,以前、前の職場の同僚が転職にて大和苑さんで面接して頂きました。聞いた様子を全て述べますがミスト消毒や検温した後、来られた面接担当お二人の方がノーマスク！！片方はピアス！？。お二人トップの方ではなく代わりに頼まれたからなのか話の進め方と対応がこれまでの面接では笑顔なく質問攻めで低印象だったとのこと。更に、外国人職員入れても人手不足で残業多いですが出来ますか?そのお年で転職されるのはどうして！？体力ありますか?持病ありますか?よく遅刻されたりしますか?他のスタッフと上手く出来ますか?入所者の方に暴力はされませんよね？と何の確認！？的な質問が来た様です。求人出されてる割にウェルカムではない対応だなとも。苑内を案内されるも2018設年立にしてはレクの飾りも写真なく行事もないのか?！室内が暗いような印象。職員少なく入所者の方も寝てるのかフロアも少ない。玄関や建物周りに花や植物もない。採用か否かは後日連絡するとの事でしたが・・・数ヶ月後の今、彼は他でのびのびと介護してます。今回の話を聞いた私と面接した彼の心の内ををお察しして頂き、求人の意味と改善、環境改善、現場は人間関係や問題行動（就業時間や処遇改善、暴力の有無、スタッフの質など）は問題ないのか?！など今ひとつ確認と職員増員のアピール（SNS開設や地域交流するなど）に取り組んでいただければと。,,Ci9DQUlRQUNvZENodHljRjlvT25OaE9UQnViR3d3Y3pWb01GSmhSa3N0Y1dGUlZWRRAB
608,14147,ChIJ2ZZOInspAWARoYuf95z2ruw,1,doc hill,2026-02-18T02:14:25.328Z,,,Ci9DQUlRQUNvZENodHljRjlvT205cVlUZEJhVE5oVW05MU5VUTRkR3A1YWpneFJXYxAB
609,14464,ChIJgcQCtMHyAGARMa2Pk2F9f9w,5,Hugo Namba,2026-02-07T01:17:31.175Z,,,Ci9DQUlRQUNvZENodHljRjlvT2taaWVUTjJURkJRU1VZMlNHNW9jMjF0WTI1Q1MxRRAB
610,13712,ChIJ_z2JTXr7AGAR-Zo6IXCs5hc,3,辰己寛,2026-02-11T09:36:54.849Z,,,Ci9DQUlRQUNvZENodHljRjlvT2xwUU1qVnRlVVZmTVdneGNTMUhlREZMVG1GQ05FRRAB
611,14538,ChIJr6ZuxsJYAGARTXi-PoyCla4,3,Y's攻略ちゃんねる,2026-01-29T02:42:53.928Z,"地域のニュースにもなったが、対策は万全と言った利用初日から離設を起こし民家に侵入、警察出動して保護される。それに3時間気付かないってあり得ない事故が多い。
フロアスタッフも1～2人の日もあるので、サービスそのものに無理があるのでは？",,Ci9DQUlRQUNvZENodHljRjlvT25kblVGQnJPRlYxTWtadFkxUkphbXBzYVZsNWFrRRAB
612,14367,ChIJwf7jlhmOAGARb9gQ5EfPokY,1,田代道弘,2026-02-24T23:45:27.401Z,,,Ci9DQUlRQUNvZENodHljRjlvT2tKSWNWUTRWMHRFWTAxUmNtdE1jMkprV0dGbWFsRRAB
613,13650,ChIJLSEjAosnAWARYSPom1hy9sc,5,白井信行,2026-01-01T07:25:53.561Z,,,Ci9DQUlRQUNvZENodHljRjlvT2s5VFVqRnhjMngwUVRONmQwZGtTbGRyT1ZreGNYYxAB
614,13994,ChIJX9nLThy3AGARwhRTjkln27c,5,春のせい,2026-01-18T00:50:17.295Z,"お世話になっています。
2026/1/18現在　面会が予約制なのが不服に思います。前日に予約しないといけない。急に時間が出来る事もありますし、連休など急に面会したい時もあります。特に三連休前なども三連休中行きたくても土日祝は面会予約不可と条件がありすぎます。他施設は予約なしの面会しています。抑止力にもなりますし、家族がいつ面会に来ても良い様にしてほしいです。",,Ci9DQUlRQUNvZENodHljRjlvT2s0eFpFdHVOV0pzVjJSc1NFbE1OSGxaVGpOVVRIYxAB
615,14423,ChIJbxu7JBTuAGARHttPAaafrKc,5,FIK_ fatih abdulloh al jibril,2026-01-23T15:44:20.936Z,Amazing experience,,Ci9DQUlRQUNvZENodHljRjlvT2xsUU5VVmhXRzFsVUhOUGRqZ3paRmRUZVdKbVIwRRAB
616,14361,ChIJ1WYLw46OAGARqRHUQO56Llc,1,T S,2026-01-26T00:56:30.187Z,"星1もつけたくないぐらい。
働いてる人の態度がごみ。",,Ci9DQUlRQUNvZENodHljRjlvT2pVMU1rMWpkbkZNZURjNGEzZGxRV1JLZEc1blNuYxAB
617,13862,ChIJK2CjWLniAGARPz4u7nNnxHk,1,太郎よぴ,2026-01-04T00:25:46.982Z,おすすめできません。母がお世話になりました。職員も大変でしょうが雰囲気はあまりよくなく、質の低い人も多いです。元気な時はいいですが弱ってくるときめ細かい対応はできないです。,,Ci9DQUlRQUNvZENodHljRjlvT2xoc2FIZE1SRUo1TXkxeFIxTnVXa3RUYW1obFIzYxAB
618,14391,ChIJzT5C5k7eVDURw7Ct20WTwZA,5,猫のいまこ,2026-01-31T02:16:11.837Z,優しい理事長　大西修二さん,,Ci9DQUlRQUNvZENodHljRjlvT2pjNFowRXdNMWxCU1dKclpESlVlRU5KZWs5emNWRRAB
619,13902,ChIJe_4bRhLXAGAR4M16SEh2jsA,1,きょん,2026-01-08T05:52:46.746Z,"ここはおすすめしません
認知症の具合の悪い入居者をを病院にも連れて行かず亡くなったあとにはご家族に老衰といいのたまった
最悪な施設
死人に口なしとはこういうことです",,Ci9DQUlRQUNvZENodHljRjlvT2toWGJUUnllbDlHVGpaSlEyMHlUbXhGZUcxTVRrRRAB
620,14393,ChIJrzmlUP_fVDURGhSAQo-Ruv0,5,hikaru s,2026-01-13T12:55:32.593Z,,,Ci9DQUlRQUNvZENodHljRjlvT2xCTFVtaFBVekZsTWpReU9YY3lNR0pwTmpKRVRHYxAB
621,14224,ChIJ0x8nqiQqAWARF-2bhLzrMks,5,ANTOKINOJO,2026-02-05T08:21:23.368Z,職員一人一人が優しく接してくださり、明るい雰囲気でした。,,Ci9DQUlRQUNvZENodHljRjlvT2xKWU1GVnhOSGxqWVc0MWIwTTVXRE5RVWtkTGJtYxAB
622,13363,ChIJLwLnDf_gAGARakpJThi4MgU,1,文伸,2026-01-15T02:28:16.240Z,,,Ci9DQUlRQUNvZENodHljRjlvT210QlExUXliVlZ1Y2xsVVVqaFdZbUptTTJ0WVFsRRAB
623,12748,ChIJ8TNMRqp2AWARDC5phiq2a1g,1,えーわい,2026-01-09T11:25:12.363Z,ここはほんまにやめといたほうがいいです,,Ci9DQUlRQUNvZENodHljRjlvT210VmVUWjJWVzVxUVdoWlNYRm5SMDkzWkZobldFRRAB
624,13071,ChIJj9l5xrUIAWARcs0fwi_G3fw,5,Mt,2026-01-23T12:22:29.821Z,,,Ci9DQUlRQUNvZENodHljRjlvT2xwNWRqVnlXbmxSWVZGUVprdHBaMkZ0WWpCR0xXYxAB
625,13833,ChIJlR_2eADZAGARt9kYs3JngQc,5,中田伸二,2026-01-27T05:05:34.272Z,スタッフの方が親切で安心できます,,Ci9DQUlRQUNvZENodHljRjlvT2poRU9WUmFMUzFKTTFKYVJEQndlazVmUTNkQmFFRRAB
626,13890,ChIJw5bWOWvXAGAR7NtVxgG0lqA,5,平尾公輔,2026-01-09T04:33:55.286Z,,,Ci9DQUlRQUNvZENodHljRjlvT2toTGVTMXFjRWhYWVZadWJGVnVZbHAyVVdOQlRWRRAB
627,13890,ChIJw5bWOWvXAGAR7NtVxgG0lqA,5,とよ子,2026-01-01T21:12:39.947Z,,,Ci9DQUlRQUNvZENodHljRjlvT2w5blprVm1jWEpCVmpWd2NGYzFZV2N5Tkc0NFVrRRAB
628,13890,ChIJw5bWOWvXAGAR7NtVxgG0lqA,5,ひーやんとらきち,2025-12-29T05:15:03.942Z,"鬱から認知症になった母がお世話になっています。
入所時よりも元気に明るくなり家族みんなが驚いております
外出も外泊も自由に出来ますし施設内でイベント等も頻繁にしてくださってます
スタッフさんもとても優しくて
母は安心して過ごしているようです
ほんとに感謝です。ありがとうございます。",,Ci9DQUlRQUNvZENodHljRjlvT21SSVJYbzJXVlpyZUhWcGVWVkZkR1ZIU1d0cmNWRRAB
629,15407,ChIJ5WWU9dMrB2AR2JIGOTN-N2A,5,ドローンマークス,2026-01-08T16:55:29.843Z,施設のスタッフさん含めいつも真摯に向き合ってくれました。,,Ci9DQUlRQUNvZENodHljRjlvT25jNUxXcGpXSEpEWkdzeVMzaFFjMkpwT1dkUFpIYxAB
630,15245,ChIJVVV5KgYyAWARuKNZJWNaBwM,5,西見義樹,2026-01-09T08:05:46.620Z,"母がこちらでお世話になっています。通い始める前は「膝が痛い！」「腰が重い〜」と口にすることが多く、外出も億劫そうでしたが、最近は驚くほど関節がよく動くようになり、家の中を歩き回っています（笑）。本人も「体が軽い」と実感しているようで、表情まで明るくなりました。笑
施術だけでなく、ものづくりや作業の時間もあるようで、それがとても楽しいらしく、「今日はこんなのを作ったのよ」と嬉しそうに話してくれます。体を動かすだけでなく、気持ちまで前向きになれる場所だと感じています。
年齢を重ねるとどうしてもできないことが増えていきがちですが、ここに通うことで「まだできる」「やってみたい」という気持ちを取り戻しているようです。家族としても、元気に歩き回る母の姿を見るのが何より嬉しく、安心してお任せできる場所だと感じています。",,Ci9DQUlRQUNvZENodHljRjlvT2pOVlRYZFlOVWR0VlhOVWFHSmZWM2R2UTNBNGFGRRAB
631,15417,ChIJQfkPxwbWBmARy0SGkgHZ1dQ,1,kazuhito kimura,2026-02-08T12:49:36.892Z,なんと言うか •••,,Ci9DQUlRQUNvZENodHljRjlvT21WT1JYWTRXRmc1Ylc5TFRGQlRYMFJQVERac2EyYxAB
632,13138,ChIJQxWWp-YWAWARwOnrtJU7T4A,2,子無,2026-01-22T00:53:58.182Z,,,Ci9DQUlRQUNvZENodHljRjlvT2tvNWNWUkxjRWM1ZERWakxYcHhhUzFuVFhOVU9YYxAB
633,15873,ChIJJav-TthdVjURq8QrsNVgVpw,5,サビネコ,2026-01-22T05:26:28.167Z,,,Ci9DQUlRQUNvZENodHljRjlvT21STWREUjFaSFZhYUhWVFgyUnFaM2w0ZDNaR2RsRRAB
634,15730,ChIJN2il3TrZVTURsbJj5OHtA8Q,4,c c,2026-01-22T04:58:23.242Z,,,Ci9DQUlRQUNvZENodHljRjlvT2xSbk5WRkJhMkZwY0U5RE5VWlpWbTFWTFVkU2VHYxAB
635,15711,ChIJKWHdy8feVTURbZ0y1qv_eKA,5,新田江美子,2026-01-08T08:02:27.514Z,,,Ci9DQUlRQUNvZENodHljRjlvT25wdE5YQmhWMjV1VTB3eVlVTnNRV3hZYjJ0Sk0zYxAB
636,15892,ChIJQxR8heReVjUR56hG8jdALQo,1,山根のぶこ,2026-01-23T09:43:25.255Z,,,Ci9DQUlRQUNvZENodHljRjlvT21KV1FtRlpVRVpNUkRKRlpFTnJTek5pTTJOVGRtYxAB
637,15870,ChIJLcjKh4BYVjURGy2Bi0ayqnA,1,ダンディ,2026-02-23T05:46:33.902Z,,,Ci9DQUlRQUNvZENodHljRjlvT25OdWVVdFJPR2R3ZFc5Mk1WWjRVVGxVVDNKUWRrRRAB
638,16246,ChIJE9GrIvH2UzURhrTJEBuclkU,1,a m,2026-02-11T12:25:26.349Z,,,Ci9DQUlRQUNvZENodHljRjlvT25kWmIyOUNZV3BGYjFaVGRIbENTSHBYU0MxNllVRRAB
639,16095,ChIJVw-gcP8SVDURnR9p3L4gA-U,4,柏尾依子,2026-02-08T18:14:25.777Z,"母親が骨折後縁あり入所し一年、度々面会に行きますがースタッフの毎回忙しいなかでの笑顔の応対には、感謝します。
おかげさまで、心静かに毎日リハビリや好きな脳トレなどしながら過ごせて、安心して家族親戚も生活できますー
本当に入所でき穏やかに元気にすごせて、スタッフの方がた
有難うございます。",,Ci9DQUlRQUNvZENodHljRjlvT2paaU16WjBZbkpXZFZJemIyZEtRV2hWYldFMGVXYxAB
640,15724,ChIJPXrxwjrZVTURHifYDUKv1Zw,1,ホコホコボコボコ,2026-01-13T20:08:09.943Z,"モラハラがあって、辞めてしまうは人が多いから、よく求人が出ているみたいと聞いたことがあるけど、人員確保したいのであれば改善した方が良いのでは？
今だけの事を考えず、長い先のことを見据えて。他の職場は、ずっと前から人員確保に努めているのに。",,Ci9DQUlRQUNvZENodHljRjlvT25CRlZFaFNSbmRUVjBjMkxVMXhYMFJzYzBWMk4xRRAB
641,16075,ChIJCzK_cDEPVDUROnEM_lWvtjk,5,山めぐ,2026-02-23T01:25:00.315Z,"見学にいかせてもらいましたが
玄関からとても清潔感があり　とても明るく　ステキな感じでした。",,Ci9DQUlRQUNvZENodHljRjlvT2xGQk5tRnhUV2xpZFdsSFRGTlJTVTFZUzE5bU9GRRAB
642,16075,ChIJCzK_cDEPVDUROnEM_lWvtjk,5,広畑美歌,2026-02-18T07:40:08.124Z,,,Ci9DQUlRQUNvZENodHljRjlvT21NdFpFTlViVTV0UkZsMWRqRXpabFJ5WHpWRmRsRRAB
643,16075,ChIJCzK_cDEPVDUROnEM_lWvtjk,5,tutu,2026-01-03T22:32:58.125Z,,,Ci9DQUlRQUNvZENodHljRjlvT21jemRucHJTSHBJYTJZMWJsaHRUV2t4VVcxM0xVRRAB
644,16299,ChIJbdQAAtsvVDURHQkNxx0wY78,1,ma mi,2026-02-26T12:57:02.355Z,"田舎なので、対応に限界があったのかもしれませんが…入所させた事を…とても後悔しています。

職員の対応援助技術がなっていませんでした。分かっていたら…入所させていませんでした。もう…後悔しかありません。

終わり悪ければ…全て悪し…本当に悔やまれます。あまりお勧めしない施設でした。",,Ci9DQUlRQUNvZENodHljRjlvT2pGMmRHSmFUVkJJVFVWblpERkdiVFYzVEZVMWJsRRAB
645,16928,ChIJ6QvNsb8TUzURZQ60Zw6waMA,5,みっく,2026-01-10T22:44:13.469Z,穏やかな施設です。利用者様のことを考え、ゆったりとしてます。スタッフも利用者様のことを一番に考えてます。母親も施設が必要になれば一番にこの施設に入れてあげたいです。,,Ci9DQUlRQUNvZENodHljRjlvT25CVWJIaHRSREZCVGxCNVMxRTNlV3cwUkVob2FsRRAB
646,16693,ChIJd4s3FUaXRDURU-3h1029uvA,1,bambini,2026-02-12T23:37:52.781Z,電話対応で居留守など行い電話の繋がらない地域にいるなど意味の分からない嘘を平気でつく社風のようですね。このご時世携帯電話繋がらない場所へたまたまいる方が難しいと思いますけど。,,Ci9DQUlRQUNvZENodHljRjlvT2tkT1dFRjJSSFJETXpGV2NIcGFiV3RrUm10aGRHYxAB
647,17063,ChIJA9Wln38KUzURFM5uYFRPNdQ,1,ジョウ,2026-02-12T06:00:49.046Z,人によって接客スキルが大分当たりハズレがある、非常識な態度をする人間が一名いる。立場が偉いのかどうか知らないが挨拶くらいすべきでは？,,Ci9DQUlRQUNvZENodHljRjlvT2xCZmNWZFVaelZsVWsxbFNUaHVXa05uTUhWWFZGRRAB
648,16084,ChIJ-1WzDeITVDURthgVCgUI7NE,1,彷徨い人,2026-02-17T07:51:35.855Z,職員の感じが悪い,,Ci9DQUlRQUNvZENodHljRjlvT2paeVEyRm1SV2cwZDFGSk1qWjFTMjlVTm5od2VrRRAB
649,17276,ChIJvThW6v7pUzURJrvGgcY9Ns4,5,うどんの国の下手の横好き,2026-02-20T23:49:05.391Z,,,Ci9DQUlRQUNvZENodHljRjlvT21RMGVGbGlRWGRvVVdwTWFFOWZhRzVSYWxaaU9WRRAB
650,17276,ChIJvThW6v7pUzURJrvGgcY9Ns4,5,- king k,2026-01-15T09:25:52.771Z,,,Ci9DQUlRQUNvZENodHljRjlvT2tkRFl6azJiMnRMVG05MVRYcHNaa2R5Y2tWTmVWRRAB
651,17556,ChIJd5GCdpGDRTUR3TjqJwXmXuo,4,9.3 SAAB,2026-02-12T04:21:26.575Z,いつ面会に行っても綺麗。施設独特の臭いもないし、スタッフの方は皆さん親切でした。,,Ci9DQUlRQUNvZENodHljRjlvT2kxc1VXWnpWVk5vZVdFMmVXcGxTVlJxV1UxemNFRRAB
652,17539,ChIJkyJJ8knOUTUROMI_nhnI4O0,1,ねこまるん,2026-01-25T08:55:00.518Z,,,Ci9DQUlRQUNvZENodHljRjlvT2xWT1lXdzNlVjlGZEhoNk4ydE9jVzFvU1dwV1lrRRAB
653,17539,ChIJkyJJ8knOUTUROMI_nhnI4O0,1,Nessy Oktaviana,2026-01-08T14:05:27.639Z,,,Ci9DQUlRQUNvZENodHljRjlvT2tFd1gyWkJZbFp4TjNsRmRVOWlUblZJWlY5TFFsRRAB
654,17539,ChIJkyJJ8knOUTUROMI_nhnI4O0,1,piola arsya07,2026-01-08T12:54:52.116Z,,,Ci9DQUlRQUNvZENodHljRjlvT2tkMlEzUkZiekk0T0hsblEwcERlVGRPT0dsWFJGRRAB
655,17315,ChIJxcpd-QDcUzURzXBWhhUVu3Q,3,好井博文,2026-02-09T04:56:00.446Z,,,Ci9DQUlRQUNvZENodHljRjlvT21WWmFWcHdRVWc0V1ZGbVVGUjJVMUJaU0ZkbE1VRRAB
656,17423,ChIJG45nTSiTUzURMCF1hf41Dag,2,千馬章吾,2025-12-30T14:48:26.186Z,,,Ci9DQUlRQUNvZENodHljRjlvT2tKUVZIZHJWbkZ1YXpoT2EyVm9kVjl3YUU5U1dIYxAB
657,17290,ChIJVVVJa5h9UTURLJwSBeqKRu4,5,行天文爾,2026-01-08T11:11:13.545Z,,,Ci9DQUlRQUNvZENodHljRjlvT2tGU1prSjFMVmhUTnkxRFJsa3hiWHBOYVd4Mk0xRRAB
658,17578,ChIJWc4KYH4vUDURkd2vWXTy72k,4,田中浩三,2026-01-12T08:23:48.154Z,,,Ci9DQUlRQUNvZENodHljRjlvT25KTVIydFdTRUpvYzNSUFIxRk9OV0ZaU1RRM01FRRAB
659,17524,ChIJoQIoszXuTzURBIouYsBAV4I,1,사이온지쿠루미,2026-01-30T06:57:43.188Z,"7686を運転してる白髪の高齢男性？の白い車が後ろから私の車にぶつかりそうになった。私はウインカーをかなり前から出してた。
1701の白い車の中年男性の運転が荒い",,Ci9DQUlRQUNvZENodHljRjlvT21OeGNIUkNVVEZFUkhkallWQnRkbkJmVkMwMlZuYxAB
660,17676,ChIJBXcs962cTzURc4lbV9LnNN0,3,山崎健一（yamaken）,2026-02-12T02:30:27.399Z,以前、デイサービスのクラフトでうちの祖母👵が作った作品です٩(ˊᗜˋ*)و,,Ci9DQUlRQUNvZENodHljRjlvT2w5SlJ5MDJSSEJVVHpoUFkzWlJPRTV2UzJWbWVFRRAB
661,16653,ChIJ59_rL80YRTURRFolSOQ9zvA,1,kin 159,2026-02-09T08:19:08.946Z,,,Ci9DQUlRQUNvZENodHljRjlvT2tWcU5WbGljVEpHTlVaVk1XOW1TakZVZWpJeFYyYxAB
662,17538,ChIJTR3ikuTFUTURRFlLJjVQjy0,4,秋山嘗一,2026-02-10T02:39:13.556Z,,,Ci9DQUlRQUNvZENodHljRjlvT21jMVFsWkNRbmhzV1RSd1dVSlZjbkZJVUcxeVowRRAB
663,15881,ChIJqS2t-jBvVjUR10zb2TTgf34,4,まるも,2026-01-07T01:29:40.299Z,,,Ci9DQUlRQUNvZENodHljRjlvT2xKSU56VkZhRFJLYlZNeVMzaG9kM04yYzFVMVRWRRAB
664,17688,ChIJzbQJam_uTzURGdMFfDetv_Q,5,NUR ROHMAT SYAIFULLOH,2026-02-13T12:41:19.339Z,,,Ci9DQUlRQUNvZENodHljRjlvT25sNWVtc3RTalkxTURSUU1HdzFWa0pKUmxKVFNYYxAB
665,16060,ChIJb4qT_kL_UzURxKfmi_euP8Y,5,おしん,2026-01-11T05:55:42.655Z,,,Ci9DQUlRQUNvZENodHljRjlvT2kxWFkyd3dOVWwyWldJdFExQndSWE5IVGxCZmFWRRAB
666,18002,ChIJGzk2JGsdTjURjhXknqOZJkE,1,カープ愛,2026-02-06T09:38:01.118Z,"ふるさと自然村の管轄下にある、高知市の有料老人ホームあっとホームで、去年４月に起きた医療事故によって、私の母が寝たきりになった❗❗
令和７年４月８日火曜日、母は歩行器をつきながらも、自分一人で歩いていた。この日あっとホームの中にあるデイサービスセンターで具合が悪くなり、こうち在宅医療クリニックに往診を依頼し、脱水症状で点滴を開始。訪問看護アムールが点滴を担当した。
問題はその事を誰も家族に連絡しなかったことだ❗
デイサービスセンターの職員、医師、訪問看護アムール、あっとホームの職員。
私は４月10日木曜日夜母に電話してみたら、なんか様子がおかしいと思って、電話を切ってあっとホームに電話をすると、「火曜日から点滴してます」と初めて知った。向こうから連絡して来たわけではない。こっちから連絡して初めて知ったのだ。
明くる11日の金曜日の朝早く、あっとホームに行くと、母は足が立てなくなっていた❗
久病院に入院して、以来寝たきりである。
点滴を３日続けていて、高齢者には寝たきり予防のリハビリが必要で、そのような環境にないあっとホームより、家族の私に連絡してくれてたら、より良い医療環境を選んでいただろう！
悔しくてたまらない。
あっとホームを管轄下におく、ふるさと自然村の理事長に責任を追求しようと、この2.３週間電話をするも留守、勤務しているかえるクリニックにも電話して、折り返し電話をくれるよう頼んだが、なしのつぶて。
南国市にも県にも訴える。
私はあきらめません。",,Ci9DQUlRQUNvZENodHljRjlvT2pJMGVIUmlYekUyY0ZkcFRWbHhaRGhoU0ZwS04zYxAB
667,18191,ChIJTbZHkR3IQzUR3nOE2MNoGaU,5,K,2026-01-28T04:16:29.464Z,"建物も室内も広々としていて綺麗です。
一人一人の個性、興味のあるものなどを皆さんで考えて頂き対応してくれました
ベットの配置なども細かく変更して頂いたり入所者本人もですが家族にも寄り添い相談にのってくれました。",,Ci9DQUlRQUNvZENodHljRjlvT2xWRVRuTnFVRW8wU2t0cFNYRjVWMlJpYTFCaFVFRRAB
