レビューID,施設ID,施設GID,レビュワー評価,レビュワー名,レビュー日時,レビュー本文,レビュー要約,レビューGID
1549,46738,ChIJl98Vw2iFGWAR4GWmMZSHPu4,1,ねむり姫,2026-01-31T08:18:49.442Z,"信号無視して突っ込んで来た車がここに入りました
皆さんはここの車に気をつけてください",,Ci9DQUlRQUNvZENodHljRjlvT2xneWJscG9URVJvU1RCamJIb3hVRmxFYmw5RFJYYxAB
1550,46798,ChIJ0zoSZNjdGWAROS_PqI4Pg2o,4,ryo,2026-01-29T17:51:51.261Z,"見た目に違わず古いお宿でしたが、掃除はきちんとされており、何よりもご飯が素晴らしかったです。特段変わったメニューではないですが、温かいものが温かいままで提供されるので、大変満足できました。火の入れ方も素晴らしかったです。
浴場も広く洗い場も数があるため、よほどの繁忙期でもなければ混み合うようなことはなさそうです。
特別ではないけれど良いお宿です!!",,Ci9DQUlRQUNvZENodHljRjlvT25aaVkwRjNVMjB4TTFkd2VVODVVVkUwV21wNFYxRRAB
1551,43471,ChIJ8WrlvKvN9l8R6_yHMHq4nv4,5,栗本吉典,2026-02-05T08:21:26.955Z,,,Ci9DQUlRQUNvZENodHljRjlvT2t4b1dXRlRVM05RZFdsU1VqSkVkVmQzUjJJeFNuYxAB
1552,45201,ChIJgYxhOd2aHGARZdAj34Q8iUo,5,仲川正博,2026-01-24T02:52:36.953Z,,,Ci9DQUlRQUNvZENodHljRjlvT25SWk0zWmxlbmhWUm1WWlZHWXRXSFZHZFRoVlRsRRAB
1553,46572,ChIJH37mPTXeGmARN68Q4SBWvPY,1,Aries,2026-02-04T05:37:52.349Z,"以前こちらから着信があり、知らない番号だったので調べたところ介護施設だったので、利用者さんのご親族に用事があって間違えていたら大変だと思い折り返し、番号が間違っている旨をお伝えしましたが、その後も別の時期に3度ほど間違ってかかってきました。
その都度、間違っていること、以前にもそうお伝えしていることを伝えました。
それ以降はないですが、緊急な用事だったら大変では無いですか？
気をつけられた方がよいと思います。",,Ci9DQUlRQUNvZENodHljRjlvT2xoelZEbHRWM0JIUWtKMVNqRm5ORmRvTURGdVdVRRAB
1554,45833,ChIJEThN7dGpA2AR8RoVr6lEIIU,5,桜庭飛鳥,2026-01-26T01:11:53.465Z,祖母がお世話になりました。糖尿病に加え認知症も始まり沢山ご迷惑をおかけしましたが、スタッフのみなさんに寄り添った対応をして頂き本当に有難かったです。,,Ci9DQUlRQUNvZENodHljRjlvT25wdU4xWktjMHQ0UVdSZlNrZENkM3BKYkdoZlJWRRAB
1555,45833,ChIJEThN7dGpA2AR8RoVr6lEIIU,5,_ koharu,2026-01-15T09:25:51.087Z,綺麗な設備、自由な外出、そして温かいスタッフ。ここを選んで本当に良かったです！,,Ci9DQUlRQUNvZENodHljRjlvT25obVdqVkhRa3QyYTJKTlFVNDJhSE5HVFdZNWIyYxAB
1556,46513,ChIJ-duC_lnfGmAR5qrgxez9XRQ,5,えつこ,2026-02-24T13:15:08.534Z,"先月、お世話になりました。あずきもち店の皆さんは優しくて、いつも低姿勢で接してくれました。まるで自分の家にいるような落ち着いた場所で大好きな母と過ごしました。式では喪主を務めましたが、知識のない私に細かく教えていただきました。
日が少し経ち、今思えばあずきもち店で良かったと思います。感謝しています。ありがとうございました。",,Ci9DQUlRQUNvZENodHljRjlvT2poVUxUTnJTekZKWVY5cllsbG5WMlJVVWt3d2VsRRAB
1557,45953,ChIJRUwiRRhBA2ARBZPTv1e8ja4,1,問答無用因果応報,2026-01-28T10:28:24.674Z,,,Ci9DQUlRQUNvZENodHljRjlvT25adlMyRmtVMUYxYzJKaVNsWkRWVEZ3WjFBd1gzYxAB
1558,46059,ChIJFYDnT4o0GmAR-7Mq6dVq8vo,1,櫻井寿美,2026-01-28T03:53:23.455Z,"私の駐車場に迷い無く駐車しようとしている車が有り、確認するとあすなろの家の送迎車だった。
そして利用者を降ろそうとしている所で私がクラクションを鳴らすと慌てて車を道路に移動して利用者を降ろしていた。
何時も昼間は駐車場が空いているのを知っている様子。
毎回使っているんだと確信した。",,Ci9DQUlRQUNvZENodHljRjlvT2t0eldFZFRWRlY0VVRsSGRtZzBSa3R6YTJOVVRIYxAB
1559,44680,ChIJaUXHcsP5G2ARunwuM5PhG3Q,5,あいうえお,2026-01-05T02:50:02.614Z,"ショートステイで何度か利用しています
職員の方々が優しくて、安心して利用できます",,Ci9DQUlRQUNvZENodHljRjlvT2pVMVJGUnlWMEpxTTJOaWVqTmpSemhwWkhBMlMxRRAB
1560,45082,ChIJ9eK9mbCQHGARalcRlAmMlYg,5,Takeuchi Takeuchi,2026-02-16T07:38:12.108Z,,,Ci9DQUlRQUNvZENodHljRjlvT2tkUk9UUTJaVkZ4VWtscVluTjVTR2hWZW1ab01WRRAB
1561,46757,ChIJSdKgiTGFGWARC_OyVh8Rfj8,1,cres1629,2026-02-25T05:49:05.879Z,,,Ci9DQUlRQUNvZENodHljRjlvT2tocVZHdDRjemQ1VmxCaVZEa3plbkZJVnpodVIxRRAB
1562,44011,ChIJ2aQf__7eAGAR8k7UouMrtjs,1,21さい,2026-02-18T14:01:33.335Z,いつもありがとう!,,Ci9DQUlRQUNvZENodHljRjlvT2pkbWJHYzRUalowTURKTFoxOU5VMWxzVjNaMU5XYxAB
1563,46487,ChIJezKIdIwnG2ARWZ23e2tqJao,5,鈴木昭子,2026-01-02T06:23:57.756Z,このお正月、元旦に飛込みで見学をさせて頂きました。帰省中ならとご配慮頂きました。施設は静かエリアにあります。建物は非常にきれいで、お部屋も全て個室です。所長さん、担当の介護職員の方のご対応が素晴らしいです。サービス内容がこちらの希望にピタリです。医療との連携があり、また日々の見守りと安心です。なにより当事者の母がすぐに気に入ってくれました。見学から2日で申込に至りました。有り難うございました。,,Ci9DQUlRQUNvZENodHljRjlvT2psWU4xWTRaMUJVVDAxMGNtdHpUbmRZWlZGRmVYYxAB
1564,45896,ChIJPWZxqfgQA2ARq8UWm6pELYo,1,ひろにい,2026-02-27T09:53:57.389Z,"障害者に合わせた寄り添い方が出来てない！
障害者の苦情など何も聞き入れてもらえません。",,Ci9DQUlRQUNvZENodHljRjlvT2t0cmJscG1VVnB3VG5sVU5qZGFaMmxWUm5KaGVFRRAB
1565,45852,ChIJuf23th5NAmAR5CGhE0MgCRc,4,越前朝倉氏の末裔,2026-02-17T12:14:45.009Z,,,Ci9DQUlRQUNvZENodHljRjlvT21Wb2FscHVOalZTUVZWalZ6Rk9WV1J4Y1dGVGFrRRAB
1566,45852,ChIJuf23th5NAmAR5CGhE0MgCRc,5,8代目フレディ,2026-01-05T10:24:02.004Z,"家族経営でとてもアットホームな雰囲気です。
岐阜周辺は老犬ホームも限られているのでここを選んで良かったです。",,Ci9DQUlRQUNvZENodHljRjlvT21WeVNFbGFPV1pxVlhaWFZYRnJjV2N0ZWxFMWVVRRAB
1567,45963,ChIJ__9v1pwIA2ARqfFjoo-G314,5,Septi Ayuna,2026-02-05T11:50:46.563Z,,,Ci9DQUlRQUNvZENodHljRjlvT25ReFJEZFNkRWxRYmxNeFJUVkZialZ3VEhoalpXYxAB
1568,46638,ChIJiabSVCIfG2ARxbEb3XBeUbM,5,稲生有香,2026-02-23T01:08:46.088Z,,,Ci9DQUlRQUNvZENodHljRjlvT210Q1VEZFJUakYxTUdoWGNtSTBVa3hsWVhONlFWRRAB
1569,43215,ChIJLx0xLfpU9l8R9rwY7bpo6iQ,5,ぴよぴよ,2026-01-20T08:27:25.586Z,"受付時間が過ぎてしまっていたことに気づかずそのまま入ってしまいましたが快く受け入れてくださり、ありがとうございました。
気さくに丁寧に話しかけてくださる看護婦さんばかりで癒されました☺",,Ci9DQUlRQUNvZENodHljRjlvT2pOR1p6ZGZSblkyUVZScFRreHJOMnhGVTNwNFVGRRAB
1570,46289,ChIJa2iE2cw1GmARMKPsd6xClYA,5,武藤琥珀,2026-02-01T09:20:13.712Z,,,Ci9DQUlRQUNvZENodHljRjlvT2pKTlVGOHdOVEJIU0ZkYUxXTlBTemRYVlVWdkxVRRAB
1571,43987,ChIJo2BRHsMEUTURgOGl45E06kY,1,J Y,2026-01-14T07:25:50.328Z,ここは神原病院の治療を受けさせられるための籠です。検査と言われて入院したのですが、説明もなく治療に検査に透析。面会は月一回。医師からの説明はなし。あっという間に寝たきりになり、このままでは危ないと思い転院させましたが間も無く亡くなりました。この施設には一月もおりませんでしたが敷金含め4ヶ月分支払いました,,ChZDSUhNMG9nS0VJQ0FnTURBeHJDVk93EAE
1572,45904,ChIJM_MkFj2tA2AR8z-DmDWK-qY,1,森亜るるか,2026-02-22T08:34:31.947Z,イオンに行ったら和光会が妙なイベントをやっていました。素通りしようとしたらしつこく誘われて。正直いって大変迷惑でした。,,Ci9DQUlRQUNvZENodHljRjlvT2xkd1VUbHhSVEEwWTFGelJrRnhUM2hHTTNKNVowRRAB
1573,45904,ChIJM_MkFj2tA2AR8z-DmDWK-qY,2,小林みくる,2026-02-04T03:46:18.915Z,"友達がボランティア行ったら高級弁当をいただいたって✨
さすが和光会さん太っ腹です💰✌️",,Ci9DQUlRQUNvZENodHljRjlvT25GT1IzTjZjelEyWldKTmRuUXRTVEZrYlhGV1ptYxAB
1574,46116,ChIJBQU51io2GmARc3FlLzxVKjQ,1,うらん,2026-02-17T22:47:07.862Z,,,Ci9DQUlRQUNvZENodHljRjlvT201UFozTmpPWFpKT0ZkS1IzQk9VWFJFTUdjMldGRRAB
1575,46491,ChIJge6YCQDfGmARo_dkpwv4stg,5,H K,2026-01-23T01:27:02.154Z,"須山建設のシニア賃貸マンションです。
高級感があってとても綺麗な建物でした。",,Ci9DQUlRQUNvZENodHljRjlvT205Wk4xaE9SR3R1Vm1WQmJuZDNTWE5qYjBORVJHYxAB
1576,46167,ChIJB4VAv8A1GmARCmjjcET18GM,2,子無,2026-01-19T04:18:56.488Z,,,Ci9DQUlRQUNvZENodHljRjlvT25kaWFWRkRaVkV3UW1OUVNVUnFWM2xKYkRCNFNIYxAB
1577,46172,ChIJQ1ZD_Jk1GmARFHHLTgTbyPc,3,いのうえか,2026-02-22T21:54:55.474Z,,,Ci9DQUlRQUNvZENodHljRjlvT2tKQ1ZHUllZV1JuZFhwQlRWaDFUemRrV0VnMWJIYxAB
1578,43288,ChIJ9wPvXEnN-V8RCD7W8OqN6o4,1,k k,2026-01-17T12:36:46.197Z,千木の里　職員が疲れ切って、利用者のおばあちゃんに暴言を言っています。次は虐待されるのでしょうか?面会に行くたびドキドキします。施設は大丈夫ですか?私のばあちゃんをこのまま預けていても大丈夫かな？不安です。,,ChdDSUhNMG9nS0VJem1oZVAtX0lXUHBRRRAB
1579,46545,ChIJ745ZWQDfGmARrV1zejNsqZI,5,Makoto Uchiyamada,2026-02-11T00:49:06.821Z,未来マチプロジェクトの開催など、入居されている方が様々なカタチで楽しめる工夫をされている場所です。,,Ci9DQUlRQUNvZENodHljRjlvT21aSlJsODRhSE16U21SeFVGZzJVamwwWkhsaGNWRRAB
1580,44304,ChIJIYvgh8Sl-F8R2FT-1YED554,4,Andy,2026-02-26T13:48:38.497Z,"こちらの温泉ホテルには今回で2回目の宿泊です。各部屋は静かで落ち着いており、ゆっくり休むことができ、大変満足できる滞在となりました。温泉の質も良く、日々の疲れを癒すには最適な環境です。
ただ、一点気になった点として、階段の移動が少し不便に感じました。また、残念ながら現在は二部屋付きのプランが予約できなくなってしまったようで、家族やグループで利用する際には少し物足りなさを感じます。
それでも、部屋の静けさやサービス、温泉の満足度は非常に高く、全体的に非常におすすめできるホテルです。次回もこの辺りに訪れる機会があれば、ぜひまた泊まりたいと思っています。",,Ci9DQUlRQUNvZENodHljRjlvT25KbGFqbGtVM1JFVWtaZmJYZGFRV1pWZW14WlNuYxAB
1581,44304,ChIJIYvgh8Sl-F8R2FT-1YED554,5,かばら伝一郎,2026-02-25T12:28:27.652Z,"失礼ながらあまり期待はしていなかったけど、温泉好きの感を信じて泊まりました。口コミに良くない評価が有ったけど、この料金なのに凄く効果の有る温泉で、静かな立地で、大満足の食事でなんの文句があんのか！そんな人は高級温泉宿へでも行ってちょうだい。再訪したい宿の上位にカウントしました。

予約が取りにくいけどやっと取れて二度目の宿泊です。やっぱり良いなあ( *¯ ³¯*)",,ChdDSUhNMG9nS0VJQ0FnSUR6eFp2MnpBRRAB
1582,44304,ChIJIYvgh8Sl-F8R2FT-1YED554,3,やまとも,2026-02-25T11:29:44.347Z,"露天風呂が 地元👴の寄合場と化していました！(既出クチコミに同じ)
泉質はよかった♨️",,Ci9DQUlRQUNvZENodHljRjlvT2xkcU9VTjBURk5vTkdoS05FUlNjakp6Ym01MGRsRRAB
1583,44304,ChIJIYvgh8Sl-F8R2FT-1YED554,4,山内一豊,2026-02-15T23:01:21.810Z,,,Ci9DQUlRQUNvZENodHljRjlvT21SSmNIZHBNMnBHVHkxSFNXbG1Za2x6ZFRBdGVXYxAB
1584,44304,ChIJIYvgh8Sl-F8R2FT-1YED554,4,hide kado,2026-02-03T11:29:33.415Z,日帰り温泉♨️　湯冷めしないいい温泉です　ライン会員になれば、お得なお知らせが入ります　地元の方々で　賑わっています　露天風呂も有り　ゆっくりできる温泉　畳の休憩所も有ります　穴場の温泉です　芒硝泉と重曹泉が日ごろの疲れを癒やします,,Ci9DQUlRQUNvZENodHljRjlvT2tRdE1VZzBXRTVuWmpsRk9GVkxjV2xLYzBOVU1rRRAB
1585,44304,ChIJIYvgh8Sl-F8R2FT-1YED554,5,max oinari,2026-01-05T17:58:30.264Z,山奥にある温浴施設ですが重曹泉なので貴重な場所です。お湯は循環式ですが清潔に管理してますのでサウナ併用だとかなり効果があると思います。ホテルなので日帰り派には結構穴場ですが駐車場も広くて温泉好きにはインパクトある温浴が楽しめると思います。たぶんリピートすると思います。,,Ci9DQUlRQUNvZENodHljRjlvT25CbU16Tmphak5pYVhJMVNqUlllRFExTVdod1VVRRAB
1586,44304,ChIJIYvgh8Sl-F8R2FT-1YED554,5,ひろみ,2026-01-03T10:51:53.198Z,福井県の中で　一番好きな温泉です。安くて　静かで　掛け流しで　サウナも広くて　言うこと無し,,Ci9DQUlRQUNvZENodHljRjlvT2pkYWRIZDJUakJIZWpadmREbDNhbEp1VTFKdFFsRRAB
1587,45471,ChIJCexYsiwF9l8RyT9D1nZWdKk,4,maru sanada,2026-02-15T06:04:06.413Z,,,Ci9DQUlRQUNvZENodHljRjlvT25SWWFVYzVaWEpCYldOT2VWbFFMVmRVVWtka2NXYxAB
1588,43349,ChIJ3y8nZXYz-F8R2kmBgvkRHw8,2,なつ美,2026-02-05T17:11:38.134Z,11階にいた年配女性職員ごく数人のスタッフへの対応が理解できませんでした。もちろん優しい年配の女性男性スタッフもいます。,,Ci9DQUlRQUNvZENodHljRjlvT21NeFRFaE5OV2d5VTBOZlJrWmFOalphTkhKWVJXYxAB
1589,42596,ChIJfUaHWeeP918RVpsrD789mx0,1,m m・,2026-01-07T16:42:43.462Z,おすすめしない。他レビューにもあるように、医師の人を小馬鹿にした態度が目に余る。,,Ci9DQUlRQUNvZENodHljRjlvT25reWVVVnZZVFJpT1hORVdFcHFWMWw0YlVjNGJrRRAB
1590,47020,ChIJT_7CKu9vA2ARcQBXQY1cnKk,5,多惠子,2026-01-11T12:09:24.583Z,,,Ci9DQUlRQUNvZENodHljRjlvT2pGR2RrSTJVbmRRY1ZoRVRYWlVPVGs0VTB4eWJXYxAB
1591,48216,ChIJ8zyNljFlA2ARlmNd7cfEo3I,1,ああ,2026-01-23T07:50:49.318Z,"ここの利用者のジジババ2人で携帯契約しにきた。
ジジババ2人だけで携帯契約しに来るなよまじで。",,Ci9DQUlRQUNvZENodHljRjlvT2s1U1IweERhVFJMYlVaWFdFUmtWRE42VFROV0xWRRAB
1592,47876,ChIJQ2jGvZB7A2ARCOh9DMrgbfs,5,山本沙智,2026-02-21T13:54:46.540Z,"皆さん優しい方ばっかりです

困ったら職員さんや責任者さんが話を聞いてくれます心配もしてくれます向き合っ待てくれます",,Ci9DQUlRQUNvZENodHljRjlvT2tvdE0xaHhiRXROTURWV04xSk5SVUU1VmxSMlZFRRAB
1593,47142,ChIJ95RW2ayCA2ARiqjXm1Vlg8c,5,南部美恵子,2025-12-29T20:52:25.108Z,通所の皆様お元気で、リハビリ体操　お食事　Coffee　Time等　楽しまれています。通所の醍醐味は、大浴場での入浴　ジャグジーも有り　スタッフの入浴介助も素敵ですね✨,,Ci9DQUlRQUNvZENodHljRjlvT21sTFpsZENka1J5ZVhaWlFrRjJVRXhzZFdzM2NYYxAB
1594,47560,ChIJN40LpdZ7A2ARTGI8WU1c20c,1,タマクローニャホニャホ,2026-02-22T06:54:30.819Z,,,Ci9DQUlRQUNvZENodHljRjlvT2sxbFNYbzNWa2xvZGxORmFHRXlVV1ZLYUhSU1EwRRAB
1595,47777,ChIJ56wpLzJ4A2ARwUJGrkkU5sU,5,カビグルマン,2026-01-09T11:01:23.203Z,スタッフの方良い雰囲気です,,Ci9DQUlRQUNvZENodHljRjlvT2pOSlVXMU1jeTFvYWpobk1ERlFjRGhYWmpWMGMwRRAB
1596,47565,ChIJAWYwKkp6A2ARk_h1zDOOcYs,5,守屋隆二,2026-02-19T04:34:00.095Z,🤓必要な費用も低額で、必要にして十分なサービスです。,,Ci9DQUlRQUNvZENodHljRjlvT2pGU00wWldZMHBCUmpORFVVcFZaa1Y1VGxST1duYxAB
1597,46963,ChIJ6-HIqHekG2ARQwlNFRuzP1s,1,富士山ぜぜぜ,2026-02-13T11:21:21.803Z,,,Ci9DQUlRQUNvZENodHljRjlvT2tGM1Z6bERWRzlpYTFoT1NGbDBMVkp5YzBsVk9WRRAB
1598,46963,ChIJ6-HIqHekG2ARQwlNFRuzP1s,5,maki,2026-01-28T14:11:47.456Z,"2月の週末に1名でお邪魔しました。
予約サイトでは1名用プランの空きがなく、電話でご相談した結果、泊めて頂けることになりました。

ホストはご夫婦ともに親切な方で快適に過ごせました。
私以外にお客様が2組宿泊されてましたが、温泉も順番に譲り合う貸切制で、ゆっくり楽しめました。
今回朝食のみでしたが、次回はぜひ夕食も頂きたいです。
チェックアウト時には周辺の観光情報を詳しく教えてくださいました。

室内外の各所に、数年前に倒れた初代たぶの木材が息づいているのも味があって素敵でした。",,ChZDSUhNMG9nS0VJQ0FnTURBX1pXSkxBEAE
1599,48713,ChIJARe557DOBGARAzCmGUPtBik,5,忠内真由美,2026-01-12T04:44:04.013Z,丁寧に施設やサービス内容の説明をしてくださり、家族への対応もしっかりしていてとても安心感のある老人ホームです。,,Ci9DQUlRQUNvZENodHljRjlvT2sxTlducGFaWGh0VEhSM1JtazFNMFZVZVhKQlJGRRAB
1600,48713,ChIJARe557DOBGARAzCmGUPtBik,5,ひな,2026-01-08T12:24:10.302Z,"明るく温かい雰囲気の老人ホームです。
職員の方が優しく、入居者の笑顔が多いのが印象的でした。",,Ci9DQUlRQUNvZENodHljRjlvT25oTVFsaFpkRVU0WjNWRVlqTlZSR0l5Wm5oNWNWRRAB
1601,48713,ChIJARe557DOBGARAzCmGUPtBik,5,ごま,2026-01-08T07:44:32.373Z,"いつも家族がお世話になっています。
施設内はとても綺麗で明るい環境で、穏やかに過ごせているようです。
職員さんも優しく色々と対応してくれて、いつも感謝しています。",,Ci9DQUlRQUNvZENodHljRjlvT214S2J6SkJXRzB5YTNKNlpUazFjbmRDYUhnNU9XYxAB
1602,48032,ChIJn6uBcyNjA2ARnKzqRcXLKww,5,vũ Ninh,2026-02-26T11:39:52.988Z,,,Ci9DQUlRQUNvZENodHljRjlvT2xKZlNVZFJYME5RYjA5RVZqbDFibk42ZUdoRE9IYxAB
1603,48538,ChIJUUjtt_iXBGARE3gJr6qB2Ls,5,伊藤広美,2026-01-28T05:57:31.637Z,2ヶ月利用させて頂きました。とても、明るくて雰囲気が良いスタッフさんが、皆さん親切で、居心地が良かったです。また何かあればお世話になりたいです。,,Ci9DQUlRQUNvZENodHljRjlvT2tSc1VHdFNkbEJJTkVWaVJ6SjVRM1V6Vmxwc1ZYYxAB
1604,47100,ChIJRbgybRVlA2ARFhcRUGOc6BQ,4,Attu,2026-02-08T19:52:26.568Z,"日々お世話になって感謝しています。細やかに1人1人できる限りの自由を尊重してくださり施設生活は絶対にしないと言っていた母ですが、いつも「ここに来てよかった。よく探してくれた。」と言っています。が「贅沢を言えばお食事の内容をもう少し考えてもらえたらなあ」と、言っていますが
スタッフさんみなさん優しく全力で接してくださり、それは何物にも変えられないと、本人も家族も安心して過ごしています。もう少し駐車場があればもっといいなとは思います。",,Ci9DQUlRQUNvZENodHljRjlvT25WNWRqWkdkMWh2V0RSbGFqWXRVRkJxUW5RMVZIYxAB
1605,47301,ChIJi7LpsSF0A2ARUw3hdS2BjzI,3,まゆ,2026-02-10T10:02:02.033Z,,,Ci9DQUlRQUNvZENodHljRjlvT2xsSVJFVTVabmhEVm10dGExaHlMVGwzTlVGNVNXYxAB
1606,49953,ChIJASMHlF8LA2ARjoYy9Kt6r4M,5,KK-Happy,2026-02-02T12:18:28.732Z,付近の街並みに溶け込んだ外観です。管理者の方をはじめスタッフの方々の対応がきめ細やかです。アットホームで良い感じです。,,Ci9DQUlRQUNvZENodHljRjlvT2xodGEzWmhlVVpNTTNreVZrOVdhblpUVFdSelZYYxAB
1607,47881,ChIJ16rQf8d7A2AR3uU13UxzBaQ,5,しんせつクン,2026-02-23T10:48:54.656Z,素晴らしい会社です！,,Ci9DQUlRQUNvZENodHljRjlvT2tOc2NsZG1TV3BCVVd0NmFWOUdZVXRXYUdNMVozYxAB
1608,47881,ChIJ16rQf8d7A2AR3uU13UxzBaQ,5,高田朋和,2026-02-06T01:24:39.663Z,,,Ci9DQUlRQUNvZENodHljRjlvT20xS1dXRmFWVXd0VEVkVlRFNW1ORk4zWlROMExXYxAB
1609,47881,ChIJ16rQf8d7A2AR3uU13UxzBaQ,3,ZT S31,2026-01-29T08:06:52.499Z,,,Ci9DQUlRQUNvZENodHljRjlvT25KTFpEQkJhMHBsWkV4UU5tMUljR2RMT0ZaeVJIYxAB
1610,47881,ChIJ16rQf8d7A2AR3uU13UxzBaQ,2,ti st,2026-01-21T02:05:09.507Z,"ロジクロスさんが左折する交差点を指定するように看板を立ててくれていますが、ほぼ守られて居ません
案の定狭い路地を左折しようとして曲がりきれずに渋滞になっています。
毎回間違えて左折するトラックが居るので非常に困っています",,Ci9DQUlRQUNvZENodHljRjlvT25sdGJGOVNWRUZETjNkTk16bDJUa3BvTVhscmRHYxAB
1611,48242,ChIJzQZKXId7A2ARWJTWUEFVjLo,1,京姫,2026-01-29T03:18:03.239Z,,,Ci9DQUlRQUNvZENodHljRjlvT2tNeE5tOHhMWEY2U1hGelZXWjJSbkp3YWxZNWRWRRAB
1612,48091,ChIJgeZrsFd7A2AR4KouoEWQQWg,5,Biff Tannen,2026-02-01T04:49:37.378Z,,,Ci9DQUlRQUNvZENodHljRjlvT2pRMU9IQktXWGc1UTI5ME5uaFlSWE5GY2xOZlJtYxAB
1613,47722,ChIJjW4svGSdA2ARH0bayf2dvYk,5,ワイバーン渉,2026-01-10T05:37:39.857Z,,,Ci9DQUlRQUNvZENodHljRjlvT2tGYVExWk1lbUpoY1ZKVlVERTRPVUZxZW1wTlZsRRAB
1614,48210,ChIJ9Y2EJwB7A2ARRKpCuYDUg40,1,荒木成義,2026-02-07T06:26:44.611Z,,,Ci9DQUlRQUNvZENodHljRjlvT2pkUmRURlJOekpYVFU5V09FUXlPVVZuZW5GalYxRRAB
1615,51100,ChIJ0-hy5bxjA2ARinvrIqJbbqc,1,ラビ,2026-01-07T14:42:09.618Z,,,Ci9DQUlRQUNvZENodHljRjlvT25CVWEyOHdkWFo0VTBsb1lWazVhWEp5VGpGbVZVRRAB
1616,47743,ChIJJef2f699A2ARJfXEc5CFBso,1,新パンダ摩可,2026-02-04T11:34:00.062Z,,,Ci9DQUlRQUNvZENodHljRjlvT2tGdGJXdEZkak5WY1ZCb05FTlVUMGg2WW10NVltYxAB
1617,47743,ChIJJef2f699A2ARJfXEc5CFBso,1,毎日イモ太郎,2026-01-30T09:11:43.933Z,"見学に来た際にスタッフから罵倒されている
入居者を見ました。ここは支援の時間以外はオムツ交換はしないそうな発言をしており虐待みたいな事を平気でしているのかとビックリしました。大事な家族はこの会社で見てほしくない。",,Ci9DQUlRQUNvZENodHljRjlvT2tvemRsTkRRMjVNWTNORloyWjBVRXhKVFZoSGEzYxAB
1618,48844,ChIJdSbkNs4JA2ARojDM_kUefeU,5,み,2026-02-24T08:51:36.557Z,,,Ci9DQUlRQUNvZENodHljRjlvT2toWU1HcFBYMWhUVDB0S2JtaENVVFZNYjBrNWFFRRAB
1619,48844,ChIJdSbkNs4JA2ARojDM_kUefeU,5,ゆ,2026-02-17T08:55:33.837Z,,,Ci9DQUlRQUNvZENodHljRjlvT2psR2VXOVlkekJaU2xoaFpUWm5OV3RSZW1waFpGRRAB
1620,48844,ChIJdSbkNs4JA2ARojDM_kUefeU,5,WA TA,2026-02-17T08:33:45.469Z,,,Ci9DQUlRQUNvZENodHljRjlvT25oVmVUZGpXbVZNT1UxcVpuUk5Za1U1ZEVRelJtYxAB
1621,47758,ChIJu5BEbBSdA2AR8kZxtJ9XyFw,1,八田輝,2026-02-23T22:10:09.943Z,"なんで住宅街に老人ホーム建てる？
モラルのかけらもなく迷惑。
夜になったら、窓開けて老人が怒鳴ってる。
深夜2.3時でも1時間くらい入居者が怒鳴りつけてる。
高齢女性が、「開けてください！もう疲れた！」を永遠に繰り返して怒鳴ってます。
施設の職員はめんどくさいのか無視？ずっと開けてくださいと怒鳴る始末…

うるさいと電話しても、出ない。

物置？カーテンも部屋にかけないので時間問わず、灯りがついて普通に近隣迷惑…

まじでどっかいってくれ。
管理する気もない、近隣に迷惑かける場所に建設するな。",,Ci9DQUlRQUNvZENodHljRjlvT21KT2JFUmhiRFYyZEZoWFVrWmhjMFJaUWtOemFVRRAB
1622,47604,ChIJxdwG3b13A2AROIrs-fvWLwc,5,ピンガチャ,2026-01-02T05:08:15.480Z,,,Ci9DQUlRQUNvZENodHljRjlvT2toeFFrd3dORVZqWm1JMFVqWndMV2d3VEhCbGRFRRAB
1623,48634,ChIJXbCkDgCnA2AR3S-se4yBrfI,5,み,2026-02-24T08:53:43.336Z,,,Ci9DQUlRQUNvZENodHljRjlvT2t4d0xVazFkVFZJVERWTGFtRndSVk5hY1U1TmVHYxAB
1624,48634,ChIJXbCkDgCnA2AR3S-se4yBrfI,5,WA TA,2026-02-17T08:34:14.859Z,,,Ci9DQUlRQUNvZENodHljRjlvT2trdFEyNU5ORUpSVXpkNlJsSnZSVmxyU1hOQ1FXYxAB
1625,47750,ChIJ65kgrmadA2ARBg-GKflUvQ4,1,あか,2026-02-24T10:50:12.684Z,"数年前に家族が利用していたが、部屋の掃除はされないし臭いし、物は無くなるし、挙句に怪我までさせられて、入院した先の病院の看護師さんに「これは…」と言われた。
次の転所先がさっさと見つかったから大事にしなかったけど被害届出すことも視野に入れてた。
退所するって言ってるのに介護保険証も返却されず、再三言ってやっと返却。
最低。",,Ci9DQUlRQUNvZENodHljRjlvT2t4T1VVdHdOR2xZTW5wVWNFTXlibm8xZGpsaGQyYxAB
