レビューID,施設ID,施設GID,レビュワー評価,レビュワー名,レビュー日時,レビュー本文,レビュー要約,レビューGID
633,200010,ChIJH7t9ANd_GGAR9zvs9YwxmK0,5,coco,2026-03-22T15:08:45.201Z,無料カウンセリングを受けたところ、担当の女性が親身になって悩み事や希望を聞いてくれました。前向きな気持ちになりました。押し売りや否定されることも無いので迷ってる方は行って話をするだけでも全然アリだと思います。私は後日契約し、これからサービス利用するところです。自己紹介文に素敵なPRを書いてくだりました。これから楽しみです。,,Ci9DQUlRQUNvZENodHljRjlvT21WVk1XTjRhbGRaU1ROamNWWXhaVTFDWkc5S2JtYxAB
634,200010,ChIJH7t9ANd_GGAR9zvs9YwxmK0,5,桑原涼太,2026-03-22T10:51:50.019Z,,,Ci9DQUlRQUNvZENodHljRjlvT2pKeVNVaHpZM2N3YVVJMmVVOXNWVXhQY1ZVd1FuYxAB
635,200010,ChIJH7t9ANd_GGAR9zvs9YwxmK0,5,ikuze cia,2026-03-04T10:30:14.809Z,,,Ci9DQUlRQUNvZENodHljRjlvT2pjMVNIaDJhRmh3T0cxdGJqRXdUekIxYVdaNk1tYxAB
636,200010,ChIJH7t9ANd_GGAR9zvs9YwxmK0,4,渡辺夏海,2026-02-25T12:47:40.614Z,,,Ci9DQUlRQUNvZENodHljRjlvT210YWJGOXhaR3M1VXpFMFJVVTVkbEpzUjBOS1ZVRRAB
637,200010,ChIJH7t9ANd_GGAR9zvs9YwxmK0,5,T Y,2026-02-21T04:33:15.625Z,短期間で成婚できて感謝しております。,,Ci9DQUlRQUNvZENodHljRjlvT25oMFZFWjFRbXRMUVUxRlJrZDVTVlpCV1hSYVJGRRAB
638,200010,ChIJH7t9ANd_GGAR9zvs9YwxmK0,4,まい,2026-02-20T10:05:12.841Z,"別の結婚相談所を利用していましたが、なかなかいい出会いに恵まれず、悩んでいたところにこちらの無料体験のことを知って、伺いました。
担当の方が親身になって話を聞いて、自分に寄り添ってくださったことが印象的でした。それで、自分も頑張ってみようと思いました。
思いきって行ってよかったです。",,Ci9DQUlRQUNvZENodHljRjlvT25aMGVHeDBORW93Y3pCbFMydzBjbk5GTWpGMVZYYxAB
639,200049,ChIJE5apbcC3ODUR8akkGQHnCBk,5,blatter,2026-02-23T06:31:54.012Z,"令和7年9月に入会しました。
良い御縁があり、近々退会できそうです。
カウンセラーの方とコメントツールや直接の面談で気になった事をタイムリーに相談できました。
悩んでいる方は話だけでも聞いてみてください。
今現在が自分の一番若いタイミングなので、今更遅いという事はありません。",,Ci9DQUlRQUNvZENodHljRjlvT20xR2MzaHpSMHA0YTFkelVrNXdSVVE1ZWxoYU5sRRAB
640,200040,ChIJT7wVXe6LGGARzXh1jTp-cSk,5,クロ くろ,2026-04-11T07:47:09.458Z,カウンセラーさんが親身になってくれてとても安心して婚活できました。,,Ci9DQUlRQUNvZENodHljRjlvT2psTFNEUTROVlJWVnkxbFNVRlBUMFJvYlMxMlMxRRAB
641,200040,ChIJT7wVXe6LGGARzXh1jTp-cSk,5,Bru El,2026-04-11T04:04:43.674Z,1月に入会して4月上旬に成婚退会できました！,,Ci9DQUlRQUNvZENodHljRjlvT2s4d1NWQnFkbWRUVWpBemJVOTFaWFI1ZWpScWFsRRAB
642,200040,ChIJT7wVXe6LGGARzXh1jTp-cSk,5,Y Y,2026-04-11T04:04:21.044Z,お引き合わせいただき成婚の運びとなりました。ありがとうございました。,,Ci9DQUlRQUNvZENodHljRjlvT2tSSk1WbEpWVFIyT0VRdFNqUktOemg1WkdWNVEzYxAB
643,200040,ChIJT7wVXe6LGGARzXh1jTp-cSk,5,小林友紀,2026-04-10T08:55:43.894Z,"この度再婚退会することができました。何度か諦めるタイミングがありましたが、カウンセラーさんにもう少し頑張ってみましょうと言われて、頑張ってみたところ良い出会いがありました。出会って1ヶ月ほどで真剣交際に進みあっという間に婚約できました。
これから結婚生活を楽しんでいきます。",,Ci9DQUlRQUNvZENodHljRjlvT2tsRFozTlBVbU5rUm1sZk9FcENVMHBEZVcxYVEyYxAB
644,200040,ChIJT7wVXe6LGGARzXh1jTp-cSk,5,山田光,2026-03-29T02:29:53.951Z,カウンセラーの方に親切に対応頂きました。素敵な出会いに感謝です！,,Ci9DQUlRQUNvZENodHljRjlvT21FeWJFUlFSRU5RTFVadFVVZGpVMHRETWpONU1WRRAB
645,200040,ChIJT7wVXe6LGGARzXh1jTp-cSk,4,たかし,2026-03-25T07:18:48.885Z,半年くらいで成婚退会することが出来ました,,Ci9DQUlRQUNvZENodHljRjlvT2tkc01qbDFXWGRRVXpBMWVGTXdWR2hPV2tWR05tYxAB
646,200040,ChIJT7wVXe6LGGARzXh1jTp-cSk,1,環月也,2026-03-23T08:15:13.945Z,無料面談に行ったら尋常じゃない程強引な勧誘を受けました。プランは悪くない、むしろ良さそうでしたが契約申込はしません。,,Ci9DQUlRQUNvZENodHljRjlvT21Gc1pVTnRNMUo2V2tsbFVXVk5hbHB5UTFaNFUyYxAB
647,200040,ChIJT7wVXe6LGGARzXh1jTp-cSk,5,川島麒麟,2026-03-20T09:57:19.684Z,"9ヶ月ほど在籍して非常に素晴らしい方と出会えました。カウンセラーの方も皆さん親身になって相談に乗っていただき、お陰で無事成婚退会することができました。
結婚をしたいという方は選択肢のひとつとして良いかと思います！",,Ci9DQUlRQUNvZENodHljRjlvT2xWcmNVd3hUMHhWTUcxM1QyWldNM1IzTVZZMU1YYxAB
648,200040,ChIJT7wVXe6LGGARzXh1jTp-cSk,5,S. N,2026-03-14T06:51:09.857Z,自分のペースで活動でき、素敵な人に出会えました！,,Ci9DQUlRQUNvZENodHljRjlvT2tsTlNHMXhhek40WldFNVQwMUVPVFE0UzBKNmMyYxAB
649,200040,ChIJT7wVXe6LGGARzXh1jTp-cSk,1,猫好き,2026-03-12T06:27:59.415Z,"正直無駄なお金だったと感じました。
最初の希望とも合わずとりあえず紹介されてるイメージでした。希望に合う方がたくさん居ると聞いてたのですが入らせる為でしかなかったみたいです。
異性を見た印象は結婚を考える前にもっと自分にも投資されてはどうかなぁって個人的には感じました。
とりあえず入会させたいのが最初の印象です。",,Ci9DQUlRQUNvZENodHljRjlvT21GNFJHOHpiVWMyV2xwMmNGZFdSbnBFVjBoeVRuYxAB
650,200040,ChIJT7wVXe6LGGARzXh1jTp-cSk,5,choco choco,2026-03-08T08:01:42.378Z,良い婚活でした。些細なことでも相談に乗って頂き、前向きに活動していくことができました！！おかげさまで成婚退会ができ、カウンセラーさんには大変感謝しております！！おすすめです。,,Ci9DQUlRQUNvZENodHljRjlvT2xsWWVWWjZkV2Q1VFcxZlQwbHVTa2hsV21wUVkxRRAB
651,200040,ChIJT7wVXe6LGGARzXh1jTp-cSk,4,あ,2026-03-08T04:54:21.845Z,サービスが充実していて安心して活動できました,,Ci9DQUlRQUNvZENodHljRjlvT2pONmIxWnhXR3BOVldKZldsbzBPR2RrVkRWUmMxRRAB
652,200040,ChIJT7wVXe6LGGARzXh1jTp-cSk,3,n n,2026-02-22T04:06:41.379Z,おかげさまで結婚することができました。,,Ci9DQUlRQUNvZENodHljRjlvT2xsSFgzRm9NbDlhWlV4MWRERkhVWEJXWW5odFoxRRAB
653,200040,ChIJT7wVXe6LGGARzXh1jTp-cSk,1,みーー,2026-02-21T09:34:14.311Z,"だらだらと会費をとり続けたいんだと思いますが、スタッフの方は本当に仕事をしないです。(人手不足なのかもしれませんが）
レスポンスが遅く、書類の不備にもきちんと対応をしていただけない。
スタッフ間の連携を取れていないのか、直接来店すると伝えたはずなのにオンラインの予定になっていたり…
会社としてあまり信用ができないと思いました。

会員同士の紹介も親よりも年上の人を紹介されたときは鳥肌がたちました。どういったつもりで紹介したのでしょうか？
お見合いの前に年収や容姿も全く分かないことも非効率的だと思いました。

結婚相談所は成婚料をとる事で稼ぐシステムなのかと思いましたが、こちらは違うようです。
だらだら会費を払い続けるのも無駄なので数ヶ月で何の成果もなく退会しました。
ある意味いい勉強代でした。",,Ci9DQUlRQUNvZENodHljRjlvT21aR2FFNXFXV05vYWs5T2RHOURUV3BxV20xWWNtYxAB
654,200040,ChIJT7wVXe6LGGARzXh1jTp-cSk,5,三宅健介,2026-02-21T07:03:48.058Z,こちらで活動して、素敵な女性と出逢えました！カウンセラーの皆様、宮崎さん、山口さんにお世話になりました！本当にありがとうございました！,,Ci9DQUlRQUNvZENodHljRjlvT210VVZrTnBPVUZHYkhKM1dHcGZlRUZRVW10b2FtYxAB
655,200040,ChIJT7wVXe6LGGARzXh1jTp-cSk,1,宗治義臣清水（AKBG推し）,2026-02-18T04:56:19.052Z,"連絡は遅いし、面談のの予約が向こう理由で取れなかったのにその後何の連絡もなし。
これなら別の相談所使った方がマシと思い退会。
2度と使うことはない

zweiのアプリもUI全く考えてない不便な物で、お金を取ることしか考えてない物思った。
なるほど、結婚相談所が潰れる理由がよくわかった",,Ci9DQUlRQUNvZENodHljRjlvT2xkcFNHdFNiMVJoYUhsSk5qbEtUME5FUTNSaU0wRRAB
656,200040,ChIJT7wVXe6LGGARzXh1jTp-cSk,2,まろん,2026-02-15T06:55:12.282Z,社員さんが忙しそうで大変そうだなと思いました。,,Ci9DQUlRQUNvZENodHljRjlvT2xSbk5HUjBRblpFVlZCYUxWQkhVWFJLTUV3NUxXYxAB
657,200040,ChIJT7wVXe6LGGARzXh1jTp-cSk,5,T Y,2026-02-12T13:24:13.505Z,"6月下旬に入会し、12月末に成婚退会した者です。
ツヴァイグループが大手企業である安心感とガイダンスのご説明が懇切丁寧だったことから、入会を決めました。

活動を始めて、まず感じたことは、世の中、性格や経歴を含めて、本当に素敵な方々が沢山いらっしゃるということです。

しかし、時間が進むにつれて、将来のパートナー探しに、焦りや不安、迷いも感じていくようになりました。

そんな中で、私の担当カウンセラーTさんは、定期的に実施していただける面談の中で、私の話を否定することなく、耳を傾けていただけました。気持ちが沈んでいる時でも、ポジティブな言葉をかけ続けてくださり、おかげさまで、前向きに活動ができたと思います。

また夜遅くになっても、アドバイスのメッセージのやり取りをしていただけたりと、本当に親身にご対応していただけたと思っています。

結局のところ、自分の責任や判断で、運命のパートナーを選ばないといけないと思いますが、カウンセラーさん無くしては、そこまで辿り着かなかったと思います。改めて、感謝御礼申し上げます。

ツヴァイのカウンセラーさんは皆様、活気があり、スピード感をもって懇切丁寧にサポートして頂ける方が非常に多いと思います。大変オススメです。
以上、少しでもご参考になれば、幸いです。",,Ci9DQUlRQUNvZENodHljRjlvT25jd2JsY3RRVmQxUVRGQ1oxQmpaVjg1TFY5RlVVRRAB
658,200032,ChIJARdLVQ30QDURCn8VQWOa27I,5,AiA,2026-04-06T07:35:17.071Z,"素敵な方と出会わせていただきました！
カウンセラーさんを始め、気軽に何でも相談できて、いい出会いを引き寄せてくれました。",,Ci9DQUlRQUNvZENodHljRjlvT25SME4yYzNaRWRIWW1acU5XSnFkVlJCWTBwMk4wRRAB
659,200032,ChIJARdLVQ30QDURCn8VQWOa27I,5,村上佳織,2026-03-29T09:23:26.602Z,"アットホームな感じで、とても親切で、スタッフの皆様も親身になって相談にのってくれます。
とても充実して婚活できました！",,Ci9DQUlRQUNvZENodHljRjlvT2pGdlJWQnhWazgzT0hoeVoyMXlSMU5uTkRCT04yYxAB
660,200032,ChIJARdLVQ30QDURCn8VQWOa27I,5,wtsram,2026-03-28T14:50:47.202Z,初回の説明の際は緊張もしていましたが、優しく丁寧に対応してくださり自分の事も自然に開示できました。説明自体も細かく丁寧で、分からないことも丁寧に何度も教えていただきました。「一緒に頑張りましょう」と背中を押してもらい、6ヶ月で成婚退会できました。活動中は悩んでることや迷ってることに親身になってくださり、アドバイスも的確で相談含めたくさん支えてもらいました。自分の性格も理解してくださっていたのでとても心強く、ここで婚活できたことはとても良かったです！もし、悩んでる方がいるなら、一度説明を聞きに行かれることをおすすめします！,,Ci9DQUlRQUNvZENodHljRjlvT2pKM0xTMW1SRTFXUlRsTlUzVnlWVUl5VkVKNE1uYxAB
661,200032,ChIJARdLVQ30QDURCn8VQWOa27I,5,N,2026-03-05T05:56:57.608Z,"入会から5ヶ月で成婚退会することが出来ました。
自分から積極的に行動しようとしたり、お相手に本心を伝えても大丈夫なのか不安になったりした時にたくさん背中を押していただけたおかげで最初に素敵だと思った方との縁を繋ぐことが出来ました。
入会のきっかけをくださった金子さんと活動中のサポートをしてくださった渡部さんに本当に感謝しています。
お世話になりました！",,Ci9DQUlRQUNvZENodHljRjlvT21keU4yMTJXSHA0TVdKbmNYQktValZoUlZrMWRuYxAB
662,200047,ChIJkeQiNXE7AWARqVK9rzRqt0E,5,Hank I. (Hankさん),2026-04-04T09:44:45.742Z,"自由な活動をサポートして下さり、約半年で成婚退会できました！今の妻と出会う場を頂き本当に感謝しています！！
２つのプランがあるため、まずは入会してみて自分のやり易いプランで活動するのがいいと思います！",,Ci9DQUlRQUNvZENodHljRjlvT2s1VGNsUkVaRU4xVVhGblJUbHRaMmRMVFhsSGJXYxAB
663,200047,ChIJkeQiNXE7AWARqVK9rzRqt0E,5,まめっまめっ,2026-04-04T09:44:04.989Z,いい年齢になってきたので、結婚したいと思い入会しました。カウンセラーさんに親身になって相談にのっていただき、無事成婚退会ができました。ありがとうございました!,,Ci9DQUlRQUNvZENodHljRjlvT2pkalREaENObGN5TUZwZlpuQlBWRmhGZG5aRVRVRRAB
664,200047,ChIJkeQiNXE7AWARqVK9rzRqt0E,5,Ta naka,2026-02-28T06:36:53.933Z,スタッフの方とても温かかったです。,,Ci9DQUlRQUNvZENodHljRjlvT25KaFdYTjNUMlk0UkdSMFRYbG5lRXB1V0UxZk9HYxAB
665,200023,ChIJQ1meA4_J9F8R5AFIp52-C30,4,はや,2026-03-08T05:46:33.460Z,なかなか上手くいかない事も多くありましたがとても素敵な方と出会う事が出来て成婚する事が出来ました。2年程活動しましたが諦めずに活動をして良かったと思います。,,Ci9DQUlRQUNvZENodHljRjlvT2sxa2FYUnlWRmxVWVZsR05tdHVlVlo2WkRoUllVRRAB
666,200023,ChIJQ1meA4_J9F8R5AFIp52-C30,5,大野美幸,2026-02-23T05:26:25.473Z,親身になってご相談に乗っていただき、無事に成婚退会することができました！,,Ci9DQUlRQUNvZENodHljRjlvT2s5c2JVeExkbDlLZUROdU1sbHBVVE5WVlRWdlNWRRAB
667,200007,ChIJX-ERO43mAGARLjhT8mjTtZs,5,daicy be-su,2026-04-11T04:07:40.394Z,良い方にお会いできた！,,Ci9DQUlRQUNvZENodHljRjlvT2pFMGJGVlZRbXAyYkVSUFJEQlNYM1ZPU2tKb2IzYxAB
668,200007,ChIJX-ERO43mAGARLjhT8mjTtZs,5,梶奈津子,2026-04-10T09:04:44.275Z,自己紹介の文章から、お見合いの時のアドバイスなど、不安な事は何でも相談できる場でした。,,Ci9DQUlRQUNvZENodHljRjlvT2tSRVZsRXlSVGswUlZJMlVFSkNWbEp6ZDBGNWJYYxAB
669,200007,ChIJX-ERO43mAGARLjhT8mjTtZs,5,mako_unagi3150,2026-04-05T08:41:39.760Z,"2025年7月末に入会し、約8ヶ月間の活動で成婚退会しました。
相談所、カウンセラーの方のサポートが手厚く、どんな質問に対しても真摯に答えてくれます^_^
IBJ連盟にも加盟しており、恋愛下手な私でも成婚することができたのでオススメの結婚相談所です。
婚活どうするか結婚しようかどうか悩んでる方はぜひ一度カウンセリングに行かれたら良いと思います！",,Ci9DQUlRQUNvZENodHljRjlvT2tSTE5WcHFMVXd3Tm1ObWVuZG9lWEJYZDNVemVtYxAB
670,200007,ChIJX-ERO43mAGARLjhT8mjTtZs,5,雲母,2026-04-04T05:27:18.200Z,"会員数も多く、親身になって相談に乗ってもらえたおかげで短期間で成婚できました。
登録して良かったと思います。",,Ci9DQUlRQUNvZENodHljRjlvT2pSbU5FZ3lTazlGV1Voa04zRlpNbXhHUTJOcE1XYxAB
671,200007,ChIJX-ERO43mAGARLjhT8mjTtZs,4,mer,2026-04-04T04:23:07.543Z,"なんでも相談できて心強く、楽しみながら活動できました。
たくさんお世話になりました。
ありがとうございました！",,Ci9DQUlRQUNvZENodHljRjlvT2pGMVdGb3dRalp4ZUdsMk5GQlNjM1F3ZGpoSVZFRRAB
672,200007,ChIJX-ERO43mAGARLjhT8mjTtZs,5,masaki takahashi,2026-03-29T08:58:31.399Z,"約2年在籍し、5ヶ月の交際を経て成婚退会した者です。
こちらで婚活を開始して山谷ありましたが、最終的に素敵な方と出会えて本当に幸せです。
私はIBJプランで活動していました。結果的にIBJで出会った方と成婚できました。
最初は出会いの場が多い方がいいと思ってこのプランにしましたがIBJでのサポート体制が私には合っていました。
このプランだったからこそ、よりカウンセラーさんのサポートがあってこちらからの相談に親身になって乗ってくださったりしては非常に助かりました。",,Ci9DQUlRQUNvZENodHljRjlvT25CblJqQlJjVkJPUmt0UVVGaGFYMEZWVHpjNFRVRRAB
673,200007,ChIJX-ERO43mAGARLjhT8mjTtZs,5,s t,2026-03-29T06:09:36.429Z,,,Ci9DQUlRQUNvZENodHljRjlvT25OaFQwRnFPSGROZWpCU1kwTndWbGR6UTB0SlkxRRAB
674,200007,ChIJX-ERO43mAGARLjhT8mjTtZs,5,yumeko,2026-03-29T06:07:52.226Z,担当の方が自分に寄り添ってアドバイスを下さったので、自分がどうしたいかを整理しながら活動できました。その結果、素敵な方に出会えたので入会して良かったです。,,Ci9DQUlRQUNvZENodHljRjlvT2xVdFRVaGtiMmRVWVdSSVVtNTBVMlUwWkc4dFQyYxAB
675,200007,ChIJX-ERO43mAGARLjhT8mjTtZs,5,だんびらXにっしー,2026-03-22T01:28:29.362Z,1年前に入会して、素敵な方と出会う事が出来ました,,Ci9DQUlRQUNvZENodHljRjlvT2xCU1RUTXlTekp3Y0hCWk4yRnlSRWRMUTFSQldFRRAB
676,200007,ChIJX-ERO43mAGARLjhT8mjTtZs,1,O A,2026-03-15T05:10:04.322Z,"口コミ案外高くてびっくりです。投稿されてる方を見に行くとなるほどなと感じました。

この投稿が消されたら察して下さい。
知人がここに行くと行ったので必死に止めました。理由は約2年間活動しましたが希望する方に会えず一度も会わないまま退会したことです。入会金は30万円月々2万円程でした。まず入会時にお会いする人、カウンセラー、日程調整人がおり連携ができていないためか伝えた事でも担当者に改めて伝えないといけません。そちらで共有して欲しいとお伝えしたところ無視をされ続け、何というか。その後その旨を伝えたところピックアップされる方も僕が伝えた方ではなく。容姿が醜い人ばっか。嫌がらせされ続け退会を決めました。婚活されている方に注意喚起として投稿させて頂きます。
退会したのでウルフギャングで美味しいステーキ食べます。",,Ci9DQUlRQUNvZENodHljRjlvT25WSlNtNW1SRmhRYldOSUxXWnhZMGhyU1ZOM2ExRRAB
677,200007,ChIJX-ERO43mAGARLjhT8mjTtZs,1,D M,2026-03-14T09:40:56.531Z,,,Ci9DQUlRQUNvZENodHljRjlvT21wV2VUVlhXa1I0UVc1UVkyUjFVSEoyUVZwRUxWRRAB
678,200007,ChIJX-ERO43mAGARLjhT8mjTtZs,1,mm “nii” y,2026-03-14T01:58:46.546Z,以前実体験を基に感じたことをレビューしましたがどうやら評価の悪い口コミは消されてしまう様です。,,Ci9DQUlRQUNvZENodHljRjlvT2xKeU4xSk9jbEpHTUZOa2FtWmtTM2hhV0VzMlpXYxAB
679,200007,ChIJX-ERO43mAGARLjhT8mjTtZs,1,B,2026-03-08T08:13:32.265Z,"入会する前にクチコミを見られる方の為にもコメント残します。

‘結婚相談所とは’と思うほど担当者から何もないです。
紹介やアテンドは一才ありません。
日程調整の催促のメールのみ。

自分でお相手にいいねをし、マッチング→日程調整→会うのみ。
マッチングアプリとなんら変わりなし。
カウンセラーは何のためにいるのかわかりません。

本当に結婚したいならここは辞めた方がいいです。
マッチングアプリで数打つ方がよっぽどマシ。
ここで成婚出来る方は、ここに入会しなくてもアプリでも出来ると思います。
ほんとに詐欺レベル

入会前の1人でも多くの方にコメントが届きますように。",,Ci9DQUlRQUNvZENodHljRjlvT2xCU05XVjZOemh6UTJad1NGVmxSbVZpU0RkcFlrRRAB
680,200007,ChIJX-ERO43mAGARLjhT8mjTtZs,4,y,2026-03-07T07:07:02.027Z,カウンセラーの方がいつも的確なアドバイスをくださり、安心して活動できました。,,Ci9DQUlRQUNvZENodHljRjlvT2sxbmRHNUhaVUZWUzBsNVRHaGZPVmxuZEhOWlRWRRAB
681,200007,ChIJX-ERO43mAGARLjhT8mjTtZs,5,しなの,2026-03-06T04:11:47.034Z,"この度、成婚退会しました！

4ヶ月の活動で成婚できました。
カウンセラーさんにはたくさんお世話になって、わからないことなど生じた時には「ここでは私が何でも受け止めます！」と言ってくれたり、大変心強かったです。

感謝の気持ちでいっぱいです。
ご縁をいただきありがとうございました✨",,Ci9DQUlRQUNvZENodHljRjlvT2pWT2VWcHhWWFZmV0RCWFYwdExURzl2YUhGcFluYxAB
682,200007,ChIJX-ERO43mAGARLjhT8mjTtZs,5,いなじゅん,2026-02-28T06:34:31.878Z,無事成婚しました。ありがとうございました。,,Ci9DQUlRQUNvZENodHljRjlvT25aRlIzcERkSFp6ZFhndE5qVnVYMUF3U1ZBMVJXYxAB
683,200007,ChIJX-ERO43mAGARLjhT8mjTtZs,5,鳥もも,2026-02-23T03:58:13.907Z,いい出会いがあるか不安ながら入会しましたが、カウンセラーさんも親切で、とてもいい人と巡り会えました。ありがとうございました。,,Ci9DQUlRQUNvZENodHljRjlvT21oemVuSndOMmRTYzFoYVVUWnFRa1JHYVVwTFIyYxAB
684,200007,ChIJX-ERO43mAGARLjhT8mjTtZs,5,Yuka,2026-02-18T14:08:39.662Z,"親身に相談に乗ってくださる温かいカウンセラーさんのバックアップのもと、素敵な方と巡り会うことができ、成婚退会する運びとなりました！
本日ご挨拶に伺いましたが、大勢のカウンセラーの方々に送り出していただき、これからに向けてとても心強かったです💪
皆様ありがとうございました🙇

これから婚活を始めようとされている方、少しでも興味のある方は一度ご相談だけでもされることをお薦めします！",,Ci9DQUlRQUNvZENodHljRjlvT25NeU1YcGhOa2s0YWpCYWRuQkZSbVpaUzBad2VYYxAB
685,200007,ChIJX-ERO43mAGARLjhT8mjTtZs,1,-,2026-02-18T13:05:30.292Z,"カウンセラー一人当たりの担当人数が多いのか、親身になって相談に乗るという姿勢はないようです。

成婚退会しましたが、結局お別れし、大金を無駄にしたと思います。

カウンセラーというお仕事自体がただの伝書鳩で、これで人並みの給料もらえるのは羨ましいと感じました。",,Ci9DQUlRQUNvZENodHljRjlvT25kcmRXMTNMVEowTW05aVltTjBUVk5wV0VnMWVVRRAB
686,200007,ChIJX-ERO43mAGARLjhT8mjTtZs,5,Nozomu Takahashi,2026-02-18T09:25:33.521Z,"この度、素敵な方と出会い、成婚退会することになりました。
親身に相談にのってくださり、入会して5ヶ月ほどで退会することになりました☺️
入会に迷われている方はぜひ相談に行かれると良いと思います。",,Ci9DQUlRQUNvZENodHljRjlvT2w5R2FHUk1aVkF0UWpOdFZHNDNUVGxhVjJNellsRRAB
687,200007,ChIJX-ERO43mAGARLjhT8mjTtZs,5,たまきち,2026-02-12T07:21:06.503Z,"結婚を迷っている方にこそ、心からおすすめしたいサービスです。2025年4月から約10ヶ月間、大変お世話になりました。

お見合いの魅力は、
・膨大な登録者の中から、真剣に結婚を考えている方とだけ出会えること
・結婚に向けた無駄な駆け引きや探り合いをせず、最初から同じ方向を向いて進めること
・専属のカウンセラーさんを通してお相手の本音を知れたり、迷いや不安で立ち止まりそうな時に寄り添い、支えていただけること
（お別れする際に、もう会えない事が寂しくて泣いてしまったほど素敵な人でした）

だと感じています。

正直、途中で気持ちが折れそうになったこともありました。それでも、その都度カウンセラーさんが親身に話を聞いてくださり、背中を押してくださったおかげで、最終的には驚くほどスムーズに成婚が決まりました。
交際からわずか3ヶ月で入籍というご縁に恵まれ、幼い頃から思い描いていたような理想の方と出会うことができました。

お見合いをしなくても、結婚はできるのかもしれません。
ただ、出会える人数と質が圧倒的に違うからこそ、「こんな方に出会えるとは思っていなかった」と思えるご縁に巡り合える確率は、確実に高まると感じます。
本気で結婚を考えている方には、ぜひ一度、この環境に身を置いてみてほしいです。
ここには、人生を一緒に歩む相手と出会える可能性があります。",,Ci9DQUlRQUNvZENodHljRjlvT2pOeFltOUlaREJ4YTFWeWJ6SlZjbUp4Y0hkbGRtYxAB
688,200007,ChIJX-ERO43mAGARLjhT8mjTtZs,4,あ,2026-02-11T01:08:25.950Z,素敵な方に出会えました,,Ci9DQUlRQUNvZENodHljRjlvT21GVFNsUklRM2N6V0d0QlowOWphMDloYURZMFUzYxAB
689,200007,ChIJX-ERO43mAGARLjhT8mjTtZs,5,りんご,2026-02-11T01:05:36.113Z,担当の方にたくさん親身に相談にのっていただけました。,,Ci9DQUlRQUNvZENodHljRjlvT2w4ME5tcHdXbVJ2WDFoNU56bGxXRVpVV0doTlUzYxAB
