レビューID,施設ID,施設GID,レビュワー評価,レビュワー名,レビュー日時,レビュー本文,レビュー要約,レビューGID
1327,200981,ChIJf1meiJznGGARMP3fL2H54TU,5,k k,2026-03-05T14:50:36.237Z,"以前の大手相談所を含め、真剣交際6回を経て成婚退会した者です。正直「婚活は地獄だ」と何度思ったかわかりません。
しかし今は水島さんのおかげもありとても良いお相手と出会う事ができました！

最初にこちらを選んだ理由は「家からの近さ」「入会金や会費の手頃さ」「申し込み数の多さ」でした。
しかし、今では相談所選びにおいてカウンセラーさんの能力と熱意を1番に考えるべきだと考えています。

理由として一つエピソードを共有します。
私が何度も真剣交際に失敗し、婚活が辛く、今後誰とも結婚できないのではないか？という不安に押しつぶされそうになった時期の話です。
何度も真剣交際を失敗する私に水島さんも嫌気がさしているのかも、と邪推する程にメンタルが弱った時期がありました。
あまり自分にしっくりきていないお相手とエイヤと先に進もうとした僕に「私は⚪︎さんが望む結婚を応援するカウンセラーです。このお相手で本当に良いと思えますか？ご自分の結婚にとって大事にしている事をもう一度考えてみては？」と立ち止まるきっかけをくれた事がありました。
「水島さんは私の味方だ」と改めて感じられた場面でした。

相談所は会員の幸せより回転率を上げて利益を上げたいはずです（それは企業として当然ですが）、会員の幸せのために「待った！」をかけてくれる相談所は他にそれほど無いのではないでしょうか？

魅力があり婚活がスムーズに進む方は、どんな相談所を選択しても良いのかもしれません。
しかし、破局やメンタルダウンなど辛い時間は必ず訪れます。地獄に不安のある方は信頼できるカウンセラー（バディ）の存在が必要不可欠と断言します。

水島さん、本当にありがとうございました！",,Ci9DQUlRQUNvZENodHljRjlvT2pKeFNYaFVNbmQ1VEZKdFdVTmpURko0T1ZWelMyYxAB
1328,200981,ChIJf1meiJznGGARMP3fL2H54TU,5,鈴木蓮香,2026-03-03T09:53:15.281Z,"仲人として活動しておりますが、より精度の高いカウンセリングを目指して受講いたしました。
恋愛診断士のカリキュラムは非常に緻密で、会員様一人ひとりの「つまづきポイント」をどう見極め、どう成婚へ導くべきか、その具体的な道筋が明確になりました。

恋愛診断士の内容は現場でもすぐ活かせる知識ばかりです。そして仲人としての自信がより深まります。
仲人としての視座を高めたい方にとって、最高の学びだと思います。",,Ci9DQUlRQUNvZENodHljRjlvT25oc2FtNXVXV1JXY1RScGRrMWFhM3BEYmpkdVprRRAB
1329,200981,ChIJf1meiJznGGARMP3fL2H54TU,5,お刺身太郎,2026-03-03T04:14:36.813Z,ヒアリング、プロフィール作成、各種手続き等、親身になって話を聞いて下さり、諦めず婚活を頑張って行こうという気持ちになりました。,,Ci9DQUlRQUNvZENodHljRjlvT25oWE5XSkRNMHQwT1ZVNWQwZGhZblp4TFZwd1dFRRAB
1330,200981,ChIJf1meiJznGGARMP3fL2H54TU,4,ノムノム,2026-03-01T08:32:49.058Z,コーディネーターの方のサポートがきめ細やかでした。定期的な面談にも助かりました。,,Ci9DQUlRQUNvZENodHljRjlvT2tWZmVFbEJaVnBMUkZoeFgwdHpVbUYwV0dKVVptYxAB
1331,200981,ChIJf1meiJznGGARMP3fL2H54TU,5,Shi Yo (Yoshi),2026-02-28T14:18:13.337Z,"こちらの相談所でお世話になり、成婚退会をしたものです。
初めてのことで沢山わからないがありましたが、丁寧かつ迅速に対応をしていただきました。
プロフィールについては、私の人柄がわかるよう具体的なエピソードを交えて掲載していただきました。
自分に足りない部分を沢山フォローしていただいたからこそ、良縁に巡り会えた時に決断することができました。
今はとても幸せです。ありがとうございました。",,Ci9DQUlRQUNvZENodHljRjlvT21SdFJYcDVVemgxUXpRM2NtcFZRM1pVZWtSSFpGRRAB
1332,200981,ChIJf1meiJznGGARMP3fL2H54TU,4,おさとう,2026-02-18T15:19:04.233Z,"いくつかカウンセリングを受けてみて地域密着型の相談所を探していました。
1歩踏み出すのに勇気が入りましたが親切丁寧に説明していただけたので安心して婚活を進めることができました。
まだ入会して間もないですが、こちらの相談事やレスポンスも早いので安心して活動できております。ある程度活事前準備をしていたため1週間という爆速さで活動が始まったため、まだ不慣れなところや戸惑いはありますが親身に相談に乗っていただけるので不安は少ないです。
これからもよろしくお願いします。",,Ci9DQUlRQUNvZENodHljRjlvT21zek1EaFFUbWt3ZGxwRVNreEpaVVpSV1VsUVJuYxAB
1333,202574,ChIJ3Zih-d3rUzUR9d-2zHuEgUs,5,草壁花道,2026-03-29T06:44:44.136Z,周囲が当然のようにできていることが何もできていない自分が悲しく、考えないふりをしていた時に友人のすすめで、話だけでも聞こうと思い面談をしました。非常に優しく話をしてくださる方で、安心しました。「結婚相談所」ときくと、とにかく営業トークがうまい人に丸め込まれるのではないかと思っていましたが、傾聴を大事にされていて、上手く答えられなくても大丈夫な空気感があり、ほっとしました。また、周りを見て焦るのではなく、自分のペースで活動をすることをアドバイスしていただき、とても心が救われました。まずは自分についての理解が必要ではあると思いますが、上手く行動にうつせるよう努力をしたいと思わせていただきありがとうございます。,,Ci9DQUlRQUNvZENodHljRjlvT25kRFZXRk5iRVZFVFRZMWQyazBjV1UyYjBaUU9IYxAB
1334,202574,ChIJ3Zih-d3rUzUR9d-2zHuEgUs,5,y k,2026-03-22T14:18:21.734Z,興味本位で無料カウンセリングを受けることになったので、｢覚悟が足りない！｣と怒られるのではないかと緊張していましたが、終始温かい雰囲気で寄り添った言葉をかけていただき、有意義な時間を過ごすことができました。｢まずは環境に身を置いてみる｣という言葉に背中を押してもらいました。とても頼もしいです！！,,Ci9DQUlRQUNvZENodHljRjlvT2t0SVZtTTRXRzV5YjJkRFptbFhWVGRqVWtwNWIxRRAB
1335,202574,ChIJ3Zih-d3rUzUR9d-2zHuEgUs,5,前中 雄貴,2026-02-23T05:55:42.698Z,"最初は別の相談所で婚活をしていたのですが、担当者と合わなくて退会し、しばらく休んでいました。
無料相談で自分の過去の話や励ましを頂き、また頑張ってみようと思えました。
大手と違い、一人一人に真剣に向き合ってくれるのはありがたいし、一度話をしてみて心打たれる事が多かったので、悩んでいたら一度相談してみるのがおすすめです。",,Ci9DQUlRQUNvZENodHljRjlvT25aaFYzb3RSakpJVlY5MmJIa3lVbU5LUWpkUVJHYxAB
1336,201901,ChIJN6-SUeh2A2ARKpuqgcR9IlA,5,Ka Hi,2026-04-08T14:40:50.283Z,"彼女とはとんとん拍子に話が進み、初めてお会いしてから約3ヶ月で婚約し、成婚退会できました！
仲人さんには、交際中のアドバイスやお相手との温度感がどうかなどをLINEで聞け、サポートを気兼ねなく受けられるところが良かったです。また、アウターサービスもあるとのことで、もうしばらくお世話になります。
ひとまず、ありがとうございました！",,Ci9DQUlRQUNvZENodHljRjlvT2xaaE16Qk5RVzA0TlVJNVFXSm9TemMzTFVSSVgxRRAB
1337,201901,ChIJN6-SUeh2A2ARKpuqgcR9IlA,5,t oku,2026-03-16T15:08:41.456Z,"結婚相談所の入会には恥ずかしさや抵抗がありましたが、後押しして頂いて入会した結果いい出会いがありました。
担当の方もいつでも相談に乗って下さり、とてもよかったです。",,Ci9DQUlRQUNvZENodHljRjlvT2xjdGFrMTZOSE5vZG5sS1kxaElWMUJIYzFKUlNrRRAB
1338,201901,ChIJN6-SUeh2A2ARKpuqgcR9IlA,5,tk,2026-03-11T08:27:16.081Z,"結婚を考えてマッチングアプリで少し活動した後、自分には難しいと思い相談所に登録しました。真剣プランで活動し、1年以内で退会することができました。
お見合い練習をして自分の話し方の良くない点を指摘いただき、改善してお見合いに臨むことができました。
はじめは苦戦しましたが、お見合いや交際時の出来事を相談してサポートいただきながら半年ほどして真剣交際に進み、その方と成婚することができました。ありがとうございました。",,Ci9DQUlRQUNvZENodHljRjlvT21nMVVWWnZPWFJrVWpsTmRuTnpOWEV3VUVGR00xRRAB
1339,201901,ChIJN6-SUeh2A2ARKpuqgcR9IlA,5,IA,2026-03-08T08:30:33.887Z,"約2年ほど活動し、無事に成婚退会することができました。
活動の途中では思うようにいかないことも多く、諦めようかと考えた時期もありましたが、最終的に成婚できて本当に良かったと思っています。

成婚に至るまでの過程では、自分の活動状況について評価していただき、客観的な視点から見つめ直す機会を得ることができました。自分一人では気づけない点も多く、大変参考になりました。

また、成婚後もさまざまな形でサポートを受けられると聞き、大変助かるなと思っています。",,Ci9DQUlRQUNvZENodHljRjlvT205YU56TkJlQzFIYUhJNFV6aGZWMGhqYzJwVE9XYxAB
1340,201901,ChIJN6-SUeh2A2ARKpuqgcR9IlA,5,S S.,2026-02-28T03:00:11.768Z,"BR Marriag様の伴走のおかげで、無事にお相手を見つけて成婚退会できました
中々ご縁に恵まれずに、相談所にお世話になることを選びましたが、良い結果が出て大変満足しております。
相手の探し方から、お見合い、デートの仕方や服の選び方まで、ご指導頂けますし、ご紹介頂いた宝石商の方にはプロポーズのご支援も頂け、大変助かりました。
また、異性の方から種々のご意見を頂けるのも結婚相談としては貴重だったと思いますので、迷われている方々は是非ご相談されることをお勧め致します",,Ci9DQUlRQUNvZENodHljRjlvT2tGT1MzUnlVMFp3UjBGb016RkJkVmRhWTBZMVJYYxAB
1341,201901,ChIJN6-SUeh2A2ARKpuqgcR9IlA,5,しょん,2026-02-27T02:39:44.075Z,"無事一年以内に成婚することが出来ました。
カウンセラーさんの手厚いサポートが
非常に心強かったです！",,Ci9DQUlRQUNvZENodHljRjlvT2twdWJreENWVTExU1U4MVNVdDVXRlZmVkhCdk1uYxAB
1342,201901,ChIJN6-SUeh2A2ARKpuqgcR9IlA,5,U ito,2026-02-25T14:17:14.364Z,"自分にあったプランやペースで活動できた。
相手の相談所とのコミュニケーションを適切に取って頂けたおかげで無事最後まで活動することが出来ました。",,Ci9DQUlRQUNvZENodHljRjlvT2xkdGVsQnhPVWhxWlhGU1ExVnRibUp0ZGpCb1pFRRAB
1343,202054,ChIJwx8mI5vnAGARwRZPnMZfa8c,5,とにこ,2026-02-22T03:42:25.499Z,"松村さまに夫婦カウンセリングをしていただきました。

お顔もさることながら、喋り方も選ぶお言葉も声のトーンも美しくて、カウンセリングを受けながら心がほぐれていくのを感じました。

夫婦としての悩み事は、即解決するものでは無かったのですが、解決の糸口を見つけていただきました。

夫婦それぞれの魅力を言葉にして伝えてくださったのがとても嬉しかったし、相手と自分を見直す手掛かりになりました。

本当にありがとうございました。",,Ci9DQUlRQUNvZENodHljRjlvT2pNeVRsVjRZbDloU2tRMU9ITmlNRzFpWVdGQ1oxRRAB
1344,203011,ChIJWwt7DlD4GGAR70qCwh9RnWc,5,OMPH,2026-04-05T07:40:21.333Z,"婚活を意識し始めたタイミングで、無料相談の文字が目に入り、結婚相談所とはどんな感じなのか？と、カウンセリングを受けました。本当に親身になってくださり、実績もおありだとわかり「この方にならお任せしたい」と思えて入会しました。
カウンセリング中のお話から、私の性質や結婚生活に求めていること、悩みなどを汲みとり、困ったときには助けてくださり、迷っているときにはそっと背中をおしたり、答えを見つけられるようなアドバイスをくださったり、とても心強いです。勇気を出して扉を叩いてみて良かったです！",,Ci9DQUlRQUNvZENodHljRjlvT25OTlUwdHZOakJqUWs5b1F6VXhOVU5OVVVOUFQyYxAB
1345,203011,ChIJWwt7DlD4GGAR70qCwh9RnWc,5,YUYA KOMATSU,2026-02-26T08:41:04.992Z,カンパネラさんを通じて、とても良い人に出会えました。私は時間掛かったほうですが諦めずに松山さんが日々、叱咤激励をしてくれたおかげで、成婚退会に至りました。塩対応の相談所も世の中にはありますが、サポートしてくれる方なので、婚活に興味も持った方は相談に訪れるてみる事をお薦めします！,,Ci9DQUlRQUNvZENodHljRjlvT21OalVVNXVaV2xZWmkxMVYxRlNiSEJ4T0MxRmRIYxAB
1346,202014,ChIJvQCW2keZGwwRK2HyztOvNXY,4,Kitamado,2026-04-07T18:38:19.163Z,"無料カウンセリングだけ受けました。
実際に入会したわけではないので星4つにしておきますが、ネガティブな感想を持ちました。

⚪︎カウンセラーの人が「自分も障害があるから理解がある」と言ってくれるけど、実際に話してみるとあまりそう感じない。障害といっても色々あるわけだし。脅迫性障害の人がADHDや統合失調症の人に共感できるかといったら、それはたぶん難しいですよね。
⚪︎カウンセラーが持ってる資格が婚活カウンセラー系だけで、精神疾患系の人を支援するための資格は持ってなさそう。専門性にちょっと疑問があるかな…。
⚪︎運気がどうこうというスピリチュアルな話をしてくる。「障害者の婚活」は厳しい戦いになるからこそ、冷静に理屈で勝負して欲しいと私は思う。スピリチュアル系の話でお茶を濁されたら嫌だなーと思ってしまった。
⚪︎結構急かしてくる。急かしてくる業者にあまり私は良い印象がない。強引というほどでは全然なかったけども。

でも、このクチコミを見ている人がもし障害者で、結婚したいなら検討する価値はあると思う。",,Ci9DQUlRQUNvZENodHljRjlvT2xGU1RVbFZVMGsyUWxSbFdHWlRSWFl4TTBKaVJIYxAB
1347,202014,ChIJvQCW2keZGwwRK2HyztOvNXY,5,さかみ,2026-04-04T05:43:35.202Z,穏やか且つ、わかりやすいお話でした。ありがとうございました。,,Ci9DQUlRQUNvZENodHljRjlvT2pZelVscDBjWEZxWkhrMVNIWkVNMnR2Y1dac2VFRRAB
1348,202014,ChIJvQCW2keZGwwRK2HyztOvNXY,5,白河桔梗,2026-03-14T04:33:02.302Z,"時間を間違えて来てしまったが、臨機応変に対応して頂き助かりました。
又プレゼンの内容も分かりやすいため、自分に必要なサービスかどうかということを判断出来ました。",,Ci9DQUlRQUNvZENodHljRjlvT205WGNrWm1SbHBXU1RWaVprOWZaMTl4TlVOa2JGRRAB
1349,202014,ChIJvQCW2keZGwwRK2HyztOvNXY,5,中野桐也,2026-03-07T21:39:45.462Z,"無料相談から各種説明入会書類送付までスムーズに進みました。
無料相談の際に質問をかなりしたのですが、すべて濁さず答えてくださったので期待大です。かなり丁寧にわからないことは説明してくれました。
成婚数No,1のIBJ正規加盟店とのことなので期待大です。

追記2026-03-08

昨日、IBJのアプリを使えるところまでいきました。
ハグムさんを選んだ理由は障害者でも登録できて、サポートが厚そうに感じたからです。そのある種の直感通り、ハグムさんはサポートがこの時点で既に手厚いです。こちらが「こうしたい」と言った所、「そのやり方はよくない」と言った趣旨の内容と、提案を既に何度かされています。本気でこちらのパートーナーを探す気合を感じます。
そのIBJのアプリが使えるようになるまで今まで時間がかかったのも、昨日プロフィール写真が出来上がったからです。こちらでもっと早く進むのを止めてしまっていたようでした。
ハグムさん、これからもよろしくお願いします！",,Ci9DQUlRQUNvZENodHljRjlvT2tKT1lYTkpaSGd0ZFVNd2VrWmFNSE56U1ZseWVVRRAB
1350,202014,ChIJvQCW2keZGwwRK2HyztOvNXY,5,張間繁樹,2026-02-23T06:47:43.572Z,親切に対応してくださいました。,,Ci9DQUlRQUNvZENodHljRjlvT2todmJqUnRUQzFIUkdnMVYxWnVXSEJuTld3NWNVRRAB
1351,203355,ChIJDzoPayKPGGARIMP_3DOeMvY,5,IT,2026-04-12T11:04:23.422Z,右も左もわからないまま活動をスタートしましたが、手厚いサポートを頂くことができ、成婚することができて非常に良かったです。,,Ci9DQUlRQUNvZENodHljRjlvT25wR2IzRlBhalF4YUZwT2JreGlaakJ3YjBoTlgwRRAB
1352,203355,ChIJDzoPayKPGGARIMP_3DOeMvY,5,あゆもち,2026-03-26T11:02:47.257Z,"先日、こちらの会員様と交際期間３ヶ月ほどでの嬉しいご成婚となり、成婚のお祝いをご一緒させて頂きました！
素敵なお2人が強い絆で結ばれましたのは、ひとえにお見合いからご成婚まで熱心にサポート頂きましたこちらのカウンセラーさんのおかげです✨
実は、今回のご縁のきっかけも駒井さんが会員様に弊社の会員をご紹介してくださったからで、駒井さんのアシストあってこそのご縁でした。この度は本当にありがとうございました！

ここまで熱心に会員様のためにサポートを頂けるカウンセラーさんは大変貴重で、駒井さんのおかげで素敵なお二人のご縁がご成婚という形で実り、感謝でいっぱいです✨
Charm Colorさんは、婚活者さんをサポートする私から見ても会員様思いで熱心なサポートを頂けるおすすめの相談所です！
これからも素敵なご縁を一緒にお繋ぎできますと嬉しいです！今後ともどうぞよろしくお願いいたします🙇‍♀️✨",,Ci9DQUlRQUNvZENodHljRjlvT21ReFNsOVRMVlpaY2tObWNrUndhRzlaWVY5cWNHYxAB
1353,203355,ChIJDzoPayKPGGARIMP_3DOeMvY,5,M K,2026-02-21T12:55:29.038Z,こちらの相談所を利用して成婚することができました！親身になって話を聞いてくださり、細やかなサポートがとても心強く安心して活動することができました。レスポンスも早く、友人におすすめしたい相談所です。,,Ci9DQUlRQUNvZENodHljRjlvT21aM1RqSTNXV2RIUVhGT05rcGhaVmd5ZG5aSFptYxAB
1354,203355,ChIJDzoPayKPGGARIMP_3DOeMvY,5,hsn,2026-02-15T06:21:16.717Z,入会して4ヶ月で成婚できました。入会のカウンセリングから退会までいつも優しくサポートしてくれました。大手の結婚相談所と違い、小規模な人数感ならではの手厚さが良いところだと思います。迷った時は結婚後のことを考えてアドバイスをくれるのでそこも凄く頼りになりました。友達など大事な人が迷っていたら薦めたいくらい素敵な相談所です！,,Ci9DQUlRQUNvZENodHljRjlvT2t4WWFrNDJaVU5zT1dsUlVFUXpZWFIxTm1NM01GRRAB
1355,201257,ChIJxVAQwpSRGGAR_PbB72gf5c8,5,Manmo kazuyo,2026-04-12T14:27:53.594Z,"草加市にあるciel lienさんは、
一人ひとりに寄り添った婚活サポートが魅力だと思います。

婚活に疲れていた私が、
もう一度頑張ろうと思えたのはこちらの相談所のおかげです。仲人さんは無理に進めることはなく、私の気持ちを大切にしながら寄り添ってくれる方です。
そのおかげで自然体でいられる方と出会い、無事に成婚することができました。
安心して婚活したい女性におすすめです。",,Ci9DQUlRQUNvZENodHljRjlvT2twWVQySTVMVlZoYTJNMlMyWnBRVEZzYjFaa1psRRAB
1356,201257,ChIJxVAQwpSRGGAR_PbB72gf5c8,5,y k,2026-03-21T14:52:02.885Z,"一人一人に親身になって話を聞いてくれて手厚くサポートしてくれます。
こちらが主催している座談会に参加しました。",,Ci9DQUlRQUNvZENodHljRjlvT2sxSWNuQmZibXBYTkUxZlNucG1NbEJhWHpkdVFXYxAB
1357,201257,ChIJxVAQwpSRGGAR_PbB72gf5c8,4,栢沼勇,2026-03-21T08:13:29.900Z,"色々な方の話を聞いて参考になりました。
開始時間も終了時間も最適でした。
話しやすい環境でした。",,Ci9DQUlRQUNvZENodHljRjlvT25nM1YxQk1kSEY0TjNOSVh6ZDVOV1JFTjI1MU5HYxAB
1358,203358,ChIJHfSbHJA7il8RjyvajmsjLh4,4,Mina,2026-02-13T14:35:27.566Z,正直なところ、最初は、自己分析すると自分はどんな感じなんだろうと、とてもドキドキしながらカウンセリングを受けました。でも、カウンセラーさんがとても気さくで話しやすく、安心して自分をさらけ出せました。ありがとうございました。特に、すっぴんトレーニングで、自分の心の癖がすごく変化していることを実感できて、とても満足しています。今まで、漠然と感じていた生きづらさの理由も分かり、自分の軸や自分を大切にする方法を知ることができて、気持ちもスッキリしました。自分の恋愛がなぜ上手くいかないのか、ここに悩んでる方にはすっぴんトレーニング、オススメできます。,,Ci9DQUlRQUNvZENodHljRjlvT25BeWRESkdWV3hSWDNWWlkxaFVRMGh0ZFhWdmRFRRAB
1359,200978,ChIJC_gQfrOHGGARWMWfnXPpwl8,5,sun magician,2026-04-10T06:45:07.627Z,"いつも助かります。
急な相談やトラブルにもご対応頂きありがとうございます。

とても信頼出来る仲人さんです。",,Ci9DQUlRQUNvZENodHljRjlvT25wc1oyUm1NMDFMWkdGR2FVNUZYeTFoWkVKVWIwRRAB
1360,203357,ChIJp4FC7fekoaYRJzTk-i7GOjw,5,安田恵子,2026-03-15T12:00:35.323Z,娘がお世話になりました。ありがとうございました。,,Ci9DQUlRQUNvZENodHljRjlvT25Ob2RteHdRVXhEU2tvMFdFTkVRalZpTFVkV1QwRRAB
1361,203357,ChIJp4FC7fekoaYRJzTk-i7GOjw,5,しなの,2026-02-28T07:13:57.170Z,"Cheerfulで活動されていた男性会員様と成婚いたしました。

成婚退会の面談でご挨拶に伺った際には、この日に至るまでの経緯や今後に向けたアドバイスなどを気さくにたくさんお話しくださり、温かく祝福していただきました。

成婚に至るまでご尽力をいただき、この日を迎えられたことを心より嬉しく思っております。

本当にありがとうございました。",,Ci9DQUlRQUNvZENodHljRjlvT2xReVZ6VlplbXRLYlhobVNsOU1ZM2t0TTNsbGNHYxAB
1362,203357,ChIJp4FC7fekoaYRJzTk-i7GOjw,5,ユウタYuta,2026-02-21T13:44:36.243Z,"成婚退会することとなりました。
休会をのぞくと約1年ちょっと(トータル約2年在籍しました)
ネガティブで辛かったという話を伝えたときに、ポジティブで新たな視点を与えてくれました。そのおかげで前向きに活動することができました。

あきらめず、お話をよくきくと婚活に限らず生活にハリが出るアドバイスをいただけたと思います。",,Ci9DQUlRQUNvZENodHljRjlvT2xGTVZIcE9hVFUzZVVGRk1WZDVVMmR6ZW5nMVUwRRAB
1363,202201,ChIJqyydBfuLGGARULZKYcfd82Y,5,焼きマシュマロ,2026-02-21T08:15:01.803Z,"入会して3週間ほどです。代表のしゅりさんと初めて会った時から明るくオープンな彼女に安心感を覚え入会を決めました。お見合いで通訳をやってくださったり、会員さんのために色々な制度をリーズナブルに用意してくださっていたり大変頼りになります。
これから自分の人生がどうなるか楽しみな反面不安もあり、そんな時に気にかけてくれる存在です。
Clarenceさんと伴走しながら幸せな成婚を目指したいです。",,Ci9DQUlRQUNvZENodHljRjlvT2pSdmNVOVlhMlpFV1hWdVNsTkRkRFUyTW1SeGNtYxAB
1364,202201,ChIJqyydBfuLGGARULZKYcfd82Y,5,v,2026-02-20T08:10:48.127Z,"Shuri was very helpful throughout the whole process, from setting up my profile to answering all my questions as a non-Japanese person.  She also helped me understand etiquette and customs and gave me recommendations.  I highly recommend her!!",,Ci9DQUlRQUNvZENodHljRjlvT25NMVUwRTFNbmxzYVZoNk5EbHJZelZHTVhaR1puYxAB
