レビューID,施設ID,施設GID,レビュワー評価,レビュワー名,レビュー日時,レビュー本文,レビュー要約,レビューGID
1889,201414,ChIJ_WM0sp4tAGARnKBFSDx8nEA,5,Fu,2026-03-09T13:41:22.078Z,"結婚したいけど、婚活が上手くいかない、。
自分に自信がなくなってきた、、。
婚活をはやく終わらせたい、、。
と思っている方。オススメです☆彡

この相談所の方はやさしくて、仕事が早くて、お人よし。
まさに人と人をつなげるのが天職。
私はこの人と出会えてことで結婚することができました。

ただ、この方は自分の用事を犠牲にしてまで、会員さんのために働くけど、時間的にキャパがいっぱいになることもたびたび。まさにレッドオーシャン！

連絡するなら、早くしましょう！",,Ci9DQUlRQUNvZENodHljRjlvT2sxdWVVaEZZM1ZJVUd4T2FVWk9lR3cxUlRoc1NuYxAB
1890,201414,ChIJ_WM0sp4tAGARnKBFSDx8nEA,5,R.,2026-03-09T04:22:53.597Z,"初めは不安もありましたが、お話していく中でその不安も一切なくなりました。
最高に信頼出来、明るい方です。
仕事の実績もあるので任せて間違いないと思います。",,Ci9DQUlRQUNvZENodHljRjlvT25aSWFuVkxjazFDTTFCMlYyZE5ia1V0TkRsbE9FRRAB
1891,201414,ChIJ_WM0sp4tAGARnKBFSDx8nEA,5,サニー,2026-03-07T08:44:33.208Z,"とても親身になって寄り添って頂いてます😊
イベントも様々あり、一人じゃないと思えて頑張れます！
美香さんに出会えてよかった💓
引き続きよろしくお願いします🙇",,Ci9DQUlRQUNvZENodHljRjlvT21GRE1tRnVSVzVXT1VkdWNEUjJWV0pwTFdGbVJVRRAB
1892,201414,ChIJ_WM0sp4tAGARnKBFSDx8nEA,5,ユカヒロ,2026-03-07T07:39:06.889Z,婚活イベントの際、サポートしてくださりありがとうございました。気さくにお声をかけていただけて、とても話しやすかったです。ご縁をつないでくださったことに感謝しています。,,Ci9DQUlRQUNvZENodHljRjlvT21OMU1rNUJPVWxqWjA5RWJWSXhiMGxxWTNsRVpYYxAB
1893,201414,ChIJ_WM0sp4tAGARnKBFSDx8nEA,5,L,2026-02-28T06:47:52.825Z,"2ヶ月の体験プランから本入会しました。
このカウンセラーさんになら何でも相談できると思いました。気さくではっきりと言葉にしてくださる方です。
目標に向かって一緒に寄り添ってくれること、とても心強く思います。
活動に前向きになれました。カウンセラーさんのお力を借りて素敵な方に出逢えるよう頑張りたいと思います。",,Ci9DQUlRQUNvZENodHljRjlvT2xwV2RXeE1aakZHUVhkdFdVaHpTMlF3VmxGUWJYYxAB
1894,201414,ChIJ_WM0sp4tAGARnKBFSDx8nEA,5,仁,2026-02-27T12:49:44.308Z,いつも親身に相談にのってくれるので心強いです！ありがとうございます！,,Ci9DQUlRQUNvZENodHljRjlvT21ZM1JFbENNMXB3VDNKd1IzTXhMWFE0Ym1WR04xRRAB
1895,201414,ChIJ_WM0sp4tAGARnKBFSDx8nEA,5,ザビエル,2026-02-27T08:22:51.316Z,"地元に戻ってきてから出会いがなく、どうしようかと思っている時に、r.Fleurのことを知り、婚活目的に入会しました。カウンセラーさんはクセのある私を決して否定せず、非常に親身になってくれています。必要に応じて、アドバイスもしてくれるので、大変ありがたいです。
パーティーなどのイベントも豊富だったり、他県の相談所とも連携されているので、広い範囲でお相手を探せるところに魅力を感じています。
引き続きよろしくお願いします🙇",,Ci9DQUlRQUNvZENodHljRjlvT2t0VVlubFpSWFV3TTNwWmVuQkNNMUpPTFhZMWRFRRAB
1896,201414,ChIJ_WM0sp4tAGARnKBFSDx8nEA,5,moco,2026-02-27T07:31:40.149Z,"無料相談に行きました。
最初は緊張していたのですが話しやすいカウンセラーさんです。
色々相談に乗って頂けて、今後の活動も楽しみになりました。",,Ci9DQUlRQUNvZENodHljRjlvT21sMmRGcEtWM0JXY1RkS09VSnNSVXQyVURobmMwRRAB
1897,201414,ChIJ_WM0sp4tAGARnKBFSDx8nEA,5,くりもも,2026-02-23T02:26:16.085Z,みかさんに、彼とお付き合いするご縁をいただきました。３年目を迎えます。仲睦まじく過ごし、公私共に充実した毎日を送っています。みかさんには、恋愛だけでは無く、心の持ち方や生き方について多くを学ばせていただいてます。感謝しかありません。,,Ci9DQUlRQUNvZENodHljRjlvT2xwelZWbFdSRGRuU1hSMVFsQkhYM2R4VVVkRFduYxAB
1898,200853,ChIJUXZSGZeLGGARuta11XgyZ98,5,Omi Kikuchi,2026-03-12T03:19:03.214Z,"徹底的に寄り添ってサポートする相談姿勢が抜群です！
私のとりとめない身の上話に根気よく付き合ってくれ、
すばらしい傾聴力で、寄り添ってお話ししていただけます。
安心して相談できます。",,Ci9DQUlRQUNvZENodHljRjlvT21SZlpVa3ROVFpoYzE5eFQweE9NbFF3VDBoTVVHYxAB
1899,201272,ChIJhQ_6WCYoil8R1JPwNi1ID5w,5,木村瑞希,2026-04-02T11:40:42.973Z,いくつか結婚相談所を比較して、サポートの丁寧さに惹かれて入会しました。紹介だけでなく、プロフィールの作り方やコミュニケーションの取り方まで細かくサポートしてもらえたのが印象的です。恋愛経験が少なく不安でしたが、寄り添ってもらえたおかげで前向きに活動できました。結果的に良いご縁に恵まれて本当に感謝しています。,,Ci9DQUlRQUNvZENodHljRjlvT2kxM1lrcERVekp0VjJWTlIydGFhV1o0V2toalNuYxAB
1900,201272,ChIJhQ_6WCYoil8R1JPwNi1ID5w,5,あらりん850R,2026-03-12T09:39:27.767Z,"先日仙台へ出張の際友人と喋っていて彼女を紹介してきたよ。
色んな仕事を転々してきてなかなか落ち着かなかった友人がここで知り合い順調だそうです。ここはいつでも相談に乗ってくれ安心出来たのが良かったとか。このまま行って欲しいと応援の意味を込めました。",,Ci9DQUlRQUNvZENodHljRjlvT2toNVNrNU1RMVZIYTFJd2FWWnJOMVJWUld4MFVsRRAB
1901,203427,ChIJMUKgndXzGGARbAiYILTZXBE,5,プリムラ,2026-02-28T13:57:23.986Z,"友人の紹介でマリッジトレインさんを知りました。
入会前の面談の時から大友さんには親身になっていただき、ぜひマリッジトレインさんで婚活を始めたいと思い入会しました。様々なことで悩んだ時、その都度大友さんからアドバイスをいただき婚活を進めた結果、素敵なお相手に出会い、成婚することができました。
婚活に対して全然自信がなかった私でしたが、1つ1つ手厚くサポートいただき、とても感謝しています！",,Ci9DQUlRQUNvZENodHljRjlvT25CcFMzVnhTVVJ5WlVwbmVETlhPRlZLZGtjME0wRRAB
1902,201194,ChIJBxbtzSzTsGoRqtMtE5nQsDo,5,mo mota,2026-04-05T04:32:57.615Z,"他の結婚相談所からの移籍の形で入会しました。
以前は上手く進められないし、どう解決していけばわからないからやめようかな...と思っていた所、Xであいりさんのアカウントを見付け、お話を聞いてみてから決めよう！から始まりました。
無料相談の時点から返信がとても速いです。
プロフィール写真の同行もしてくださり、インタビューもじっくりしていただきました。自分では表現できない所を言葉にして頂けたと思います。
私はまだ参加出来ていませんが、女子会やオンラインの勉強会も開催されています。
これからの活動頑張っていきたいと思います！",,Ci9DQUlRQUNvZENodHljRjlvT25oSGJ6VjVTRFF6ZFZRMGVGRjJWVGswV1VaSlgyYxAB
1903,201194,ChIJBxbtzSzTsGoRqtMtE5nQsDo,5,brûlée cheesecake,2026-04-04T10:21:01.624Z,"マッチングアプリでの活動が停滞していた際、XでMarry Celebrate 長岡さんを知り入会しました。

強引な勧誘は一切なく、常にこちらの意思を尊重し寄り添ってくださる姿勢が決め手となりました。

初回カウンセリングから2週間弱で活動開始でき、そのスピード感にも驚いています。活動中も連絡は基本即レスで、不安なことも丁寧に解消してくださるため、非常に心強いサポート体制です。

目標の成婚時期に向け、信頼できるカウンセラーさんと共に頑張っていきます。",,Ci9DQUlRQUNvZENodHljRjlvT21wMGNuWlpkSGhpYld0dmRWSjRXVFpOUmpkdVRFRRAB
1904,201194,ChIJBxbtzSzTsGoRqtMtE5nQsDo,5,M.M,2026-03-31T23:09:52.423Z,"本当に結婚したいのか、自分自身の気持ちがはっきりしない状態で初回の面談に伺いましたが、とても親身に話を聞いてくださり、疑問点などは率直にご説明いただき安心できました。
入会後も、いつご連絡しても、すぐにお返事くださり、ご相談すると的確にアドバイスをいただけるので安心できます。
プロフィール写真の撮影や、面談を通しての、自分自身の気持ちの棚卸しなども、時間をかけて丁寧に対応いただきました。

まだ始まったばかりですが、よろしくお願いいたします。",,Ci9DQUlRQUNvZENodHljRjlvT2tsa1NHaDRXR2xCTVc1bFExb3phbkZSTTBWSWJtYxAB
1905,201194,ChIJBxbtzSzTsGoRqtMtE5nQsDo,5,ふー,2026-03-24T00:34:35.215Z,"【2026.3追記】
あいりさんの相談所に入会し、出会った方と成婚退会しました。
プロフィールの写真撮影、プロフィール作成なども丁寧で迅速に対応して下さったお陰で素敵な方に出会うことができました。
初めての婚活で戸惑いや不安もありましたが、あいりさんはいつでも悩みや不安にも親身になって聞いていただき、夜遅い時間にもすぐレスポンス下さいました。あいりさんから「いつも私の味方だよ」と言って下さったことは私の心の支えとなっていました。定期面談は婚活、仕事の話、プライベートまで何でも話せるお姉さんのような存在で、毎回ワクワクして面談に行っていました。
あいりさんのお陰で私にはもったいない位、素敵な方と出会うことができて感謝しかありません。
婚活で不安な方、サポートが充実している相談所を求めている方にぜひ入会していただきたいです。

Xをみて入会しました。
あいりさんは初回面談の予約時は迅速に対応していただき、分からないことや不安なことはいつでもすぐに相談に乗ってくださいます。
また、率直な意見をくださるので自分の足りない部分や改善点を見つめ直す機会にもなります。
始まったばかりですが、今後の活動が楽しみです！宜しくお願いします。",,Ci9DQUlRQUNvZENodHljRjlvT2xkMVpFaEdkalJvT0RaNU0zTTVhVzFpY1hsM1JYYxAB
1906,201194,ChIJBxbtzSzTsGoRqtMtE5nQsDo,5,F,2026-03-02T14:33:18.201Z,知り合いからやり手の仲人さんがいると紹介して頂き入会しました。入会の手続きもスピーディーで、とにかくレスが早いです。美容にも詳しく、服やメイクなど相談に乗って頂けます。プロフィール写真にも力を入れており、自分ではないような仕上がりでした。始まったばかりで上手く行くのか不安ですが、長岡さんのサポートがあれば成婚に向けて頑張れそうな気がします。大手よりもサポート体制が厚く、おすすめだと思います。,,Ci9DQUlRQUNvZENodHljRjlvT2pSVFMwVlZSek5zYkZwVmEzbDNRa3hTVTA5RFlrRRAB
1907,201194,ChIJBxbtzSzTsGoRqtMtE5nQsDo,5,S H,2026-02-27T07:38:31.567Z,"無料カウンセリングを受けて、こちらへの入会を決意しました。他の方も仰っているように、レスポンスが早く、カウンセリングもきめ細やかで、とても丁寧に対応いただいています。
こちらにお世話になるかを決める際に他社も検討しましたが、サポート体制やレスポンスの早さに加えて、やはり自己PRを読んでもらう入口となるプロフィール写真への考えが真逆だった事が決定的でした。
これから活動が本格的に始まりますが、初心を忘れずに行きたいと思います。どうぞ宜しくお願いいたします。",,Ci9DQUlRQUNvZENodHljRjlvT21GWmFYWlVaelY0WDFSek1HNXNhemROTWtWT05rRRAB
1908,201194,ChIJBxbtzSzTsGoRqtMtE5nQsDo,5,eriko sen,2026-02-21T09:04:49.103Z,"初回のカウンセリングから常にレスポンスが早く、迅速に対応してくださるので大変助かっています。
活動中の不安についても親身になって相談に乗ってくださり、婚活用の洋服のアドバイスや買い物への同行までしていただきました。自分一人では迷ってしまうことも多いので、プロの視点でサポートいただけるのは本当に心強いです。
また、夜遅い時間でも反応してくださり、不安を感じることなく活動を進められています。いつも温かく寄り添ってくださり感謝しています。今後ともよろしくお願いします。",,Ci9DQUlRQUNvZENodHljRjlvT21ocE1GOVNTRkkyYURGMVRsZGpOelp2YmxOM2QyYxAB
1909,201194,ChIJBxbtzSzTsGoRqtMtE5nQsDo,5,masayuki,2026-02-14T15:32:37.873Z,"入会前の相談から手続き、写真撮影と一貫してとても丁寧に対応いただいています。
こちらの話をしっかり聞いたうえで説明してくださり、無理に勧められることもなく、安心して判断できたのが印象的です。

カウンセラーの方も話しやすく、結婚に対する考え方について親身に向き合ってもらえました。
レスポンスもとても早く、信頼して活動をお任せできそうだと感じ、入会を決めました。

これから前向きな気持ちで活動を進めていきたいと思います。
どうぞよろしくお願いします。",,Ci9DQUlRQUNvZENodHljRjlvT2xaSWREWkhTR3AzVXkxM01WZEpRV1l6V21oT1JuYxAB
1910,202552,ChIJU0E_9ZlDHmARRtLP3Qp0Bb8,5,rie,2026-03-28T11:35:24.212Z,"私はこちらのマリーガーデン･エルさんで4ヶ月お世話になりました。相談所で活動すること、年齢のこと、すべて不安がありましたが、担当カウンセラーさんはいつも私の気持ちに寄り添ってくださり、優しくアドバイス、サポートしてくださいました。そのお陰でいつしか不安もなくなり、自分の軸を持ちながら活動することが出来たと思います。
時には一緒に涙を流してくださった事もありましたね。
2個上の素敵な方と出会い、成婚退会することができました。このご縁を繋いでくださった担当カウンセラーさんに心より感謝申し上げます。ありがとうございました。",,Ci9DQUlRQUNvZENodHljRjlvT2kxU1dFVlllbk5DYkRsc2R6aGtXVzV5WVUxaFVuYxAB
1911,201098,ChIJoQFOc8uLGGARt9o-EKu075U,5,なっち野澤,2026-03-29T09:30:05.286Z,"この度、成婚退会が決まったので初めて口コミ書きます。
9月に入会し、小山さんにたくさんのお力添えをいただき、2月バレンタインにプロポーズ、両家顔合わせも終わり3月で晴れて成婚退会となりました。
皆さんも書かれている通り、人情味溢れる素敵なカウンセラーさんが運営している相談所です。連絡もマメで明るく優しく寄り添ってくれます。
マリノワさんに入ってよかった！と心から思っています。ありがとうございました。",,Ci9DQUlRQUNvZENodHljRjlvT2tNMFUySnJTVEJvY21OQmMzVnNOMTlKZGxReGNFRRAB
1912,201029,ChIJ2XjfAIRTFTUR79kju-_yqOo,5,森航平,2026-03-31T10:08:33.253Z,,,Ci9DQUlRQUNvZENodHljRjlvT2s1aGFXd3lWbmhZZEc4MVVqQkZkMVZZUm01UFZHYxAB
1913,201892,ChIJgTVQH8LxGGARXoTMuiClPas,5,r,2026-04-07T12:04:42.765Z,"婚活に対して何から始めればいいか分からず不安でしたが、相談してみて視点が変わりました。
自分では気づけなかった考え方や整理の仕方を教えてもらえて、自然と次の行動が見えてきました。
無理に急かされることもなく、自分のペースで進められそうだと感じています。",,Ci9DQUlRQUNvZENodHljRjlvT2s1TVYwTjVVa1JuT0RoV2VVOWxVVzA0UmpCTGNVRRAB
1914,201892,ChIJgTVQH8LxGGARXoTMuiClPas,5,emi,2026-03-28T10:26:50.754Z,"最初は、結婚相談所というと少し堅いイメージがありました。
でも勝さんは、上からアドバイスする感じではなく、こちらの気持ちに寄り添いながら、今の状態を整理してくれる方でした。
私は婚活で迷いが多く、考えすぎて動けなくなることがあったのですが、相談した時に「何が不安なのか」「本当はどうしたいのか」を一緒に言語化してもらえたのが大きかったです。
一人で婚活していた時より、気持ちの負担がかなり減りました。
焦らせるのではなく、でもちゃんと前に進めてくれる。そんなあたたかさのある相談所だと思います。",,Ci9DQUlRQUNvZENodHljRjlvT2tOMFNXaE1lRFJDWm5aMFNYUnVObEZpVG5OTFZGRRAB
1915,201892,ChIJgTVQH8LxGGARXoTMuiClPas,5,明里,2026-03-21T12:34:41.774Z,"勝さんの相談所は、いわゆる「とにかく急かす婚活サポート」とは違いました。
実際に相談してみて感じたのは、こちらの状況や性格を見ながら、無理のない形で方向性を整えてくれることです。
私は婚活で気持ちが空回りしやすく、何が正解なのか分からなくなっていたのですが、勝さんと話す中で、自分が本当に大事にしたいことや、相手を見る視点が整理されていきました。
ただ励ますだけでなく、ちゃんと整理してくれるのが印象的でした。
話をちゃんと聞いてくれるだけでなく、曖昧だった部分を言葉にしてくれるので、相談後は不思議と気持ちが軽くなります。
一人で頑張りすぎている人には、特に合う相談所だと思います。",,Ci9DQUlRQUNvZENodHljRjlvT2xGZlRFaHRTRTVPYzA1d1prcE1jamh4ZWxwSGFVRRAB
1916,201892,ChIJgTVQH8LxGGARXoTMuiClPas,5,ぱんさー,2026-03-13T09:30:43.835Z,"婚活について誰に相談していいかわからず、ずっと一人で悩んでいました。
勝さんに相談してまず感じたのは、ただ条件ややり方を押しつけるのではなく、こちらの気持ちを丁寧に聞いた上で、頭の中を整理してくれることです。
自分では「結婚したい」と思いながらも、何を基準に進めればいいのか分からず止まっていたのですが、話していくうちに、自分が迷っていた理由や、これからどう動けばいいかが少しずつ見えてきました。
相談前は頭の中がぐちゃぐちゃでしたが、話した後はやることが見えました。
すぐに答えを出させる感じではなく、でも前には進ませてくれる。そんな安心感のある相談所だと思います。",,Ci9DQUlRQUNvZENodHljRjlvT2pZMmRHZHVMWEZqTjB4aGNUSXliR0Z3ZVRsbmJYYxAB
1917,201770,ChIJ-aloxpSTGGARAy5NquB8rJE,5,池川加恵,2026-03-15T13:15:43.352Z,"手相をみてもらいながら
相談も気軽にしてもらえて
とても雰囲気よく信頼できるところだと
思いました！",,Ci9DQUlRQUNvZENodHljRjlvT25CM1ZTMU9aRjlWVkRCNWVUSkVZMWQ1ZEdadGMzYxAB
1918,203185,ChIJ_YJBQkM1-F8Rv7mhIddf2AI,5,ゼブラマン,2026-03-25T10:55:08.407Z,"こちらの相談所のおかげで時間はかかりましたが成婚退会する事が出来ました。
年中サポートしていただける所が魅力なのと、LINEでいつでも相談出来て助かってました。
くだらない事でもすぐに相談出来たりする所も魅力です。
成婚退会した後でも相談に乗ってくれる所もおすすめです。
長い期間かかりましたが、黄倉さんのおかげで諦めずに成婚出来ました。
ありがとうございます。",,ChdDSUhNMG9nS0VJQ0FnSUMzaHN1VTVBRRAB
1919,201220,ChIJY2kWGa-JGGAR5N1w8zRjkwM,5,Daichi Ogawara,2026-04-12T02:24:43.554Z,"カウンセラーの方がめちゃくちゃ良かったです！
話しやすいのはもちろん、的確な指摘アドバイスも、配慮ある表現でしっかりしてくださり、顧客に迎合せずちゃんと成果に向き合ってくれているスタンスにプロさを感じました。
大手に行きがちですが、行ってみて本当に良かったです。
ありがとうございました！",,Ci9DQUlRQUNvZENodHljRjlvT2tocVIzZFpiMTh0WTI5b2NqRnJZakZFUWt4a2JWRRAB
1920,201410,ChIJ6UWjR1OfRjUR8k_JfP84xBk,5,sho,2026-02-25T13:50:11.099Z,訪れた際、1対1でしっかりと話ができる環境がとても良かったです。婚活パーティーの情報を収集するために伺ったのですが、スタッフの方の対応が親切で安心感がありました。雰囲気もアットホームで、初めての方でも気軽に参加できそうです。ただ、もう少しイベント内容の種類が増えるとさらに魅力的になると思います。全体として、とても満足できる体験でした。,,Ci9DQUlRQUNvZENodHljRjlvT2twTWN6QXlhVlZ3VVc1RWJGUlZiRUZLZFRsbFRYYxAB
1921,201410,ChIJ6UWjR1OfRjUR8k_JfP84xBk,5,ちぃ,2026-02-12T09:28:35.709Z,お忙しい中、婚活相談にお越しいただき、誠にありがとうございます。担当者の対応はとても満足で、安心感や親しみやすさも感じられ、リラックスして相談できました。特に気に入った点は特にないですが、全体的にとても良い雰囲気でした。次回も利用したいと思います。,,Ci9DQUlRQUNvZENodHljRjlvT25vMFNFcENSVGgzYzBGT1QydFpSME5MWkhwV09GRRAB
1922,201410,ChIJ6UWjR1OfRjUR8k_JfP84xBk,5,おすし,2026-02-11T07:16:20.541Z,スタッフの方々の温かい対応に感激しました。話しやすさは抜群で、リラックスして相談できました。明るい雰囲気の中、婚活に対する不安も解消されました。また、他の方にも自信を持ってお勧めしたいです。,,Ci9DQUlRQUNvZENodHljRjlvT205bmQxOXhkSGsyU3pOR1ZHSlpRVVpNV0c5S05sRRAB
1923,202688,ChIJn2DSjlPnAGARL9WTl__Qk4c,5,和泉,2026-04-06T15:17:59.085Z,"大手からの乗り換えで登録させていただきました。人と人の付き合いというか、友人として親身になって相談に乗ってもらったり、アドバイスをいただき、良いお相手と巡り合うことができました。
成婚してからもお相手に会ってみたいと言ってくださったり、婚約が決まったなら早く手続きしちゃおう月会費がもったいないよ！と月末ギリギリだったのに退会手続きをしてくださったり最後まで親身になって動いていただき嬉しかったです。
前の相談所での活動が上手くいかず悩んでいましたが、ここを選んでよかったです。",,Ci9DQUlRQUNvZENodHljRjlvT25GRFQwTnFabE5HWjBKVFVUWkZiRTUxYzNaU09XYxAB
1924,202688,ChIJn2DSjlPnAGARL9WTl__Qk4c,5,Ay,2026-02-23T07:47:51.359Z,"とても親身に話を聞き熱心にサポートしてくださるカウンセラーさんで、本当にここを選んで良かったです！
入会時は、仮で書いた自己紹介文をキレイにまとめていただいたり、プロフィール写真を一緒に選んでいただいたり、不安な点を気軽に相談できたり、安心してスムーズに活動を始めることができました。活動開始後も、WEB面談やLINE等で色々と相談に乗っていただきました。私は消極的な方ですが、こちらからも男性に積極的にお見合いを申し込むようおすすめされ、結果今の彼に出会いました。カウンセラーさんに話を聞いてもらいながら色々な人に会う中で、自分の理想のタイプがはっきりとし、スピード感を持って成婚に辿り着くことができました。
退会後も式場や2人の住まいのこと等相談することができ、とてもありがたいです。相談所を迷っている人にぜひオススメしたいです！",,Ci9DQUlRQUNvZENodHljRjlvT2t4QmJFaElkalZZVnkxTFJXNU1ZMjkyWW5KU00zYxAB
1925,201123,ChIJMeVnPjguny0Rd2Gll5dzn_M,5,7 akane,2026-04-08T15:16:31.113Z,とても優しいカウンセラーさんです。どんな話も親身になって聞いてくださるし、とても的確なアドバイスをしてくださって非常に心強いです。また話を聞いてほしいって思えるカウンセラーさんに出会えて良かったです！,,ChdDSUhNMG9nS0VMN3dqdVQwMTVxbzlnRRAB
1926,202657,ChIJ74Irhh4hL20RuiER-CT_Zaw,5,はるねこ,2026-03-29T06:55:00.923Z,,,Ci9DQUlRQUNvZENodHljRjlvT2xkdlNrOWFlRlYxTldKdFJEWlZlbTB0Vm1oRmIwRRAB
1927,202657,ChIJ74Irhh4hL20RuiER-CT_Zaw,5,篠原広樹,2026-02-14T08:59:12.254Z,"初めてで緊張しました。
みんな年上だったため会話が弾むか不安でしたが、優しい方が多く楽しかったです！！",,Ci9DQUlRQUNvZENodHljRjlvT2tNNFptcFZSRVJKUjBoVGNqUmtOM3BxTVVjNVVVRRAB
1928,202657,ChIJ74Irhh4hL20RuiER-CT_Zaw,5,とっとととお,2026-02-14T08:57:25.841Z,"とても和やかでいい会だったと思います。
サポートしてくださるスタッフさんも気が利いててありがたかったです",,Ci9DQUlRQUNvZENodHljRjlvT2pjdGVuZGZWRlZ4ZGxBeFZWQnlWMmhGTkV0emJIYxAB
