レビューID,施設ID,施設GID,レビュワー評価,レビュワー名,レビュー日時,レビュー本文,レビュー要約,レビューGID
101,202294,ChIJVaHLxTEGVDUR0ViGNUGnGHg,5,たのたの,2026-03-27T09:34:16.065Z,とても感じが良くてアドバイスもたくさんしていただきました。親身になっていろいろ考えて下さり感謝してます。入会してほんとによかったなぁって思ってます。,,Ci9DQUlRQUNvZENodHljRjlvT21sclpqaG5NVEkzV1ZsNldrRlpYeko1YmpoMlFYYxAB
102,202294,ChIJVaHLxTEGVDUR0ViGNUGnGHg,5,ue-y,2026-03-21T03:23:52.796Z,"相談しやすいので活動が続けられています。
これからも宜しくお願いします。",,ChdDSUhNMG9nS0VJQ0FnSURGdW9HVnZRRRAB
103,202294,ChIJVaHLxTEGVDUR0ViGNUGnGHg,5,アーサー,2026-03-15T05:45:09.895Z,"2人ともとても親切で ちょっとした
アドバイスも細かく説明してくださります
不安な時も励まし気持ちをもち上げてくれるので婚活を頑張れる相談所です",,Ci9DQUlRQUNvZENodHljRjlvT2pjMExVYzVVbVZxU2tWRVFYVjFjSFI1VGxKRU1YYxAB
104,202551,ChIJv0RB6Lv6AGAR3EwwL_yBPRU,5,mixed juice,2026-04-06T11:38:03.779Z,"飯塚先生を始めカウンセラーの皆様には、いつでも暖かくお迎えいただき、親身に、的確なアドバイスをいただけました。
おかげ様で、この度、婚姻退会することができました。
本当にありがとうございました！",,Ci9DQUlRQUNvZENodHljRjlvT25GR2JsbzROV3hKUVVWcU4yeDBMVVF5WjJWWVEzYxAB
105,202551,ChIJv0RB6Lv6AGAR3EwwL_yBPRU,5,脇田和栄,2026-03-29T06:54:30.461Z,"還暦を迎える歳に、こちらの相談所へ入会し、入会からちょうど1年後に何人目かのお見合いのお相手と結婚する事になりました。
昨今中高年の婚活も盛んだと聞いておりましたが、想像を超える程たくさんの会員がおり皆さん第二の人生を謳歌するために婚活されている事に衝撃を受けました。
飯塚さんをはじめ、スタッフの皆様にご紹介やアドバイスを頂きながら、良いご縁に繋がられる事ができました。
改めて、ありがとうございました。",,Ci9DQUlRQUNvZENodHljRjlvT2s1VWVESjVWemxhUm5OTWVsVk1Oa2N4TUhJeFVGRRAB
106,202551,ChIJv0RB6Lv6AGAR3EwwL_yBPRU,5,フラワーエリー,2026-03-28T08:30:59.975Z,スタッフの方には、とても親身になっていただき、ご紹介もたくさんしていただきました。その中で、やっと運命の方と出会うことができました。とても感謝しています。,,Ci9DQUlRQUNvZENodHljRjlvT2s5cFdHMU9jMm8yWkdKeWNsZFBiRGREWVdVMmRHYxAB
107,201652,ChIJRWTVbaMIAWARkSA-Z3Fsjco,5,pine,2026-04-08T09:12:37.125Z,"無事今後の人生を一緒に過ごしたいと思える人に出会えました。
こちらの京都縁結び倶楽部に入会したのは職場の方がこちらで結婚が決まったのでその紹介で行きました。
最初はどうして良いか分からず失敗もしましたが担当の清水さん、細見さんにアドバイスを沢山頂き、約1年半で成婚退会出来ました。
話は合って楽しいが結婚を考えると違う...という方には出逢えていたのですが、中々結婚を考える方と出会えず１年経った頃に仕事も忙しくなり、しばらく活動を控えていました。少し仕事が落ち着いたので活動を再開し、1人目に出逢ったのが運命の人でした。
３ヶ月の交際を経てプロポーズし、今年結婚が決まっています。
諦めずに運命の人と出逢えたのは京都縁結び倶楽部のスタッフの方々のおかげです。
少し厳しい事も言われたりしましたが、それがあって私自身が成長したからこそ運命の人に出逢えたのだと思います。
結婚したいと思うなら是非行って下さい。
遅くなるほど間違い無く不利なるので婚活は早い方が絶対良いです。",,Ci9DQUlRQUNvZENodHljRjlvT2tGWFVtcFFXbnA2V21oWFNHeHVWR1UyUWxoME5FRRAB
108,201966,ChIJ0fLm7ysoil8Rb1-LWlr3-4w,5,A I,2026-02-28T10:59:35.432Z,仙台に住み続けたかったので、仙台の相談所を探しました。口コミを見て、安心感のある中村さんにお願いすることにしました。活動は大変になるだろうなと覚悟していましたが、写真撮影からプロフィール、活動中のサポート・フィードバックに至るまで、やさしく、あたたかく寄り添ってくれたので、活動を前向きにたのしむことができました。結婚相手を見つけることができたのは中村さんのおかげです。本当にありがとうございます。,,Ci9DQUlRQUNvZENodHljRjlvT25sQ2NXaHJMVXd3Y2tWaGFVMW5RVXBDZEdzNE9YYxAB
109,202962,ChIJsRZBCMeIil8R-TWlbiM2Ybw,5,婚活サポートクラブ福島,2026-03-22T01:07:14.302Z,"この度は弊社、女性会員様と【アエル福島】さまの男性会員様とのご成婚に多大なるご協力をいただきまして心より感謝いたしております。
これもひとえに安部先生のきめ細やかなサポートの賜物でございます。
途中、お互いの相違もあった場面での安部先生のスピードを持った適切なアドバイスは私も大変勉強になりました。これからお二人を末永く見守っていきたいと思っております。
今後とも、お互いに福島の明るい未来に向けて頑張って参りましょう！この度は誠にありがとうございました。",,Ci9DQUlRQUNvZENodHljRjlvT25ocVRWODJkRFJUTUd0ZlprNXdWM0ZtTmxWeVkxRRAB
110,202962,ChIJsRZBCMeIil8R-TWlbiM2Ybw,4,えわ,2026-03-09T11:07:23.686Z,些細な内容の疑問や不安点、聞きにくいようなことでも親身になって助言していただけます。カウンセラーの方が仰っていたお見合いは一期一会…まさにその通りだと思います。今まで他のではうまくいってなかったのですがここではトントン拍子で進んでいます。,,Ci9DQUlRQUNvZENodHljRjlvT21aUVNIbDJTSGRXWkZCcmVHaEZTelJWWVhGamQyYxAB
111,203066,ChIJt5nsKfy--F8ReEZh7qn3bJ0,2,毬谷敵親,2026-03-10T12:54:23.119Z,"アラフォー・アラフィフ女性最期の砦を見学!
シンプルでクリーンな建物、親切丁寧な案内でした
ありがとうございました(о´∀`о)",,Ci9DQUlRQUNvZENodHljRjlvT2t4eWFuQmtjamhxU0ZweVkxODBWMnRvYlRodldsRRAB
112,203066,ChIJt5nsKfy--F8ReEZh7qn3bJ0,1,異常独身女性,2026-03-09T15:43:10.702Z,"数年前:安かろう悪かろう
現在:高かろう悪かろう",,Ci9DQUlRQUNvZENodHljRjlvT2tJMVFtNWxNa1ZKZUc5UmFUWkxibWwxUWtaTk5rRRAB
113,202406,ChIJKYTCNZySHmAR3ROcWMVCD1U,5,なっとうマン,2026-03-08T22:16:01.646Z,こちらで妻と出会い結婚、子供も授かり今は大変ながらも幸せな毎日を過ごせています。マチアプ等便利でお手軽に出会いの場を得られる現代ですが自分は相談所さんを選びました。親切丁寧に希望や理想を話をきいてくださり時にはお耳に痛い言葉も頂くこともありましたが最高のスタッフさんだったおもいます。婚活に悩んで壁に当たってる人には自信をもってオススメします。経験者は語るです,,Ci9DQUlRQUNvZENodHljRjlvT2twM1dGSklTR05GVkdVM1lVaE1NeTFKY2pJMGFFRRAB
114,202406,ChIJKYTCNZySHmAR3ROcWMVCD1U,5,RIE,2026-03-06T11:51:40.822Z,"友人がそちらでいい縁があり、私も続きたいと思い登録させてもらいました
相談しやすかったり、的確なアドバイスをいただけるので心強かったです
私も素敵な方と巡り会えました
登録をする時に源泉徴収の提出があり、自己申告だけでないので安心できました",,Ci9DQUlRQUNvZENodHljRjlvT2twMFYweHFNMlJQZUdkSVgyZEVVbmxNVkhwbFdtYxAB
115,202406,ChIJKYTCNZySHmAR3ROcWMVCD1U,5,Ya “ばら”,2026-03-06T11:20:23.854Z,"こちらで素敵な旦那様と出会うことができ、本当に感謝しています。
親子で経営されていて、お二人とも優しく丁寧に接してくれます。親戚の家にいるような安心感があります。恋愛アプリでは失敗したものの、結婚相談所では独身証明書などを提出しなければ登録できないので、信頼できました。恋愛アプリで無駄な時間を過ごすくらいなら、結婚相談所のアプリで効率的に出会う選択は賢かったと思います。自分への良い投資になり、幸せな結婚生活を送っています。",,Ci9DQUlRQUNvZENodHljRjlvT2s1NGQwbHdTMWhPZWpsdlJ6UXlSRUpTZVhkWWNYYxAB
116,200835,ChIJj28XZe92A2AR49oU_nTSq3M,5,おざき,2026-04-11T12:22:24.895Z,"約1年の活動を経て、2026年4月に成婚退会しました。
25歳で入会し、内田さんのカウンセリングを受けるたび、恋愛とは違う”結婚”というものの考え方をたくさん教えていただきました。
内田さんの後押しがきっかけとなり、素敵なお相手と成婚退会することができ本当に感謝しています。

不安なことを相談すると的確に道を示してくれ、それ以外は深く詮索せず程よい距離感で活動を見守っていただき、ストレスのない楽しい活動になりました。

いつ終わるかわからない活動に不安を覚えたこともありましたが、内田さんのおかげでとても良い経験ができました。
本当にありがとうございました！",,Ci9DQUlRQUNvZENodHljRjlvT25sWFdXaGZVRXhOZGpCUWFqVllNelZ4YVVOT1NuYxAB
117,200835,ChIJj28XZe92A2AR49oU_nTSq3M,5,MR.0118,2026-04-07T12:27:23.558Z,"2025年11月に入会し、2026年3月に成婚退会しました。
カウンセラーの内田さんと話すと、いつも前向きな気持ちになりました。
内田さんに会えたことも名古屋婚活に入会して良かったと思う理由の一つです。
なかなか思うようにいかず、落ち込む時もありますが、その人とは縁がなかっただけだから落ち込む必要なしと思えたのも内田さんのおかげです。
「縁がある人とは無理をしなくても繋がっていくものなのでね」という言葉に励まされ、自分をよく見せようとか選んでもらわなければ！なんとしてでも早く決めなければと焦る必要はなく、自然体で楽しく色々な人と会って楽しくおしゃべりしてこようと肩の力を抜いて婚活することができました。
婚活は楽しいことばかりではないので、行き詰まることもありますが、そんな時こそカウンセラーさんと話すことが大切です。名古屋婚活では無理のない範囲で自分らしく婚活をするにはピッタリだと感じました。
ありがとうございました！",,Ci9DQUlRQUNvZENodHljRjlvT20xRGVEQnlXa2N5YkVwR2JqbE5iMXBhY0Uxa2EwRRAB
118,200835,ChIJj28XZe92A2AR49oU_nTSq3M,5,rs 0228,2026-04-06T13:24:11.128Z,"約3年、名古屋婚活で活動をさせていただきましたが、
先日、ようやく成婚退会することができました。
カウンセラー様も親身に対応いただき、3年間自分のペースで活動できたので、自分の人生の成長のためにも、とても有意義な時間となりました。
活動を通して、自分の価値を見つめ直し、時に落ち込む時もありましたが、自分らしく居られるパートナーを見つけられたのは、
名古屋婚活のおかげだと思います。
本当にありがとうございました。",,Ci9DQUlRQUNvZENodHljRjlvT25jMk0wbDVibG95YkhaWU5VdEdSRGMzWDBsMFkwRRAB
119,200835,ChIJj28XZe92A2AR49oU_nTSq3M,5,梅雨生まれの麦,2026-03-10T16:28:54.137Z,"2026年2月に成婚退会しました。
わたしは仕事上シフト制なので、お見合いの調整が難しいのでは‥と思っていましたが
カウンセラーの内田さんはいつも迅速に対応をしてくれたのでたくさんのご縁を頂けました。なかなか上手くいかずこの世の終わりの様な顔で伺った定期面談も(笑)内田さんに話を聞いてもらうとスッキリした気持ちになれました✨それはいつもこちらの話を遮ることなく聞いてくれたことや、自分のペースで活動ができたからだと思います😊
おかげで『この人がいい！』と思える素敵な方と出会うことができました！本当にありがとうございます！

結婚相談所は最後に頼るところと思っている方もいると思いますが、わたしは寧ろ最初が良いと思います。名古屋婚活さん、大変おすすめの相談所さんです🍀",,Ci9DQUlRQUNvZENodHljRjlvT2xVNFRrVjRSa1kyT1U5Uk5qTk5hMUp2YjAxd1FXYxAB
120,202751,ChIJOxKB9SeTA2ARNzHv9O8lFu4,5,YKH,2026-03-31T13:57:29.986Z,"先日成婚退会しました。活動を開始してから、約半年で退会に至りました。
その間、カウンセラーさんからは、交際に至るまでの助言や、交際後の関係性の築いていく上で大切なことなど、多くのことを親身になって、相談に乗ってくださいました。
もし婚活に悩んでいる方がいらっしゃれば、相談してみると良いと思います。
悩んでいる間に時間を浪費してしまい、勿体無いです！",,Ci9DQUlRQUNvZENodHljRjlvT25wdU9HMUpZbTVaVUZoRGJIRXliakZFUTFGR05uYxAB
121,202751,ChIJOxKB9SeTA2ARNzHv9O8lFu4,5,水谷朋美,2026-03-16T09:11:25.232Z,"3年前にいいともさんでお世話になり成婚することができました。
活動中はカウンセラーさんの返信に返せなかったり迷惑をかけてしまったこともありましたが、根気強く付き合って色々なアドバイスをしてくれました。
特に真剣交際に入ってからは陥りがちなトラブルを予期して私に色々なことを教えてちゃんと成婚までの道をつくってくれました。
お陰で今も幸せな日々を暮らせています。
婚活に思い悩んだ方はぜひ相談してほしいです。",,Ci9DQUlRQUNvZENodHljRjlvT2pkRmVuUkZZbDlEZUZaMlRGcFBhMHM1VW5GVGFWRRAB
122,202751,ChIJOxKB9SeTA2ARNzHv9O8lFu4,5,K O,2026-02-28T04:18:05.891Z,"昨年いいともさんにお世話になり成婚することができました。
婚活に◯年かかってしまいましたが、諦めなくて良かったと思いました。
カウンセラーさんとは婚活の話だけではなくそれ以外の話もできたのが楽しかったのでやってこれました。
一度相談するのをオススメしたい相談所です。",,Ci9DQUlRQUNvZENodHljRjlvT25JekxWSkdXa290ZDNSMFJIQjNlbGczZDA5YVFrRRAB
123,201952,ChIJF1fILMF_GGAR9u98Manwk5k,5,臼井久美子,2026-03-22T04:38:29.529Z,,,Ci9DQUlRQUNvZENodHljRjlvT2xsVFExb3phVVZvYzBRMlgwbElSSGxEVGpoVU5tYxAB
124,201952,ChIJF1fILMF_GGAR9u98Manwk5k,5,Yuta Oonishi,2026-03-10T10:39:41.300Z,"以前、結婚相談所リボンスクウェア千葉で
貴嶋美知子さんに婚活のご相談をさせていただいたことがあります。

とても穏やかで話しやすい方で、こちらの話を丁寧に聞きながら親身にアドバイスをしてくださるのが印象的でした。婚活の考え方だけでなく、服装や髪型など第一印象に関わる部分についても具体的にアドバイスをいただき、自分では気づかなかった点に気づくことができました。

押し付けるような指導ではなく、一人ひとりの状況や気持ちを大切にしながらサポートしてくださるので、安心して相談できる方だと感じました。

千葉で婚活や結婚相談所を探している方にとって、落ち着いて相談できる信頼感のある相談所だと思います。婚活について悩んでいる方には、一度相談してみる価値があると感じました。

私自身、実際にご相談させていただいた経験から、誠実に向き合ってくださる信頼できるカウンセラーの方だと感じています。",,Ci9DQUlRQUNvZENodHljRjlvT201R2N6Y3hZMjQyZUdGcFFUbHVWSHBNVERCeVRtYxAB
125,201952,ChIJF1fILMF_GGAR9u98Manwk5k,1,ちひろ白井,2026-02-22T07:08:46.764Z,"運営者が横柄かつ高慢で、
怪しげな品物等を売りつけようとしてくる。
利用者がほとんどいないにも関わらず、下手な芝居や虚偽の発言もする。

運営者が個人情報を共通の知り合い等に漏らす。最悪の婚活業者だと思う。

問い合わせすらしないほうが良いでしょう。",,Ci9DQUlRQUNvZENodHljRjlvT25Obk1rbG9ZMDFwWmpKeVRVZEhNWE5MWlhKMFJWRRAB
126,201965,ChIJn6mugSIoil8RUo7jj28TaXI,1,しおいぬ社長,2026-02-24T10:16:03.401Z,"1.5年程在籍。とても割高なマッチングアプリでしかなかったです。アプリの操作性だけで見るとマチアプよりも悪い。担当者からのサポートもほぼありません。オススメしません。

有名な婚活インストラクターが言っている言葉ですが、「結婚相談所は自由恋愛であぶれた弱い男性と女性を、お尻を叩いてなんとかマッチングさせる場所」なので、しっかりとお尻を叩いて危機意識を持たせてくれつつサポートをしてくれるところを選んだほうがよいと思います。この相談所はそういった場所ではありませんでした。",,Ci9DQUlRQUNvZENodHljRjlvT2xaWlRqQllkSFJTZFRGRVRtWlJkV2t4TVVwTVkzYxAB
127,203294,ChIJGRLFrjOQ918RkcO1eE_W87o,5,藤井静,2026-02-16T08:05:34.590Z,"婚活を全面的にサポートしていただき、無事に成婚退会を迎えることができました。

年齢や地域などの条件を絞ってお相手を検索することができるので、自分に合うひとを見つけやすいと思います。

個人的には上手くいかない時期があっても、気軽に相談に乗っていただけたことがとてもうれしいです。

もし結婚相談所への加入を考えている方がいれば、こちらの仲人協会さんをおすすめします。",,Ci9DQUlRQUNvZENodHljRjlvT2w5aE1uRkZZVnBSTldKVE5HaEhlbTUzTjNwNVQwRRAB
128,201761,ChIJpznUZ6E0-F8R7n2607h9NiA,4,愛姫日夜,2026-04-09T00:09:45.734Z,母親に勧められて入会しました。最初は不安でしたが、何回もお見合いするにつれありのままの自分を出せました。2年半婚活してやっと成婚しました。アドバイザーさんのお陰です。諦めないで進めば出会えます。,,Ci9DQUlRQUNvZENodHljRjlvT2xWdldYUlpWRlpaYkhsdFN6QnROR2s1YkZOaFpsRRAB
129,201761,ChIJpznUZ6E0-F8R7n2607h9NiA,4,みみ,2026-03-05T21:42:28.057Z,"こちらに入会して成婚退会しました。
カウンセラーさんの人柄は、皆様たいへん素晴らしいです！
結婚相談所は、すべて受け身でことが進むイメージをしていましたが、自分でも努力が必要でした。婚活迷子になったら、早めの段階で無料相談することをおすすめします。",,Ci9DQUlRQUNvZENodHljRjlvT2psclVVcEViVFJpTW1WaFIxcE9aMFZsVERWVldWRRAB
130,201761,ChIJpznUZ6E0-F8R7n2607h9NiA,5,n.,2026-03-04T12:52:13.314Z,少し不安もありましたが、とても良い経験になりました♪困ったときはカウセラーさんになんでも相談きいちゃえばいいと思うと心強いですね‼︎数ヶ月でしたが良い出会いがありました‼︎お世話になりました！,,Ci9DQUlRQUNvZENodHljRjlvT25GVE9ISldkR3BLV1Zwd1NVSmpVMTlmVVVzMlkyYxAB
131,201761,ChIJpznUZ6E0-F8R7n2607h9NiA,5,T U,2026-03-02T09:41:48.892Z,入会から1年経たずに成婚できました！,,Ci9DQUlRQUNvZENodHljRjlvT25wbFZIQlhRbHAzVUhZM1UwOVRMWFJ0YWxaSlduYxAB
132,201761,ChIJpznUZ6E0-F8R7n2607h9NiA,5,ちょこちょこ,2026-02-26T10:35:25.097Z,"結婚相談所に入るのは正直勇気がいりますが、思い切って一歩踏み出してよかったと感じています。最初は緊張もありましたが、スタッフの方が丁寧に話を聞いてくれて、安心して活動を始められました。大変心強かったです。
迷っている時間が長いほど、出会いのチャンスも先延ばしになると思います。本気で結婚を考えているなら、まずは話を聞いてみるだけでも価値はあると思います。",,Ci9DQUlRQUNvZENodHljRjlvT2t4Vk1IZDVUR1prYUdReFkxUmhVM3BUWVhsUU9XYxAB
133,201297,ChIJT2EE0GIN3y4R0YByrdNxmjc,5,山田幸一,2026-04-11T08:05:26.033Z,"YouTubeで紹介動画を見て、こちらの結婚相談所に入会しました。活動を始めてから1年が経ちましたが、担当カウンセラーとの連絡が非常にスムーズで、定期的な面談で安心して活動を続けられました。

大変な決断の際も、親身になってサポートしてくれたので、一人では乗り越えられない壁も共に超えることができました。最後には無事に成婚退会でき、とても満足しています。

広島の結婚相談所をお探しの方には、心からお勧めしたいです。サポート体制と雰囲気が素晴らしい場所です。ぜひ一度相談してみてください。",,Ci9DQUlRQUNvZENodHljRjlvT2sxNmJYQjFUMGR2VnkxVmFYQlFMWFZPVXpkRlJrRRAB
134,201297,ChIJT2EE0GIN3y4R0YByrdNxmjc,5,伊藤拓哉,2026-03-23T10:40:38.089Z,"YouTubeを見てこのサービスに興味を持ち、入会しました。活動中は、とても親しみやすい雰囲気で、不安な時もしっかり支えてくれるし、辛い決断も乗り越えられました。

こちらの結婚相談所では、定期的な面談やお見合い前のサポートが非常に心強かったです。また、活動方針が明確で、戸惑うことなく進められました。

7ヶ月以上の活動を通じて、無事に成婚退会することができ、本当に感謝しています。サポートしてくださったカウンセラーの方には心から感謝しています。",,Ci9DQUlRQUNvZENodHljRjlvT2xneWMya3RWa2hsZFcxS1VEaEtRek5zUmxCUmVXYxAB
135,201297,ChIJT2EE0GIN3y4R0YByrdNxmjc,5,よる,2026-03-22T12:38:46.519Z,"活動を始めてから4〜6か月が経ちました。私は広島の結婚相談所で充実したサポートを受け、心強いお見合いやデート前の準備ができました。マニュアルや資料も非常に役立ち、特に担当カウンセラーとのスムーズな連絡が大きな助けとなりました。

不安な時には、しっかりとした支えがあり、前向きに活動を進めることができました。自分のペースに合わせたサポートのおかげで、辛い決断も一緒に乗り越えることができました。この環境が成婚退会へのモチベーションを高めています。

YouTubeを通じて入会したこの経験は大変満足のいくもので、これからも成婚退会を目指して頑張りたいと思います。広島で結婚相談所をお探しの方には、ぜひお勧めします。",,Ci9DQUlRQUNvZENodHljRjlvT2taalVFSmhibHBzZVdZeVFqaE9jMGROYVRaV1dtYxAB
136,201297,ChIJT2EE0GIN3y4R0YByrdNxmjc,5,T S,2026-03-20T22:59:59.153Z,"今まで結婚相談所へいくつか複数加入してきましたが、最終的にプレシアへ出会えて本当に良かったです。担当の方のサポートが素晴らしく、常に安心して活動を続けることができました。面談が定期的にあり、不安な時にも支えてくれる環境が整っていて本当に良かったです。

活動開始から約6カ月程度で成婚退会することができるとは思ってもいませんでした。自分のペースに合わせたサポートが、前向きに取り組む力をくれたと思っています。特に担当者の西村様には心から感謝しています。

結婚相談所において、ここまで真摯にサポートしていただけたこと、本当にありがたかったです。",,Ci9DQUlRQUNvZENodHljRjlvT2xWblNVTlJVMll5ZVdwUE5WQjVhWGROYlVVMFlrRRAB
137,201297,ChIJT2EE0GIN3y4R0YByrdNxmjc,5,まるもとたけお,2026-03-16T12:27:21.463Z,"プレシアさんでの活動は、本当に満足のいくものでした。最初はYouTubeで興味を持ちましたが、思い切って入会してよかったです。活動中は不安な時も支えられ、前向きに進むことができました。カウンセラーとの連絡はスムーズで、資料も非常に役立ちました。

特にお見合いやデート前のサポートが心強く、定期的な面談が安心感を与えてくれました。活動を始めてから4〜6か月と短期間で成婚退会できたのも、この手厚いサポートのおかげです。人生の大切な場面で最高の伴走者を得ることができ、本当に良かったと思います。

プレシアさんを選んで、広島の結婚相談所として非常に満足しています。これからも多くの方にこの素晴らしいサポートを広めて欲しいです。",,Ci9DQUlRQUNvZENodHljRjlvT2xFeFZFRmtaa3R5ZDNOVGIybEhaa2Q2T0U1dldVRRAB
